Article,Recommendation,News,Recommended_News
Article_65,Article_502,Senate Passes Internet Sales Tax; Bill Moves to House,Book Review: The Constant Contact Guide to Email Marketing
Article_76,Article_892,Artsy Central Shows Trend Toward Etsy Alternatives,Targeted Cyber Attacks Against Small Biz: Chat Recap
Article_104,Article_817,Email Erases 9 to 5 at Many Small to Mid-Sized Businesses,Will You Jump at the Chance? BlackBerry Leap Pre-orders Begin
Article_108,Article_611,Do You Trust Your Employees to Work Remotely?,Yahoo Buys 30 Percent Stake In Indian Phone Directory Service Ezee
Article_122,Article_664,How to Balance Engagement and Customer Service on Twitter,Vertical Response Acquires Social Media Platform Roost
Article_137,Article_409,Twitter Officially Launches Mobile Ads Manager,Dig Into The Strategy Book
Article_152,Article_900,President Obama Angers Small Booksellers With Amazon Speech,"Exceed Your Indiegogo Goals by 1,000 Percent with These Lessons"
Article_226,Article_348,How Venture Capital Deals Have Changed Since the Great Recession,What you need to know on Wall Street right now
Article_276,Article_802,60 Percent of Online Traffic Now Comes From Mobile,Are You Blogging for Your Small Business?
Article_282,Article_883,How to Create a LinkedIn Profile That Rocks At Generating Leads,HTC Announces UH OH Protection for When an Oopsie Occurs
Article_291,Article_30,Top Jobs Of The Week In Digital Media And Mobile Content,You Made It Yourself: Now What? 29 Places to Sell Your Handmade Creations
Article_332,Article_863,Pinterest Contemplates Sponsored Pins,Batchbook and HootSuite Integration: View Social Media Activity and Customer Contacts Together
Article_340,Article_292,"This Hyderabad-based startup aims to aggregate cabs, food and mobile recharge apps",First Smartphone Anti-Theft Law Could Also Make Reselling Phones Hard
Article_352,Article_862,Got a Sony Laptop? See If Your Batteries Could Be a Hazard,Crowdfunders: PayPal Will No Longer Freeze Your Funds
Article_369,Article_657,Here comes industrial production ...,MYQROsites Offers New App for Mobile Marketing With QR Codes
Article_370,Article_613,How to Form an LLC or Incorporate a Business,10 Mindsets of Successful Entrepreneurs
Article_393,Article_163,STOCKS SLIP: Here's what you need to know,The yen is surging
Article_479,Article_728,Survey: Businesses Benefit from Social Media Savvy,Google Knocks $100 Off Nexus 4
Article_481,Article_205,9 appearance mistakes that could be holding you back at work,HP Pavilion Mini and Stream Mini Introduced
Article_494,Article_362,US Fed keeps interest rates unchanged,Gross Fixed Capital Formation Weak at Non-Corporate Businesses
Article_503,Article_453,Failing to deliver a 39-point list for school education cost Smriti Irani her job,BSE: Top gainers and losers
Article_509,Article_526,Six Apart finds a pot full of VC Dollars,"Buy  BEML, target Rs  1000  :   Kunal Bothra"
Article_539,Article_126,"CBS MarketWatch.com: Director of Ad Development, NYC",Earnings This Week
Article_550,Article_135,Read Adaptability and Learn to Thrive in Any Environment,Here comes the Beige Book ...
Article_581,Article_620,Celebrating National Business Etiquette Week,"Federal Gas Tax Could Increase by 15 Cents, More Costs Possible"
Article_590,Article_260,New Amazon Kindles Will Be More Like Tablets,WitKit Platform Lets Your Team Collaborate in Security
Article_603,Article_655,Stop Collecting And Start Engaging With Your Twitter Followers,The State of Social Media
Article_622,Article_212,How to Get Your Company Back in Good Standing This Summer,25 of the Best Cities for Freelancers to Work and Play
Article_678,Article_913,A Beer Keurig Machine? SYNEK Draft System is on its Way,Spotlight: Helena Tubridy Uses Hypnotherapy to Treat Infertility
Article_679,Article_517,7 Ways to Get More From Social Media in 2010,eBay Opposes Legislation Imposing New Taxes and Regulatory Burdens on Small Businesses
Article_692,Article_866,A Quick Guide to What You Should Be Doing NOW for the Affordable Care Act,15 Power Foods To Boost Your Business
Article_708,Article_83,Google Acquires Flutter And Its Gesture Technology,How Does Social Media Aid Lead Generation?
Article_711,Article_520,How my first startup ended in a loss of Rs 15 lakh and shut down in a year,Government Resources to Help Market Your Business Overseas
Article_787,Article_235,Twitter Attack Caused Thousands to Retweet a Single Message,How to Use The Linkedin Mentions Feature to Engage and Connect
Article_823,Article_657,5 Ways Business Intelligence and Online Marketing Can Work Together,MYQROsites Offers New App for Mobile Marketing With QR Codes
Article_831,Article_948,The Terms of Business: How to Negotiate a Partnership Agreement,"Marijuana Businesses Offer Opportunities, But Also Risks"
Article_835,Article_997,Here comes consumer confidence ...,Ten interesting things we read last week
Article_839,Article_565,Are Immigrants Really More Likely to Become High Tech Entrepreneurs?,Accenture launches fifth season of InnovationJockeys
Article_881,Article_185,Chrome Cracks Down on Extensions for Adding Unwanted Adware,LotusJump Review: Do-It-Yourself Online Marketing Service
Article_884,Article_882,"Yes, Some Small Businesses Have Social Media Budgets over $100,000",Business By Miles: Automate Your Business All in a Single System
Article_911,Article_235,13 Creative Ways to Use LinkedIn for Lead Generation,How to Use The Linkedin Mentions Feature to Engage and Connect
Article_920,Article_804,5 Tips to Improve Your Marketing Mix,The Referral Engine: Teaching Your Business to Market Itself
Article_925,Article_71,Tweeter in Chief: Obama Twitter Account Gets Heavy Engagement,How Cloud Computing Can Help You Scale Your Business
Article_930,Article_397,"Meet the Core Team of EXIMIUS, The Hottest Student-led Entrepreneurship
Summit going on in India right now",Finding Success Empowering Lifestyle Entrepreneurs
Article_939,Article_202,Idea Cellular posts 74 percent drop in first quarter profit,"The curious story of Dadi Balsara, the Parsi billionaire who stayed
at Taj Mansingh Hotel for 36 years"
Article_941,Article_769,"Anthony Smith of Insightly: How to Attract 20,000 Users in 3 Months",Be.Lead.Do Provides Online Resource for Business Managers
Article_961,Article_439,Connie Certusi of Sage: Our Goal is to Automate Small Business Tasks,Review: Samsung Chromebook for Your Small Business
Article_967,Article_641,Court Defends the Anonymity of Yelp Reviewers,"Fraudulent DMCA Takedown Requests: Finally, a Lid on Them?"
Article_971,Article_995,Read Digital Dollar to Get Your Online Strategy in Gear,5 Ways to Run Effective Facebook Ads at Different Stages
Article_987,Article_376,Who Should You Follow on Twitter?,PayPal Will Change User Agreement After Robocall Concerns
