Article,Recommendation
15 meeting etiquette rules every professional needs to know,"[(0.95, 'Top Jobs Of The Week In Digital Media'), (0.95, ""STOCKS FALL: Here's what you need to know""), (0.95, 'Lenovo A7000 Phablet Offers Super Sound and Little Interference'), (0.95, 'How to Use Criminal Background Checks and Not Get Sued'), (0.9, 'Tips for Tracking Employee Time Effectively in Your Business')]"
Focused Leadership Teaches Leadership Lessons That Can Make Your Day,"[(1.0, '5 Surprising Mobile Search Statistics and Facts'), (0.97, 'Sleeping With Your Smartphone Makes Productivity and Life Balance Possible'), (0.96, 'The Age of the Platform Will Make You Think'), (0.95, 'Are You Being Too Nice for Your Own Good?'), (0.93, 'Celebrating National Business Etiquette Week')]"
Call+ Offers Free Landline Calls To 16 Countries,"[(1.0, 'Has Your Site Been Pandalized by Google?'), (0.93, 'Windows 8.1 For Free? A Version May Be In The Works'), (0.93, 'Spring Clean Your Small Business, Twitter Chat Recap'), (0.93, 'Small Business Job Growth Dips in January'), (0.93, 'SMB Owners Can Respond to Google Place Reviews')]"
These were the 10 biggest European tech stories thisweek,"[(1.0, 'This Startup is Using Salt to Create an Alternative to Nuclear Energy'), (0.95, 'Working at TaxiForSure is fun for sure [Fabulous Workplaces]'), (0.95, 'Volvo is quietly becoming a tech superpower'), (0.93, 'JotForm Now Offers Adobe eSign Service'), (0.93, 'Bill Gates, Warren Buffett And Oprah All Use The 5-Hour Rule')]"
22 Ways to Renew Your Spirit and Get Your Mojo Back,"[(0.95, 'Amazon Innovates With New Tablets and e-Readers'), (0.83, 'Yahoo Buys 30 Percent Stake In Indian Phone Directory Service Ezee'), (0.83, 'Meet Byju, whos changing the way India learns'), (0.83, 'LinkedIn Gets Rid of Products and Services Tab on Company Pages'), (0.82, 'A 101 Guide To Building Your Personal Brand')]"
The Blink Factor: Time Management Can Build or Break Your Business,"[(1.0, 'Marketing With Vine: Leveraging the Power of 6-Second Videos'), (1.0, '6 Actually-Useful Facebook Apps For SMBs'), (0.98, 'You Can Use LinkedIn As a Landing Page and Facebook For Blogging'), (0.97, 'Who Should You Follow on Twitter?'), (0.97, 'PayPal Will Change User Agreement After Robocall Concerns')]"
What Makes You Stand Out When Job Hunting?,"[(0.96, 'Microsoft Ponders Free Windows Phone Licensing'), (0.94, 'Briggo Will Change Your Morning Coffee'), (0.94, 'Apple Pays $200 Million for Topsy'), (0.92, 'Your End of Year Legal Checklist'), (0.92, 'Med-tech providing sustainable solutions for healthcare')]"
7 Steps to Writing A Great Blog Post,"[(1.0, '27 Percent of Mobile Sites Are Misconfigured Leading to Lower Traffic'), (0.97, 'New Dell Tablet Features 3D Camera'), (0.97, 'Jonathan Davids of Influicity: Engaging YouTube Stars to Connect with Prospects'), (0.94, 'Web.com Moves Into Mobile Marketing With SmartCalls'), (0.94, 'Dell Has A New Tablet, iCloud Prices Drop')]"
Success Story of an Indian College Drop Out,"[(0.9, 'Mix360 Headset Promises Hi-Fi Experience From Your Smartphone'), (0.88, 'Sustainable Startups Using Technology to Make Use of Food Waste'), (0.88, 'Health, tech stocks power S&P, Nasdaq to record highs'), (0.87, 'These 19 companies are racing to put driverless cars on the road by 2020'), (0.87, 'How To Train Your Team And Make It Connect')]"
"Week In Review: Small Business Saturday, Twitter Experiments and More","[(1.0, 'Yelp Will Allow Businesses to Sell Food, Other Services'), (1.0, 'Chekkt: A Place To Discover Business Management Software'), (1.0, '5 Internet Marketing Trends for SMBs to Watch in 2012'), (1.0, '5 Benefits of Having a Website for Your Small Business'), (0.96, 'How to Create a Mobile Office for Your Small Business')]"
A Beer Keurig Machine? SYNEK Draft System is on its Way,"[(0.98, 'Spotlight: Helena Tubridy Uses Hypnotherapy to Treat Infertility'), (0.97, 'Protecting Small Business Intellectual Property'), (0.97, '3 Questions for You to Ask Yourself About Employee Health Care'), (0.94, 'WordStream Improves Its Free AdWords Benchmark Tool For Small Business Advertisers'), (0.94, 'Ohio Weighing Major Tax Break For Small Businesses')]"
7 Ways to Get More From Social Media in 2010,"[(1.01, 'eBay Opposes Legislation Imposing New Taxes and Regulatory Burdens on Small Businesses'), (1.0, 'ZenPayroll Could Change the Way You Pay'), (1.0, 'Microsoft Temporarily Cuts the Price on the Surface 2'), (0.97, 'Working On Your Business Not In It'), (0.97, 'Small Business Groups Offer Mixed Reaction to Obama Budget')]"
Spotlight: This Service Brings Product Photography into Focus,"[(1.0, '10 Tips For Organizing Your Small Business This Year'), (0.97, 'Windows 8.1 For Free? A Version May Be In The Works'), (0.96, 'The Age of the Platform Will Make You Think'), (0.96, 'Small Business Loan Approval Drops to 18.8 Percent at Big Banks'), (0.96, 'New Shopping Habits: When Your Clients Go Mobile')]"
Google Improves AdWords Express Program,"[(0.96, 'How to Create a Mobile Office for Your Small Business'), (0.95, 'What New Opportunities Does Android Wear Offer for Entrepreneurs?'), (0.95, 'Getting Your Business Energy Efficient Before the Holidays'), (0.93, 'Is It Time to Change Your Business Structure?'), (0.91, 'Yelp Will Allow Businesses to Sell Food, Other Services')]"
A Look at Franchises Specializing In Security,"[(0.96, 'Twitter Ads API Gives You More Advertising Options'), (0.96, 'Small Business Optimism: Status Quo or Cautious Optimism?'), (0.96, 'Most Common SMO Strategies Not The Most Effective'), (0.96, 'Getting Your Small Business Ready for the Holidays'), (0.96, 'Big News: Quickbooks Competitor Intacct Targets the SMB Market')]"
USPS Cuts Saturday Mail Delivery But Will Continue Package Delivery,"[(0.97, 'Introduction To Franchising'), (0.94, 'Small Businesses Spend 20 Hours Per Week on Marketing'), (0.94, 'Our Top Story This Week: A New SBA Administrator is Approved'), (0.94, 'Google Gets Heavy-Handed In Local Search'), (0.94, 'Direct Marketing and Other Small Business Wonders')]"
Birth to re-birth: The man who made Savita Bhabhi,"[(1.0, 'Finding Money for That Franchise When Money is Tight'), (0.95, 'Top 4 Health Insurance Trends for Small Businesses'), (0.95, 'Successful S-Corp Owners: Watch Out For A Tax Increase'), (0.92, 'North Korea Missile Launches, Nuclear Detonations: Timeline'), (0.92, 'How to Form an LLC or Incorporate a Business')]"
"Glip Enters Crowded Collaboration Space, Creates Conversation Streams","[(1.01, 'Profit Sharing Surprise: Lenovo CEO Shares Bonus with Employees'), (0.98, 'Twitter Accidentally Sends Out Thousands of Reset Notices'), (0.98, 'New LG Smartphone Added to the G3 Line Has a Stylus Pen'), (0.95, 'What New Opportunities Does Android Wear Offer for Entrepreneurs?'), (0.95, 'Targeted Cyber Attacks Against Small Biz: Chat Recap')]"
"[Techie Tuesdays] A tribute to Humblefool, the best coder that ever lived in India","[(0.98, 'iPad Losing to More Affordable Tablets'), (0.89, 'A 101 Guide To Building Your Personal Brand'), (0.87, 'Homeless Man Learns Coding, Launches App'), (0.84, 'Is It Time to Change Your Business Structure?'), (0.82, 'How Cloud Computing Can Help You Scale Your Business')]"
"Microsoft Drops Price of Surface Pro Tablets, Too","[(1.0, 'SoundCloud Introduces Program to Share Revenue with Artists'), (1.0, 'Purchase by Commenting on Instagram with Spreesy'), (1.0, 'How the Cloud is Reshaping Small Business Productivity'), (1.0, 'A Quick Guide to Local Search to Ease Any Confusion'), (0.97, 'The Creative Small Business and 4 Ways to Get There')]"
Read iPhone Millionaire to Create Professional Looking Videos,"[(1.0, 'Google Updates Listings, Crowdfunding Campaigns Extended'), (0.96, 'Survey: 11 Percent of UK Workers Want Flexible Hours'), (0.94, 'Twitter Chat: Is Your Brand Helping Or Hurting Your Business?'), (0.94, 'Receive Custom Social Content for Your Small Business With Emphatic'), (0.94, '4 Things To Consider When Writing Site Content')]"
Customer Asked to Leave Local Business Over Google Glass Policy,"[(0.94, ""AdPushup, a tech startup backed by Microsoft Accelarator just raised Series A funding from Japan's Geniee, Inc""), (0.91, 'Local Marketing and the Google Pigeon Update'), (0.89, 'Internet Explorer Remains Dominant Browser'), (0.86, 'Briggo Will Change Your Morning Coffee'), (0.82, 'Med-tech providing sustainable solutions for healthcare')]"
Windows 8.1 For Free? A Version May Be In The Works,"[(0.97, 'Spotlight: This Service Brings Product Photography into Focus'), (0.97, 'Is the S Corp Right for Your Small Business?'), (0.97, 'How To Get Everything You Promised Done'), (0.97, '10 Tips For Organizing Your Small Business This Year'), (0.94, 'Is Google Wallet Geared Toward Small Biz?')]"
Spreecast: One on One Video Chats Right in Your Web Browser,"[(0.97, 'Ebay Adds Same Day Delivery In Dallas'), (0.96, 'S-Corp Audit Rates Inch Down, But Most Targeted Are Compliant'), (0.96, 'An Update on the Greater Opportunities for Small Business Act'), (0.94, 'Working On Your Business Not In It'), (0.94, 'Small Business Groups Offer Mixed Reaction to Obama Budget')]"
A Quick Guide to What You Should Be Doing NOW for the Affordable Care Act,"[(0.94, 'A Beer Keurig Machine? SYNEK Draft System is on its Way'), (0.94, '15 Power Foods To Boost Your Business'), (0.92, 'Facebook Wants Your Businesses On Messenger'), (0.89, '3 Questions for You to Ask Yourself About Employee Health Care'), (0.88, 'Protecting Small Business Intellectual Property')]"
New Study Helps SMB Owner Analyze Local Search Data,"[(1.0, 'Hacking of Google Maps May Have Killed This Business'), (0.98, 'Pinterest Marketing Tool Discover Can Give Better View of Your Brand'), (0.97, 'What is a Hashtag? And What Do You Do With Hashtags?'), (0.97, 'Black Business Secrets Offers Tips to a New Generation of African American Entrepreneurs'), (0.95, 'Manta Business Directory Upgrades to Help You Get Discovered')]"
Time and Expense Tracking Apps: 27 Solutions,"[(1.0, 'Be.Lead.Do Provides Online Resource for Business Managers'), (1.0, 'Anthony Smith of Insightly: How to Attract 20,000 Users in 3 Months'), (0.96, 'Facebook Wants Your Businesses On Messenger'), (0.96, 'Facebook Testing New Shareable Ads'), (0.96, 'Buffer Hack Spams Social Media Followers')]"
New Acer Chromebook Introduced with Focus on Mobility,"[(0.92, 'Q2 Earnings Announcements This Week'), (0.92, 'Podio Launches Video Conference App'), (0.89, 'Business Fills Same Niche for Over 100 Years'), (0.84, 'Evernote Business: Know What Your Team Knows'), (0.83, 'Yahoo Buys 30 Percent Stake In Indian Phone Directory Service Ezee')]"
1001 Startup Ideas - Place for connecting students to micro-jobs,"[(1.01, 'TheStreet.com: Marketing Manager, NYC'), (1.0, 'Jonathan Davids of Influicity: Engaging YouTube Stars to Connect with Prospects'), (0.96, 'Here come personal income and spending ...'), (0.96, 'Dell Has A New Tablet, iCloud Prices Drop'), (0.96, '10 Food Franchise Technology Tools And Solutions')]"
LinkedIn Rolls Out New Features For Marketers,"[(1.01, 'Pinterest Beta Tests Do-It-Yourself Promoted Pins for Business'), (1.01, 'Getting Comfortable With Self-Promotion'), (0.97, 'One on One: Michael Wu of Lithium Technologies'), (0.97, 'Introducing the ASUS ZenFone 2, No Contract Required'), (0.96, 'Verizon Plans to Acquire Content Delivery Network EdgeCast')]"
What You Need to Know About the Sequester,"[(1.0, 'HP Did Better Than The Market on PC Sales, But Mum About Mobile'), (0.97, 'Give Quantitative, Monetary Values to Employee Benefits or Risk Attrition'), (0.97, '11 things to do in your 20s to become a millionaire by 30'), (0.94, 'Why Small Businesses Have Trouble Getting Credit'), (0.94, 'When I had no food and only Rs 50 in my pocket  a moving story of an entrepreneur')]"
Survey: 11 Percent of UK Workers Want Flexible Hours,"[(0.97, 'The Small Business Guide to Getting Ready for Vacation'), (0.97, 'Payvment Lets SMBs Attract Fans With Coupons'), (0.96, 'Read iPhone Millionaire to Create Professional Looking Videos'), (0.96, 'Mid-Year Business Review: Risk Management Edition'), (0.96, 'How Much Will the Sequester Cost Small Business Contractors?')]"
Apps to Make Your Blogging Life Easier,"[(1.15, '4 Powerful LinkedIn Tips To Generate Sales'), (1.0, 'Will You Jump at the Chance? BlackBerry Leap Pre-orders Begin'), (1.0, 'Satanic Latte Art? How Should a Business Respond?'), (1.0, 'Email Erases 9 to 5 at Many Small to Mid-Sized Businesses'), (0.95, 'LG Launching G4 Flagship Phone and One for Doodling')]"
Aim to add 2-3 million tonne capacity every year: Shree Cements,"[(1.03, 'Stay At Home Mom Launched $24 Million Franchise in her Living Room'), (0.94, 'Will You Jump at the Chance? BlackBerry Leap Pre-orders Begin'), (0.94, 'Crude palm oil futures remain up on rising demand'), (0.88, 'Curved LG G Flex 2 Phablet a Sequel Improving the Original'), (0.87, '4 Powerful LinkedIn Tips To Generate Sales')]"
"Time Warner takes stake in Hulu, lifts profit forecast","[(0.95, 'Tips for Tracking Employee Time Effectively in Your Business'), (0.83, 'LinkedIn: The Professional Playground For Professional Connections'), (0.82, 'Why Networking in Person Still Matters'), (0.82, 'What to buy, sell and hold'), (0.82, ""STOCKS FALL: Here's what you need to know"")]"
Get Ready: Here Comes Twitter Business Center,"[(1.0, 'Small Banks Continue to Grab Share In Small Biz Loan Market'), (1.0, 'Court Reverses $338,000 Award for User Generated Content'), (0.97, 'Business By Miles: Automate Your Business All in a Single System'), (0.96, 'Yes, Some Small Businesses Have Social Media Budgets over $100,000'), (0.96, 'Read The Other Side of Innovation to Transform Your Revolutionary Ideas')]"
Introduction To Franchising,"[(0.97, 'When and How to Use Autoresponders'), (0.97, 'USPS Cuts Saturday Mail Delivery But Will Continue Package Delivery'), (0.97, 'Types of Franchises And How To Find Them'), (0.93, 'The Sweet Sound of Online Sales: Review of KaChing'), (0.93, 'The Referral Engine: Teaching Your Business to Market Itself')]"
5 Ways To Turn Up the Volume With Twitter,"[(0.92, 'MyOpenID Will Shut Down in February'), (0.91, 'Google Releases Real-Time Reputation Problem'), (0.9, 'eBay Plans a New Mobile Ad Network'), (0.86, 'Sauca Foods:  New Flair for the Food Truck Trend'), (0.85, '13 Creative Ways to Use LinkedIn for Lead Generation')]"
Forget what you heard: Jupiter does not orbit the sun,"[(0.93, 'Why I Linked Out on LinkedIn'), (0.93, 'The Project Champion: A Management Best Practice'), (0.93, 'Read Adaptability and Learn to Thrive in Any Environment'), (0.93, 'Here comes the Beige Book ...'), (0.86, 'Got a Sony Laptop? See If Your Batteries Could Be a Hazard')]"
This Startup is Using Salt to Create an Alternative to Nuclear Energy,"[(1.0, 'These were the 10 biggest European tech stories thisweek'), (0.95, 'Working at TaxiForSure is fun for sure [Fabulous Workplaces]'), (0.94, 'CEO of @PipelinerCRM: Sales is About Process & People Not Data Mgmt'), (0.89, 'North Korea Missile Launches, Nuclear Detonations: Timeline'), (0.88, 'Weighing the Pros and Cons of Free City WiFi')]"
Google Acquires Flutter And Its Gesture Technology,"[(0.97, 'How Does Social Media Aid Lead Generation?'), (0.92, 'These were the 10 biggest European tech stories thisweek'), (0.91, 'Working at TaxiForSure is fun for sure [Fabulous Workplaces]'), (0.88, 'Weighing the Pros and Cons of Free City WiFi'), (0.88, 'This Startup is Using Salt to Create an Alternative to Nuclear Energy')]"
1001 Startup Ideas - Delivery Aggregator in a city,"[(1.01, 'Vertical Response Acquires Social Media Platform Roost'), (1.0, 'Small Businesses Divided on Internet Sales Tax'), (1.0, 'Outsell Yourself: Go From Hello to Sold With Ethical Business and Sales Techniques'), (0.98, 'Book Review: The Constant Contact Guide to Email Marketing'), (0.97, 'Senate Passes Internet Sales Tax; Bill Moves to House')]"
Small Businesses Created 45 Percent of the New Jobs in June,"[(0.98, 'How to Form an LLC or Incorporate a Business'), (0.98, '10 Mindsets of Successful Entrepreneurs'), (0.96, 'Successful S-Corp Owners: Watch Out For A Tax Increase'), (0.93, 'Working at TaxiForSure is fun for sure [Fabulous Workplaces]'), (0.92, 'Exceed Your Indiegogo Goals by 1,000 Percent with These Lessons')]"
How my first startup ended in a loss of Rs 15 lakh and shut down in a year,"[(0.96, 'Government Resources to Help Market Your Business Overseas'), (0.96, '3 Ways to Look at Marketing'), (0.96, '12 Blogs Every Small Business Should Be Reading'), (0.92, 'Spotlight: BlogPaws is a Media Company That Puts Animals First'), (0.92, '6 Benefits of Social Media for Small Businesses')]"
Personal task management startup dunzo raises $650K funding from Blume Ventures and Aspada,"[(0.86, 'Daisy Chittilapilly- Director, Partner Organization, Cisco India and SAARC'), (0.78, 'Join The Crowdfunding Revolution to Start Your Business'), (0.75, 'This couple bought 300 acres of land and created Indias first private wildlife sanctuary'), (0.75, 'Nexus 6 Could Compete with iPhone 6 Plus, Other Phablets'), (0.75, 'Can SMB Owners Make Social Media Useful?')]"
Learn Vital Lessons by Entering The Mind of Elite Entrepreneurs,"[(1.0, 'The 10 things in advertising you need to know today'), (1.0, '85 Percent of Small Businesses Get Customers Through Word of Mouth'), (0.98, 'The State of Social Media'), (0.98, 'Stop Collecting And Start Engaging With Your Twitter Followers'), (0.98, '12 Ways You Can Use LinkedIn for Branding to Stand Out')]"
Does a Rise in Housing Starts Equal Growth in Construction Startups?,"[(1.06, 'Copper futures rise on global cues, spot demand'), (1.0, 'Kid Inventors Come Up With Creative Environmental Solutions'), (1.0, 'Amazon AWS MarketPlace Puts Desktop Apps in the Cloud'), (0.95, 'Robust Employment Growth, Just not for the Self-Employed'), (0.95, 'Review  of Crush It!: Why Now is the Time to Cash in on your Passion')]"
Franchising: The Importance Of Great Systems Within The System,"[(0.94, 'Best Small Business Books'), (0.9, 'LinkedIn Rolls Out New Features For Marketers'), (0.87, 'One on One: Michael Wu of Lithium Technologies'), (0.87, 'Introducing the ASUS ZenFone 2, No Contract Required'), (0.87, 'Famous Bloggers Founder Loses Domain Names')]"
"How to Use Live Streaming for Content Marketing: Meerkat, Periscope, katch.me","[(1.02, 'Manta Business Directory Upgrades to Help You Get Discovered'), (1.02, 'Learn How to Improve Online Marketing: Performance Marketing With Google Analytics'), (1.02, 'Clate Mask of Infusionsoft: $54M Ways Your Small Business Can Benefit'), (1.02, '5 Ways to Run Effective Facebook Ads at Different Stages'), (1.0, 'Small Business News: Small Biz Startup Tips')]"
Top Jobs Of The Week In Digital Media,"[(1.01, 'Small Business Disaster Survival Guide: Get Your Insurance Claims Covered'), (1.01, 'Franchising In The Downturn And Recovery'), (0.95, 'HP Reinventing Traditional Computers With Mini Desktop PC'), (0.95, 'Evernote Coming Out With New App Just for Businesses'), (0.95, '15 meeting etiquette rules every professional needs to know')]"
Small Businesses Spend 20 Hours Per Week on Marketing,"[(1.0, 'Practices of Top SEO Companies for Small Businesses'), (1.0, 'Google Gets Heavy-Handed In Local Search'), (0.97, 'enMarkit Leads in Social Commerce in India'), (0.97, 'Why SMB owners should care about SEO'), (0.97, 'Nokia Introduces Asha Smartphones Beginning at Just $69')]"
Mary Lou Song of Fuel451: Using Ad Tech to Turn Videos into Digital Marketing Campaigns,"[(0.98, 'New Verizon SpeedMatch Program Will Boost Upload Speeds on FIOS'), (0.98, 'Multi-Screen Ecommerce Strategy: Beyond the Single Shopping Screen'), (0.98, 'How to Get More Positive Customer Reviews, Using Get Five Stars'), (0.98, 'Are You Blogging for Your Small Business?'), (0.97, 'The Referral Engine: Teaching Your Business to Market Itself')]"
"Disqus Introduces Sponsored Comments For Publishers, Brands","[(1.01, 'Entrepreneur Creates Winery on the Third Floor of a Warehouse'), (0.96, 'Barbershop Makes Kids Look Like Senior Citizens for Free'), (0.94, 'How to Get Your Products Discovered with Videos'), (0.94, 'Employers Say Wellness Programs Work'), (0.89, 'Gluten-Free Girl Flour Gets Funded With Help From Famous Tweeter')]"
Entrepreneurs Take Us to the Edge of Outer Space,"[(0.93, 'Employers Say Wellness Programs Work'), (0.87, 'Disqus Introduces Sponsored Comments For Publishers, Brands'), (0.86, 'Small Business Disaster Survival Guide: Get Your Insurance Claims Covered'), (0.86, 'Franchising In The Downturn And Recovery'), (0.86, 'Barbershop Makes Kids Look Like Senior Citizens for Free')]"
How Do Your Employee Benefits Stack Up?,"[(0.98, 'Small Businesses Spend More on Travel, Per Concur Survey'), (0.98, '15 Power Foods To Boost Your Business'), (0.95, 'Protecting Small Business Intellectual Property'), (0.93, 'Mobile Coupons Slowly Gain Steam With Users'), (0.92, 'WordStream Improves Its Free AdWords Benchmark Tool For Small Business Advertisers')]"
11 Tips for Using Images on Twitter,"[(0.96, 'What Is HTML5? Do I Need It For My Business Website?'), (0.96, 'Adobe Acquires Fotolia for $800 Million'), (0.95, 'The Kodak Pixpro SP360 Sports a 360 Degree Camera'), (0.95, 'Small Business News: Tips For Your Next Venture'), (0.95, '7 Best Business Books for Summer Reading')]"
10 Online Dangers Your Business Faces,"[(1.0, 'Monitoring Your Social Media Channels From One Place is a Good Idea'), (1.0, 'How to Promote Offline Events On The Web'), (0.97, 'Watch These Metrics to Measure YouTube Marketing Success'), (0.97, 'Twitter Ads Soar, But Beware This AdWords Hack'), (0.97, 'New Google and New Foursquare Offerings Call Attention to Local Business Marketing')]"
Why I Linked Out on LinkedIn,"[(1.0, 'The Project Champion: A Management Best Practice'), (0.93, 'Got a Sony Laptop? See If Your Batteries Could Be a Hazard'), (0.93, 'Forget what you heard: Jupiter does not orbit the sun'), (0.93, 'Crowdfunders: PayPal Will No Longer Freeze Your Funds'), (0.91, 'When to Give Business Gifts and Who to Give Them to')]"
FTC Ruling on Pinterest Contest Increases Urgency Over Disclosures,"[(1.02, 'Manta Business Directory Upgrades to Help You Get Discovered'), (1.02, 'Learn How to Improve Online Marketing: Performance Marketing With Google Analytics'), (1.02, 'Clate Mask of Infusionsoft: $54M Ways Your Small Business Can Benefit'), (1.02, '5 Ways to Run Effective Facebook Ads at Different Stages'), (0.97, 'What is a Hashtag? And What Do You Do With Hashtags?')]"
How to Handle a Public Relations Crisis,"[(0.97, 'Senate Passes Internet Sales Tax; Bill Moves to House'), (0.97, 'How Are Business Books Like Restaurants?'), (0.97, 'Finding Success Empowering Lifestyle Entrepreneurs'), (0.97, 'Book Review: The Constant Contact Guide to Email Marketing'), (0.94, 'Xero Sees 200 Percent Increase in U.S. Customers, Adds New Leadership')]"
Google Knocks $100 Off Nexus 4,"[(0.98, 'eBay Plans a New Mobile Ad Network'), (0.96, 'The ultimate master list of revenue models used by Web and Mobile companies'), (0.93, 'Survey: Businesses Benefit from Social Media Savvy'), (0.92, 'The Rumors Are True, Facebook Gets Hashtags'), (0.9, '10 things successful people never do')]"
This Coffee Shop is Selling More Than Just Coffee,"[(1.0, 'This One Quality Can Make or Break Your Social Media Campaigns'), (0.96, 'Cardamom futures remain up on rising demand'), (0.96, '13 Best Practices for Building Solid Small Business Operations'), (0.94, 'The 20 best smartphones in the world'), (0.94, 'RANKED: The 20 best Nintendo 64 games of all time')]"
How Low Will Online Storage Costs Finally Go?,"[(0.94, ""STOCKS RISE: Here's what you need to know""), (0.92, 'Yahoo Buys 30 Percent Stake In Indian Phone Directory Service Ezee'), (0.92, 'Q2 Earnings Announcements This Week'), (0.87, 'Google Antitrust Case: EU Charges Explained'), (0.86, 'Do You Trust Your Employees to Work Remotely?')]"
The Network Is Your Customer: Combining Strategy and Technology,"[(0.96, 'Yelp Reviews Out of Google Places. What Else Ya Got?'), (0.92, 'Why You Need Honest Feedback and 3 Ways to Get It'), (0.92, 'The story of BPLs amazing comeback, riding the online wave on the shoulders of Flipkart'), (0.9, 'Verizon Trades Two Year Contracts for Monthly Billing'), (0.9, 'The Art of Pricing')]"
10 Twitter Blunders Businesses Should Avoid,"[(0.94, 'WhatsApp Offers Alternative to Paid Texting, Social Sites'), (0.94, 'Top 5 Online Credibility Killers'), (0.88, 'Twitter Attack Caused Thousands to Retweet a Single Message'), (0.88, '13 Creative Ways to Use LinkedIn for Lead Generation'), (0.87, 'Twitter Officially Launches Mobile Ads Manager')]"
What is Branding? And Should Small Businesses Care?,"[(1.01, 'How an MBA grad became a marketplace millionaire by selling umbrellas'), (1.0, 'Yelp Loses Money, But Hits 100 Million Visitors'), (1.0, '9 Holiday Marketing Tips to Make Your Retail Store Stand Out'), (0.96, 'Review: Attention! This Book Will Make You Money'), (0.96, 'Mobile Payments are Exploding: What You Need to Know as a Retailer')]"
Business Fills Same Niche for Over 100 Years,"[(0.89, 'New Acer Chromebook Introduced with Focus on Mobility'), (0.85, 'Google Antitrust Case: EU Charges Explained'), (0.82, 'Q2 Earnings Announcements This Week'), (0.8, 'How Low Will Online Storage Costs Finally Go?'), (0.76, 'Yahoo Will Free Up Inactive IDs, Possibly Including Yours')]"
Fox Mobile/Jamba CEO Lucy Hood Resigns; European Focus Going Forward,"[(1.01, 'How to Create a Facebook Page for Your New Business'), (0.91, 'Reed Business Information: Online Sales Manager, LA'), (0.89, 'Top Reasons to Incorporate Your Business'), (0.81, 'Sony Unveils Xperia Z3 Flagship Phone'), (0.8, 'Malicious Apps On Google Play Increase By 388 Percent')]"
