,title,most_similar_1,most_similar_2,most_similar_3,most_similar_4,most_similar_5,most_similar_6,most_similar_7,most_similar_8,most_similar_9,most_similar_10
0,How 2 of the world's most powerful and dangerous drug lords compare,Finding Success Empowering Lifestyle Entrepreneurs (1.01),10 things you need to know in markets today (1.00),FCC Decision on Net Neutrality Coming Soon (1.00),Here come retail sales ... (1.00),The Daily Sprout (1.00),Cardamom futures remain up on rising demand (1.00),"Up close & personal: How Sunny Leone handles stocks, land, gold, other assets (1.00)",Here come personal income and spending ... (1.00),Earnings This Week (1.00),Here comes the Baker Hughes rig count ... (1.00)
1,"Fortune 500 Thrives, But Small Businesses Not So Optimistic",Is It Time to Change Your Business Structure? (1.00),Protecting Small Business Intellectual Property (1.00),Peer-to-Peer Lending Club Fine-Tunes Small Business Loan Program (1.00),Getting Your Business Energy Efficient Before the Holidays (1.00),Reward your Small Business with the Capital One Spark (1.00),Remote Work No Longer a Perk But a Business Imperative (1.00),Study Finds Small Business Loans Key to Startup Success (1.00),"Small Businesses Spend More on Travel, Per Concur Survey (1.00)",Cyber Liability Insurance: Protect Your Business Online (1.00),Why Small Businesses Have Trouble Getting Credit (1.00)
2,Google Acquisition of Motorola Finally Closes: Why You Should Care,"Bright Light Helps Market Products, But Makes Decisions More Emotional (1.01)",Enterprise Cloud Services Retooled as Google for Work (1.01),Customer Relations Blunder? Google Causes Stir Over Easter Doodle (1.01),Headlining the News This Week: Wix Acquires OpenRest (1.01),WixMusic Lets Musicians Set the Tempo for Their Brand (1.01),Local and Ecommerce Merchants Pick Up On Facekini Trend (1.01),"Jupitermedia: Media Analyst, NYC (1.00)",This New Online Tool Creates a Picture of Your Cash Flow (1.00),Video Ad Service TubeMogul Hopes to Raise $93.4 Million with IPO (1.00),The Project Champion: A Management Best Practice (1.00)
3,Finding Money for That Franchise When Money is Tight,Do You Trust Your Employees to Work Remotely? (1.01),How to Get a Startup Visa Act Passed (1.00),Angel Investments Since the Economic Downturn (1.00),Plastic Preferred: Cash To Decline to Just 23% of Purchases (1.00),Pricing pressure in US biz cyclical in nature: Cadila Health (1.00),Franchising In The Downturn And Recovery (1.00),Here's the salary you have to earn to buy a home in 19 major US cities (1.00),Newly Sworn SBA Chief Must Deal With Lending Defaults (1.00),Senate Passes Internet Sales Tax; Bill Moves to House (0.99),You thought Vijay Mallya is the largest defaulter who owes banks money? Wait till you read this (0.99)
4,94 Percent of People Think Buying From Small Businesses is Important,5 Tips for Buying a Franchise (1.00),Protecting Small Business Intellectual Property (1.00),Peer-to-Peer Lending Club Fine-Tunes Small Business Loan Program (1.00),Ohio Weighing Major Tax Break For Small Businesses (1.00),Getting Your Business Energy Efficient Before the Holidays (1.00),How to Turn Your Home Brewing Hobby into a Business (1.00),Remote Work No Longer a Perk But a Business Imperative (1.00),Study Finds Small Business Loans Key to Startup Success (1.00),Woman Makes Business Out of Giant Cookies After Losing Job of 30 Years (1.00),"Small Businesses Spend More on Travel, Per Concur Survey (1.00)"
5,"Bright Light Helps Market Products, But Makes Decisions More Emotional",Google Acquisition of Motorola Finally Closes: Why You Should Care (1.01),Customer Relations Blunder? Google Causes Stir Over Easter Doodle (1.01),Headlining the News This Week: Wix Acquires OpenRest (1.01),"Jupitermedia: Media Analyst, NYC (1.00)",Enterprise Cloud Services Retooled as Google for Work (1.00),Video Ad Service TubeMogul Hopes to Raise $93.4 Million with IPO (1.00),Google+ Lifts Real Names Only Policy (1.00),27 Percent of Mobile Sites Are Misconfigured Leading to Lower Traffic (1.00),Charitable Startup Finds New Use for Old Cardboard Boxes (1.00),"Google Updates Listings, Crowdfunding Campaigns Extended (1.00)"
6,25 Tips for Using Instagram in Your Business,How to Market Your Business on Twitter Like a Pro (1.00),Are You Being Too Nice for Your Own Good? (1.00),Business Book Review: iPhone And iPad App Marketing (1.00),10 Ways to Use Hashtags for Your Business (1.00),Invisible Capital Reveals The Resources That Builds Success (1.00),Lumiary Lights the Way for Marketing Your Online Business (1.00),5 Ways Business Intelligence and Online Marketing Can Work Together (1.00),Pinterest Beta Tests Do-It-Yourself Promoted Pins for Business (1.00),Pinteresting Image Optimization Tips When Using Pinterest for Business (1.00),Facebook Wants Your Businesses On Messenger (0.99)
7,"Intuit Will Acquire Check App, Deal is Worth $360 Million",Want to build a billion dollar organisation without VC money? Learn from Sridhar Vembu (1.01),How an MBA grad became a marketplace millionaire by selling umbrellas (1.01),"India orders four maritime spy planes from Boeing, bolsters navy (1.00)",HP Reinventing Traditional Computers With Mini Desktop PC (1.00),Victoria's Secret supermodel reveals everything she eats in a day (1.00),How an English teacher conquered China : Wisdom of Jack Ma condensed into 33 quotes (1.00),Juice Your Apple Devices with this Fun Juice Box Charger (1.00),With great stardom comes great stress  learn how to de-stress from your favourite celebrities and leaders (1.00),The 5 best new songs you can stream right now (1.00),"Etsy Balances Needs of Sellers, Stockholders as IPO Gets Under Way (1.00)"
8,3 Ways to Look at Marketing,Managing Different Generations in the Workplace (1.01),10 phrases in your emails that make you sound unprofessional (1.00),Better Online Marketing Optimization Through Google Analytics: A Book Review (1.00),Metrics Overload? How to Streamline Marketing Data (1.00),Raghu Raghavan of Act-On: Now is the Time to Dive Into Marketing Automation (1.00),4 Real Reasons to Care About Google Place Pages (1.00),Social Customers Means a Social Inbox: Review of Nimble CRM (1.00),20 Reasons People Unfollow You On Twitter (1.00),How to Leverage Infographics for B2B Marketing (1.00),How Does Social Media Aid Lead Generation? (1.00)
9,Successful S-Corp Owners: Watch Out For A Tax Increase,IRS Adopts Taxpayer Bill of Rights (1.01),Evernote Coming Out With New App Just for Businesses (1.00),Internet Sales Tax Bill May Stall in House of Representatives (1.00),Reaching the Cloud: Dedicated Ethernet vs Public Internet Connections (1.00),Understanding Health Insurance Marketplaces: Fast Facts (1.00),No More Tipping at This Pittsburgh Restaurant (1.00),10 Things You Need To Do After Forming An LLC (0.99),"South Dakota, Texas Top List of Best State Tax Systems (0.99)",25 of the Best Cities for Freelancers to Work and Play (0.99),How Do You Feel About Raising the Minimum Wage? (0.99)
10,10 phrases in your emails that make you sound unprofessional,3 Ways to Look at Marketing (1.00),Better Online Marketing Optimization Through Google Analytics: A Book Review (1.00),Metrics Overload? How to Streamline Marketing Data (1.00),4 Real Reasons to Care About Google Place Pages (1.00),Social Customers Means a Social Inbox: Review of Nimble CRM (1.00),How to Leverage Infographics for B2B Marketing (1.00),Getting Comfortable With Self-Promotion (1.00),4 Ways to Market Your SMB With Flickr (1.00),The 5 Types of Influencers On The Web (1.00),10 Assets for Using Tech to Keep Your Team on Track (1.00)
11,Mid-Year Business Review: Risk Management Edition,Best Small Business Books (1.00),Quantify Lets You Shop For Your Next Business Consultant Online (1.00),The Small Business Guide to Getting Ready for Vacation (1.00),The Commitment Engine Inspires Small Business Growth (1.00),Small Business News: Small Biz Startup Tips (1.00),10 Tips For Organizing Your Small Business This Year (1.00),25 Top YouTube Channels for Small Business Owners and Entrepreneurs (1.00),WordStream Improves Its Free AdWords Benchmark Tool For Small Business Advertisers (1.00),Tom Byun of Yahoo! Small Business: Making That Next Sale (1.00),Small Business Guide to Cloud Computing (1.00)
12,European shares lifted by solid earnings but RBS slumps,STOCKS RALLY: Here's what you need to know (1.00),How millions from the Bangladesh Bank heist disappeared (1.00),The Daily Sprout (1.00),The 10 most important things in the world right now (1.00),Daily Sprout (1.00),"The curious story of Dadi Balsara, the Parsi billionaire who stayed
at Taj Mansingh Hotel for 36 years (1.00)",Rupee down against dollar (1.00),10 things you need to know before the opening bell (1.00),Plastic Preferred: Cash To Decline to Just 23% of Purchases (1.00),What you need to know on Wall Street right now (1.00)
13,How to Get Your Products Discovered with Videos,Franchising: The Importance Of Great Systems Within The System (1.03),Google Improves AdWords Express Program (1.01),Infusionsoft Gmail Integration is Now Available (1.01),"Court Reverses $338,000 Award for User Generated Content (1.00)","Brands Doing More Content Marketing with Less Return, TrackMaven Says (1.00)",Vine: Now You Can Send Video Messages Directly to Friends and Colleagues (1.00),"Culture, Career Development and Networking Blend in Black Faces In White Places (1.00)",Google AdWords Conversion Import Tracks Offline Sales (1.00),Social Media Customer Care Company Raises $1 Million for Growth (1.00),Spotlight: Manage A Gazillion Marketing Platforms with Holonis (1.00)
14,"Court Reverses $338,000 Award for User Generated Content",How To Integrate Your Remote Office Effectively (1.01),Google Improves AdWords Express Program (1.01),Franchising: The Importance Of Great Systems Within The System (1.01),How to Get Your Products Discovered with Videos (1.00),Vine: Now You Can Send Video Messages Directly to Friends and Colleagues (1.00),"Culture, Career Development and Networking Blend in Black Faces In White Places (1.00)",Google AdWords Conversion Import Tracks Offline Sales (1.00),Getting Your Invention To Market (1.00),Social Media Customer Care Company Raises $1 Million for Growth (1.00),Pinterest Contemplates Sponsored Pins (1.00)
15,25 Free WordPress Plugins for Integrating Google Features,Why to Think Twice About Green Labels (1.01),Metrics Overload? How to Streamline Marketing Data (1.00),"Meet Byju, whos changing the way India learns (1.00)",Getting Comfortable With Self-Promotion (1.00),SMB Owners Get Mobile Coupons For The Holidays (1.00),The Evolution of Affiliate Marketing (1.00),5 Points to Remember About Mobile SEO (1.00),How To Integrate Your Remote Office Effectively (1.00),The Age of the Platform Will Make You Think (1.00),Google Releases Real-Time Reputation Problem (1.00)
16,Small Business Product Launches and Shut Downs,Is Your Small Business Marketing to Hispanic Consumers? (1.00),Improving Your Community Can Improve Your Business (1.00),Going Mobile: Does Your Small Business Need an App? (1.00),How the Cloud is Reshaping Small Business Productivity (1.00),How Cloud Computing Can Help You Scale Your Business (1.00),The Small Business Guide to Getting Ready for Vacation (1.00),Email Erases 9 to 5 at Many Small to Mid-Sized Businesses (1.00),Catch Up With Our Latest Small Business News Recap (1.00),Small Business Disaster Survival Guide: Get Your Insurance Claims Covered (1.00),Small Business News: Week in Review for July 7 (1.00)
17,Build your Business Through The Economics of Integrity,Hacking of Google Maps May Have Killed This Business (1.00),Get It Together! Consolidate Your Business Systems (1.00),The Creative Small Business and 4 Ways to Get There (1.00),Getting Your Small Business Started On Yelp (1.00),Insights From Google About How Small Businesses Can Improve Sales (1.00),Chekkt: A Place To Discover Business Management Software (1.00),How best friends turned co-founders are building their dream business (1.00),Strategic Speed Shows How to Execute Business Strategy Fast and Well (1.00),Effective Websites for Small Businesses: A Review (1.00),Tips for Tracking Employee Time Effectively in Your Business (1.00)
18,STOCKS RALLY: Here's what you need to know,Finding Success Empowering Lifestyle Entrepreneurs (1.01),European shares lifted by solid earnings but RBS slumps (1.00),How millions from the Bangladesh Bank heist disappeared (1.00),Here come retail sales ... (1.00),The Daily Sprout (1.00),Here comes Markit services PMI ... (1.00),Daily Sprout (1.00),Putin and Erdogan move towards repairing Russia-Turkey ties (1.00),"What to buy, sell and hold (1.00)",Rupee down against dollar (1.00)
19,Best Small Business Books,Mid-Year Business Review: Risk Management Edition (1.00),Quantify Lets You Shop For Your Next Business Consultant Online (1.00),The Commitment Engine Inspires Small Business Growth (1.00),Small Business News: Small Biz Startup Tips (1.00),10 Tips For Organizing Your Small Business This Year (1.00),25 Top YouTube Channels for Small Business Owners and Entrepreneurs (1.00),WordStream Improves Its Free AdWords Benchmark Tool For Small Business Advertisers (1.00),Small Business Guide to Cloud Computing (1.00),28 Webinar Services for Small Business Owners (1.00),Upstarts: How GenY Entrepreneurs are Rocking the World of Business (1.00)
20,What Is HTML5? Do I Need It For My Business Website?,Hacking of Google Maps May Have Killed This Business (1.00),5 Benefits of Having a Website for Your Small Business (1.00),Outsell Yourself: Go From Hello to Sold With Ethical Business and Sales Techniques (1.00),How a Small Business Can Use Big Data (1.00),How Are Business Books Like Restaurants? (1.00),How best friends turned co-founders are building their dream business (1.00),12 Blogs Every Small Business Should Be Reading (1.00),Clate Mask of Infusionsoft: $54M Ways Your Small Business Can Benefit (1.00),Government Resources to Help Market Your Business Overseas (1.00),Black Business Secrets Offers Tips to a New Generation of African American Entrepreneurs (1.00)
21,10 Apps to Assist with Your Small Business Taxes,The Secret to Achieving Resolutions:  Setting Small Goals (1.00),How the Cloud is Reshaping Small Business Productivity (1.00),Is It Time to Change Your Business Structure? (1.00),How Cloud Computing Can Help You Scale Your Business (1.00),Email Erases 9 to 5 at Many Small to Mid-Sized Businesses (1.00),Satanic Latte Art? How Should a Business Respond? (1.00),Small Business Disaster Survival Guide: Get Your Insurance Claims Covered (1.00),How to Turn Your Hobby Into a Business (1.00),Top Reasons to Incorporate Your Business (1.00),A Plug-and-Play Customer Loyalty Program for Small Businesses (1.00)
22,Evernote Coming Out With New App Just for Businesses,IRS Adopts Taxpayer Bill of Rights (1.01),Reaching the Cloud: Dedicated Ethernet vs Public Internet Connections (1.01),How my first startup ended in a loss of Rs 15 lakh and shut down in a year (1.01),Successful S-Corp Owners: Watch Out For A Tax Increase (1.00),10 Things You Need To Do After Forming An LLC (1.00),Understanding Health Insurance Marketplaces: Fast Facts (1.00),No More Tipping at This Pittsburgh Restaurant (1.00),"South Dakota, Texas Top List of Best State Tax Systems (0.99)",25 of the Best Cities for Freelancers to Work and Play (0.99),Loan Approvals Rising at Small Banks and Alternative Lenders (0.99)
23,Facebook Wants Your Businesses On Messenger,Business Book Review: iPhone And iPad App Marketing (1.00),10 Ways to Use Hashtags for Your Business (1.00),Invisible Capital Reveals The Resources That Builds Success (1.00),Pinteresting Image Optimization Tips When Using Pinterest for Business (1.00),25 Tips for Using Instagram in Your Business (0.99),How to Market Your Business on Twitter Like a Pro (0.99),Are You Being Too Nice for Your Own Good? (0.99),What Google+ Local Pages Means to Your Business (0.99),Manta Business Directory Upgrades to Help You Get Discovered (0.99),Lumiary Lights the Way for Marketing Your Online Business (0.99)
24,"5 entrepreneurship lessons to learn from Colonel Sanders, the culprit responsible for your finger-licking mania",Getting In The Game Puts Your Start Up Investment on the Board (1.02),Adobe Acquires Fotolia for $800 Million (1.01),Audiam Wants to Find Money for Musicians on YouTube (1.01),Amazon Takes Aim at Etsy with Handmade (1.01),The Kodak Pixpro SP360 Sports a 360 Degree Camera (1.01),How to Secure and Protect Mobile Devices (1.01),"This Hyderabad-based startup aims to aggregate cabs, food and mobile recharge apps (1.01)","Introducing the ASUS ZenFone 2, No Contract Required (1.01)",Top Jobs Of The Week In Digital Media (1.01),Google Knocks $100 Off Nexus 4 (1.01)
25,"India orders four maritime spy planes from Boeing, bolsters navy",Want to build a billion dollar organisation without VC money? Learn from Sridhar Vembu (1.01),"Intuit Will Acquire Check App, Deal is Worth $360 Million (1.00)",Victoria's Secret supermodel reveals everything she eats in a day (1.00),Microsoft Makes $44.6 Billion Cash And Stock Bid For Yahoo; 62 Percent Premium (1.00),How an English teacher conquered China : Wisdom of Jack Ma condensed into 33 quotes (1.00),With great stardom comes great stress  learn how to de-stress from your favourite celebrities and leaders (1.00),"Etsy Balances Needs of Sellers, Stockholders as IPO Gets Under Way (1.00)","Reliance Jio is yet to be launched, but is already breaking rules (1.00)",Kid Inventors Come Up With Creative Environmental Solutions (1.00),Microsoft Temporarily Cuts the Price on the Surface 2 (1.00)
26,"Daisy Chittilapilly- Director, Partner Organization, Cisco India and SAARC",Indie Books Now Have a Better Shot With Brick-and-Mortar Bookstores (1.01),New Microsoft Surface 2 Tablets Have Arrived (1.00),"Michael Phelps has the perfect body for swimming, but that's not the only reason he's so good (1.00)",Call+ Offers Free Landline Calls To 16 Countries (1.00),Sauca Foods:  New Flair for the Food Truck Trend (0.99),ZenPayroll Could Change the Way You Pay (0.99),"New Apple iPad Thinner, Lighter But Still $499 (0.99)",Thanks to TheAppleBlog Sponsors! (0.99),Juice Your Apple Devices with this Fun Juice Box Charger (0.99),Days Are Numbered for the LG Google Nexus 5 (0.99)
27,Adobe Acquires Fotolia for $800 Million,"5 entrepreneurship lessons to learn from Colonel Sanders, the culprit responsible for your finger-licking mania (1.01)",Amazon Takes Aim at Etsy with Handmade (1.01),How Low Will Online Storage Costs Finally Go? (1.01),Getting In The Game Puts Your Start Up Investment on the Board (1.01),Days Are Numbered for the LG Google Nexus 5 (1.00),BotBeat: This weeks top botstories (1.00),Audiam Wants to Find Money for Musicians on YouTube (1.00),Cicret Could Turn Your Skin Into a Smartphone Display (1.00),"China Based Huawei Introduces Five New Devices, Eyes U.S. Market (1.00)","Community Connect: Product Strategist, NYC (1.00)"
28,"Brands Doing More Content Marketing with Less Return, TrackMaven Says",Franchising: The Importance Of Great Systems Within The System (1.04),"Fraudulent DMCA Takedown Requests: Finally, a Lid on Them? (1.01)",Infusionsoft Gmail Integration is Now Available (1.01),How to Get Your Products Discovered with Videos (1.00),Vine: Now You Can Send Video Messages Directly to Friends and Colleagues (1.00),"Culture, Career Development and Networking Blend in Black Faces In White Places (1.00)",Social Media Customer Care Company Raises $1 Million for Growth (1.00),Infosys is using an algorithm to identify its next top-level leaders (1.00),"The Rumors Are True, Facebook Gets Hashtags (1.00)",Spotlight: Manage A Gazillion Marketing Platforms with Holonis (1.00)
29,You Made It Yourself: Now What? 29 Places to Sell Your Handmade Creations,Why to Think Twice About Green Labels (1.01),"Meet Byju, whos changing the way India learns (1.00)",SMB Owners Get Mobile Coupons For The Holidays (1.00),5 Points to Remember About Mobile SEO (1.00),How To Integrate Your Remote Office Effectively (1.00),The Age of the Platform Will Make You Think (1.00),Business Insider is hiring a paid social media intern for our video team. Apply now! (1.00),How to Promote Offline Events On The Web (1.00),Graph Search Presents Opportunties to Reach More Facebook Users (1.00),How Google Upgraded URLs Will Change Your AdWords Experience (1.00)
30,10 things you need to know in markets today,Finding Success Empowering Lifestyle Entrepreneurs (1.02),The Christmas Conspiracy (1.01),How 2 of the world's most powerful and dangerous drug lords compare (1.00),FCC Decision on Net Neutrality Coming Soon (1.00),Here come retail sales ... (1.00),The Daily Sprout (1.00),Cardamom futures remain up on rising demand (1.00),"Up close & personal: How Sunny Leone handles stocks, land, gold, other assets (1.00)",Here come personal income and spending ... (1.00),Earnings This Week (1.00)
31,FCC Decision on Net Neutrality Coming Soon,Finding Success Empowering Lifestyle Entrepreneurs (1.01),How 2 of the world's most powerful and dangerous drug lords compare (1.00),10 things you need to know in markets today (1.00),Here come retail sales ... (1.00),The Daily Sprout (1.00),Cardamom futures remain up on rising demand (1.00),"Up close & personal: How Sunny Leone handles stocks, land, gold, other assets (1.00)",Here come personal income and spending ... (1.00),Earnings This Week (1.00),Here comes the Baker Hughes rig count ... (1.00)
32,How to Market Your Business on Twitter Like a Pro,Pinterest Beta Tests Do-It-Yourself Promoted Pins for Business (1.01),25 Tips for Using Instagram in Your Business (1.00),Want to Learn How to Use Google Plus for Business? Of Course You Do! (1.00),What Google+ Local Pages Means to Your Business (1.00),Business Book Review: iPhone And iPad App Marketing (1.00),10 Ways to Use Hashtags for Your Business (1.00),Invisible Capital Reveals The Resources That Builds Success (1.00),Lumiary Lights the Way for Marketing Your Online Business (1.00),"31 LinkedIn Tools for Business, Plus a Few Extras (1.00)",5 Ways Business Intelligence and Online Marketing Can Work Together (1.00)
33,The Secret to Achieving Resolutions:  Setting Small Goals,"21 Year Old Solves Own Acne Problem, Builds Business (1.01)",10 Apps to Assist with Your Small Business Taxes (1.00),How the Cloud is Reshaping Small Business Productivity (1.00),Is It Time to Change Your Business Structure? (1.00),How Cloud Computing Can Help You Scale Your Business (1.00),Email Erases 9 to 5 at Many Small to Mid-Sized Businesses (1.00),Satanic Latte Art? How Should a Business Respond? (1.00),How to Turn Your Hobby Into a Business (1.00),Protecting Small Business Intellectual Property (1.00),Top Reasons to Incorporate Your Business (1.00)
34,11 Ways to Use Twitter To Develop Sales Leads,Time and Expense Tracking Apps: 27 Solutions (1.01),Outright: Simple Online Bookkeeping for Sole Proprietors (1.01),Better Online Marketing Optimization Through Google Analytics: A Book Review (1.00),Raghu Raghavan of Act-On: Now is the Time to Dive Into Marketing Automation (1.00),20 Reasons People Unfollow You On Twitter (1.00),How to Leverage Infographics for B2B Marketing (1.00),How Does Social Media Aid Lead Generation? (1.00),10 Tips for Using a Blog to Increase Email List Signups (1.00),Not Sure How to Use LinkedIn for B2B? Let Us Help You (1.00),When and How to Use Autoresponders (1.00)
35,"Jupitermedia: Media Analyst, NYC",Franchising: The Importance Of Great Systems Within The System (1.02),What is Siri? And Does Siri Have Competitors? (1.01),Headlining the News This Week: Wix Acquires OpenRest (1.01),Apple Pays $200 Million for Topsy (1.01),Google Acquisition of Motorola Finally Closes: Why You Should Care (1.00),"Bright Light Helps Market Products, But Makes Decisions More Emotional (1.00)",Twitter Officially Launches Mobile Ads Manager (1.00),Enterprise Cloud Services Retooled as Google for Work (1.00),Twitter Accidentally Sends Out Thousands of Reset Notices (1.00),Google+ Lifts Real Names Only Policy (1.00)
36,Better Online Marketing Optimization Through Google Analytics: A Book Review,Smartsheet: Online Spreadsheets for Project Collaboration (1.01),Awaken Your Productivity With Fearless At Work (1.01),Managing Different Generations in the Workplace (1.01),Read Digital Dollar to Get Your Online Strategy in Gear (1.01),Big News: Quickbooks Competitor Intacct Targets the SMB Market (1.01),3 Ways to Look at Marketing (1.00),10 phrases in your emails that make you sound unprofessional (1.00),11 Ways to Use Twitter To Develop Sales Leads (1.00),Metrics Overload? How to Streamline Marketing Data (1.00),Raghu Raghavan of Act-On: Now is the Time to Dive Into Marketing Automation (1.00)
37,Is Your Small Business Marketing to Hispanic Consumers?,Small Business Product Launches and Shut Downs (1.00),Going Mobile: Does Your Small Business Need an App? (1.00),The Small Business Guide to Getting Ready for Vacation (1.00),Catch Up With Our Latest Small Business News Recap (1.00),The Commitment Engine Inspires Small Business Growth (1.00),Small Business News: Week in Review for July 7 (1.00),"Spring Clean Your Small Business, Twitter Chat Recap (1.00)",Small Business Leads To Better Economy (1.00),Oakland Program Helps Underprivileged Youth Start Businesses (1.00),Join The Crowdfunding Revolution to Start Your Business (1.00)
