,title,most_similar_1,most_similar_2,most_similar_3,most_similar_4,most_similar_5,most_similar_6,most_similar_7,most_similar_8,most_similar_9,most_similar_10
230,Are You Making Use of These 200+ Content Marketing Tips?,Managing Different Generations in the Workplace (1.01),3 Ways to Look at Marketing (1.00),11 Ways to Use Twitter To Develop Sales Leads (1.00),Better Online Marketing Optimization Through Google Analytics: A Book Review (1.00),Raghu Raghavan of Act-On: Now is the Time to Dive Into Marketing Automation (1.00),Social Customers Means a Social Inbox: Review of Nimble CRM (1.00),20 Reasons People Unfollow You On Twitter (1.00),How to Leverage Infographics for B2B Marketing (1.00),How Does Social Media Aid Lead Generation? (1.00),Not Sure How to Use LinkedIn for B2B? Let Us Help You (1.00)
231,Lawn Care Services Offered on Amazon Soon,Indie Books Now Have a Better Shot With Brick-and-Mortar Bookstores (1.01),Thanks to TheAppleBlog Sponsors! (1.00),Juice Your Apple Devices with this Fun Juice Box Charger (1.00),Amazon Introduces New Kindle Fire Tablets (1.00),The 5 best new songs you can stream right now (1.00),Your Uncharged Phone Might Not be Allowed on Some Flights (1.00),Ebay Adds Same Day Delivery In Dallas (1.00),Googles Russian Ad Buy Blocked On Technicality; Putins Spanner In The Works? (1.00),Want to build a billion dollar organisation without VC money? Learn from Sridhar Vembu (1.00),Here's A Brand New Thing You Didn't Know About 'Friends' (1.00)
232,HP Announces 8 New Business Tablets,Do You Trust Your Employees to Work Remotely? (1.02),Senate Passes Internet Sales Tax; Bill Moves to House (1.00),How to Get a Startup Visa Act Passed (1.00),"Robust Employment Growth, Just not for the Self-Employed (1.00)",A dummy's guide to GST (1.00),Pricing pressure in US biz cyclical in nature: Cadila Health (1.00),Employers Say Wellness Programs Work (1.00),"Venture Capital Trends: A Shrinking, Evolving Industry (1.00)",Newly Sworn SBA Chief Must Deal With Lending Defaults (1.00),Consumer Attitudes Indicate a New Year with Old Spending Habits (1.00)
233,5 Ways Social Media Can Make Your Trade Show A Success,Smartsheet: Online Spreadsheets for Project Collaboration (1.01),Awaken Your Productivity With Fearless At Work (1.01),Managing Different Generations in the Workplace (1.01),3 Ways to Look at Marketing (1.00),10 phrases in your emails that make you sound unprofessional (1.00),Better Online Marketing Optimization Through Google Analytics: A Book Review (1.00),Metrics Overload? How to Streamline Marketing Data (1.00),Raghu Raghavan of Act-On: Now is the Time to Dive Into Marketing Automation (1.00),4 Real Reasons to Care About Google Place Pages (1.00),Social Customers Means a Social Inbox: Review of Nimble CRM (1.00)
234,How to Use The Linkedin Mentions Feature to Engage and Connect,Why to Think Twice About Green Labels (1.01),Metrics Overload? How to Streamline Marketing Data (1.00),Getting Comfortable With Self-Promotion (1.00),The 5 Types of Influencers On The Web (1.00),5 Points to Remember About Mobile SEO (1.00),5 Reasons SMBs Need Content Marketing (1.00),Loni Stark of Adobe: Digital Marketing Solutions in the Cloud (1.00),Increase Your Website Credibility in the Age of Content Marketing (1.00),Smartsheet: Online Spreadsheets for Project Collaboration (1.00),Yelp Reviews Out of Google Places. What Else Ya Got? (1.00)
235,"Better Business Bureau Reviews, LinkedIn Apps and More",Receive Custom Social Content for Your Small Business With Emphatic (1.00),3 Key Business Marketing Trends for 2014 (1.00),Twitter Chat: Is Your Brand Helping Or Hurting Your Business? (1.00),Black Business Secrets Offers Tips to a New Generation of African American Entrepreneurs (1.00),7 Best Business Books for Summer Reading (1.00),Be.Lead.Do Provides Online Resource for Business Managers (1.00),Google Makes Business Photos Self-Service (1.00),Is Your Online Reputation Impacting Your Business? (1.00),Advantages of Using eCommerce Software in Your Retail Business (1.00),5 Benefits of Having a Website for Your Small Business (0.99)
236,Loan Approvals Rising at Small Banks and Alternative Lenders,Reaching the Cloud: Dedicated Ethernet vs Public Internet Connections (1.01),Estimated Tax Payments:  Your Questions Answered (1.00),10 Questions to Ask Before Applying for a Bank Loan (1.00),How to Get Your Company Back in Good Standing This Summer (1.00),How my first startup ended in a loss of Rs 15 lakh and shut down in a year (1.00),Evernote Coming Out With New App Just for Businesses (0.99),10 Things You Need To Do After Forming An LLC (0.99),Are You Operating Your Business in Multiple States? What You Need to Know (0.99),Euro zone business growth picks up slightly but still muted (0.99),3 Questions for You to Ask Yourself About Employee Health Care (0.99)
237,How a Small Business Can Use Big Data,What Is HTML5? Do I Need It For My Business Website? (1.00),Hacking of Google Maps May Have Killed This Business (1.00),5 Benefits of Having a Website for Your Small Business (1.00),Outsell Yourself: Go From Hello to Sold With Ethical Business and Sales Techniques (1.00),How Are Business Books Like Restaurants? (1.00),How best friends turned co-founders are building their dream business (1.00),3 Key Business Marketing Trends for 2014 (1.00),12 Blogs Every Small Business Should Be Reading (1.00),20 Important LinkedIn Groups for Business (1.00),Clate Mask of Infusionsoft: $54M Ways Your Small Business Can Benefit (1.00)
238,Protecting Small Business Intellectual Property,"Fortune 500 Thrives, But Small Businesses Not So Optimistic (1.00)",94 Percent of People Think Buying From Small Businesses is Important (1.00),The Secret to Achieving Resolutions:  Setting Small Goals (1.00),Is It Time to Change Your Business Structure? (1.00),Peer-to-Peer Lending Club Fine-Tunes Small Business Loan Program (1.00),Getting Your Business Energy Efficient Before the Holidays (1.00),How to Turn Your Home Brewing Hobby into a Business (1.00),Reward your Small Business with the Capital One Spark (1.00),Remote Work No Longer a Perk But a Business Imperative (1.00),Study Finds Small Business Loans Key to Startup Success (1.00)
239,Odd Lots,Want to build a billion dollar organisation without VC money? Learn from Sridhar Vembu (1.01),"Intuit Will Acquire Check App, Deal is Worth $360 Million (1.00)",Juice Your Apple Devices with this Fun Juice Box Charger (1.00),The 5 best new songs you can stream right now (1.00),Indie Books Now Have a Better Shot With Brick-and-Mortar Bookstores (1.00),Ebay Adds Same Day Delivery In Dallas (1.00),Liquid Soap and Green Tech are Game Changers for This Entrepreneur (1.00),Curved Smartphones Trend:  G Flex Ready for the U.S. (1.00),UPS Considers Delivery Drones Too (1.00),Entrepreneur Gary Vaynerchuk: From Personal Brand to VC Investor (1.00)
240,Twitter is Playing Favorites With People You Follow,How To Integrate Your Remote Office Effectively (1.01),Getting Your Invention To Market (1.00),How to Create a LinkedIn Profile That Rocks At Generating Leads (1.00),Business Insider is hiring a paid social media intern for our video team. Apply now! (1.00),The ultimate master list of revenue models used by Web and Mobile companies (1.00),How Do I Update WordPress Plugins Automatically? (1.00),"Facebook, Yelp Follow FourSquare, Launch Deals (1.00)",LinkedIn Gets Rid of Products and Services Tab on Company Pages (1.00),20 More Resources To Sell Your Handmade Crafts (1.00),What Makes You Stand Out When Job Hunting? (1.00)
241,Omnichannel done right: 4 ways to keep the communication in marketingcommunications,Time and Expense Tracking Apps: 27 Solutions (1.01),Managing Different Generations in the Workplace (1.01),Big News: Quickbooks Competitor Intacct Targets the SMB Market (1.01),3 Ways to Look at Marketing (1.00),11 Ways to Use Twitter To Develop Sales Leads (1.00),Better Online Marketing Optimization Through Google Analytics: A Book Review (1.00),Raghu Raghavan of Act-On: Now is the Time to Dive Into Marketing Automation (1.00),Social Customers Means a Social Inbox: Review of Nimble CRM (1.00),20 Reasons People Unfollow You On Twitter (1.00),How to Leverage Infographics for B2B Marketing (1.00)
242,The Christmas Conspiracy,Finding Success Empowering Lifestyle Entrepreneurs (1.02),10 things you need to know in markets today (1.01),Earnings This Week (1.01),The 20 best smartphones in the world (1.01),Here comes consumer confidence... (1.01),Union Cabinet approves skill training through Pradhan Mantri Kaushal Vikas Yojana (1.01),P2P Tech Firm CacheLogic Raises $20M in Third Round Funding (1.01),How to Boost Your Retail Sales Into the New Year (1.01),Govt's decision to demonetise a retrograde move: Arvind Sanger (1.01),Flexible Working: Win-Win For Employers and Employees (1.01)
243,Rupee down against dollar,Finding Success Empowering Lifestyle Entrepreneurs (1.01),10 real problems in India startups can aim to solve (1.01),Behavioral Economics for Entrepreneurs (1.01),How 2 of the world's most powerful and dangerous drug lords compare (1.00),European shares lifted by solid earnings but RBS slumps (1.00),STOCKS RALLY: Here's what you need to know (1.00),10 things you need to know in markets today (1.00),FCC Decision on Net Neutrality Coming Soon (1.00),How millions from the Bangladesh Bank heist disappeared (1.00),Here come retail sales ... (1.00)
244,UPS Considers Delivery Drones Too,Indie Books Now Have a Better Shot With Brick-and-Mortar Bookstores (1.02),Juice Your Apple Devices with this Fun Juice Box Charger (1.01),The 5 best new songs you can stream right now (1.01),Want to build a billion dollar organisation without VC money? Learn from Sridhar Vembu (1.01),RANKED: The 20 best Nintendo 64 games of all time (1.01),Game Plan: (1.01),"[Techie Tuesdays] A tribute to Humblefool, the best coder that ever lived in India (1.01)",How an MBA grad became a marketplace millionaire by selling umbrellas (1.01),The First Consumer 3D Printer Is Now In Crowdfunding (1.01),Rs 5000 to Rs 5 crore: An Indore boys graduation from a hacker to an entrepreneur (1.01)
245,4 Practical SMB Uses For FourSquare,Time and Expense Tracking Apps: 27 Solutions (1.01),3 Ways to Look at Marketing (1.00),11 Ways to Use Twitter To Develop Sales Leads (1.00),Better Online Marketing Optimization Through Google Analytics: A Book Review (1.00),Raghu Raghavan of Act-On: Now is the Time to Dive Into Marketing Automation (1.00),20 Reasons People Unfollow You On Twitter (1.00),How to Leverage Infographics for B2B Marketing (1.00),How Does Social Media Aid Lead Generation? (1.00),Not Sure How to Use LinkedIn for B2B? Let Us Help You (1.00),When and How to Use Autoresponders (1.00)
246,Insights From Google About How Small Businesses Can Improve Sales,Build your Business Through The Economics of Integrity (1.00),Quantify Lets You Shop For Your Next Business Consultant Online (1.00),Get It Together! Consolidate Your Business Systems (1.00),Getting Your Small Business Started On Yelp (1.00),How best friends turned co-founders are building their dream business (1.00),28 Webinar Services for Small Business Owners (1.00),Strategic Speed Shows How to Execute Business Strategy Fast and Well (1.00),Effective Websites for Small Businesses: A Review (1.00),Review of The Mesh: Why The Future of Business Is Sharing (1.00),Evernote Business: Know What Your Team Knows (1.00)
247,Infosys is using an algorithm to identify its next top-level leaders,Franchising: The Importance Of Great Systems Within The System (1.03),"Brands Doing More Content Marketing with Less Return, TrackMaven Says (1.00)",Nimble CRM Says LinkedIn Lock Out is a Minor Stumbling Block (1.00),Twitter Ads API Gives You More Advertising Options (1.00),What Are Net Promoter Scores? (1.00),Why You Need Honest Feedback and 3 Ways to Get It (1.00),5 Surprising Mobile Search Statistics and Facts (1.00),"Fraudulent DMCA Takedown Requests: Finally, a Lid on Them? (1.00)",Spotlight: Studypool Provides Fast Online Homework Help (1.00),12 Apps to Help Ease Anxiety (1.00)
248,When I had no food and only Rs 50 in my pocket  a moving story of an entrepreneur,Indie Books Now Have a Better Shot With Brick-and-Mortar Bookstores (1.02),How an MBA grad became a marketplace millionaire by selling umbrellas (1.01),HP Reinventing Traditional Computers With Mini Desktop PC (1.00),"New Apple iPad Thinner, Lighter But Still $499 (1.00)",Thanks to TheAppleBlog Sponsors! (1.00),Juice Your Apple Devices with this Fun Juice Box Charger (1.00),Amazon Introduces New Kindle Fire Tablets (1.00),The 5 best new songs you can stream right now (1.00),Your Uncharged Phone Might Not be Allowed on Some Flights (1.00),Nokia Introduces Asha Smartphones Beginning at Just $69 (1.00)
249,The Day After: Yang Still Open To Deal; Angry Instiutionals; Shareholder Lawsuits Start,Finding Success Empowering Lifestyle Entrepreneurs (1.01),STOCKS RALLY: Here's what you need to know (1.00),10 things you need to know in markets today (1.00),How millions from the Bangladesh Bank heist disappeared (1.00),Here come retail sales ... (1.00),The Daily Sprout (1.00),Here come personal income and spending ... (1.00),Here comes the Baker Hughes rig count ... (1.00),Here comes Markit services PMI ... (1.00),Daily Sprout (1.00)
250,Entrepreneur Gary Vaynerchuk: From Personal Brand to VC Investor,Want to build a billion dollar organisation without VC money? Learn from Sridhar Vembu (1.01),"[Techie Tuesdays] A tribute to Humblefool, the best coder that ever lived in India (1.01)",How an MBA grad became a marketplace millionaire by selling umbrellas (1.01),"Intuit Will Acquire Check App, Deal is Worth $360 Million (1.00)","India orders four maritime spy planes from Boeing, bolsters navy (1.00)",HP Reinventing Traditional Computers With Mini Desktop PC (1.00),Victoria's Secret supermodel reveals everything she eats in a day (1.00),Microsoft Makes $44.6 Billion Cash And Stock Bid For Yahoo; 62 Percent Premium (1.00),How an English teacher conquered China : Wisdom of Jack Ma condensed into 33 quotes (1.00),Juice Your Apple Devices with this Fun Juice Box Charger (1.00)
251,MyOpenID Will Shut Down in February,CrowdtiltOpen Allows Free Crowdsourcing on Your Own Domain (1.01),"Busted: Hotels.com Caught Buying Links, Apology is Weak (1.01)",[Techie Tuesdays] Manish Bhattacharya  The Kid who paid his education loan by hacking into facebook (1.01),Ever Wish You Had the Same Data As Amazon? Terapeak Says You Can (1.01),Learn Vital Lessons by Entering The Mind of Elite Entrepreneurs (1.01),This Coffee Shop is Selling More Than Just Coffee (1.01),Working at TaxiForSure is fun for sure [Fabulous Workplaces] (1.01),Mix360 Headset Promises Hi-Fi Experience From Your Smartphone (1.00),What is a Database? (1.00),Yahoo Opens Its Ad Network to Other Publishers (1.00)
252,Internet Sales Tax Bill May Stall in House of Representatives,IRS Adopts Taxpayer Bill of Rights (1.01),Successful S-Corp Owners: Watch Out For A Tax Increase (1.00),"South Dakota, Texas Top List of Best State Tax Systems (1.00)",25 of the Best Cities for Freelancers to Work and Play (1.00),Reaching the Cloud: Dedicated Ethernet vs Public Internet Connections (1.00),How Do You Feel About Raising the Minimum Wage? (1.00),Communicating to Employees About Health Insurance Open Enrollment (1.00),"Federal Gas Tax Could Increase by 15 Cents, More Costs Possible (1.00)",Understanding Health Insurance Marketplaces: Fast Facts (1.00),No More Tipping at This Pittsburgh Restaurant (1.00)
253,5 Ways to Start Building Your Brand Online,8 Daily Steps to Compete Like a Champion (1.01),11 Ways to Use Twitter To Develop Sales Leads (1.00),20 Reasons People Unfollow You On Twitter (1.00),How Does Social Media Aid Lead Generation? (1.00),10 Tips for Using a Blog to Increase Email List Signups (1.00),When and How to Use Autoresponders (1.00),Book Review: You Are What You Choose (1.00),How to Balance Engagement and Customer Service on Twitter (1.00),Review: Attention! This Book Will Make You Money (1.00),LotusJump Review: Do-It-Yourself Online Marketing Service (1.00)
254,Chekkt: A Place To Discover Business Management Software,Build your Business Through The Economics of Integrity (1.00),Hacking of Google Maps May Have Killed This Business (1.00),Get It Together! Consolidate Your Business Systems (1.00),The Creative Small Business and 4 Ways to Get There (1.00),Getting Your Small Business Started On Yelp (1.00),How best friends turned co-founders are building their dream business (1.00),12 Blogs Every Small Business Should Be Reading (1.00),Tips for Tracking Employee Time Effectively in Your Business (1.00),Clate Mask of Infusionsoft: $54M Ways Your Small Business Can Benefit (1.00),Government Resources to Help Market Your Business Overseas (1.00)
255,Tom Byun of Yahoo! Small Business: Making That Next Sale,Mid-Year Business Review: Risk Management Edition (1.00),Is Your Small Business Marketing to Hispanic Consumers? (1.00),Quantify Lets You Shop For Your Next Business Consultant Online (1.00),The Small Business Guide to Getting Ready for Vacation (1.00),The Commitment Engine Inspires Small Business Growth (1.00),Small Business News: Small Biz Startup Tips (1.00),10 Tips For Organizing Your Small Business This Year (1.00),Join The Crowdfunding Revolution to Start Your Business (1.00),Small Business Guide to Cloud Computing (1.00),Working On Your Business Not In It (1.00)
256,Your End of Year Legal Checklist,What Are Sunk Costs? (1.01),Mompreneur Launches $3 Million Business Selling Superhero Capes (1.00),Small Business Loan Approval Drops to 18.8 Percent at Big Banks (1.00),"Small Business Loans Up at Big Banks, Down at Small Ones (1.00)",The Micro Business Home Equity Loan Crunch (1.00),President Obama Angers Small Booksellers With Amazon Speech (1.00),"Reed Business Information: Online Sales Manager, LA (1.00)",Small Business Employment Share Shrinking for a Good Reason (1.00),Gross Fixed Capital Formation Weak at Non-Corporate Businesses (1.00),Raising Minimum Wage: Next Proposal to Threaten Small Businesses (1.00)
257,5 Small Business Social Media Mistakes,10 Social Media Books Every Small Business Owner Should Read (1.00),LinkedIn Introduces Showcase Pages for Business (1.00),Customer Asked to Leave Local Business Over Google Glass Policy (1.00),6 Benefits of Social Media for Small Businesses (1.00),The Referral Engine: Teaching Your Business to Market Itself (1.00),Best Small Business Use of Facebook Graph Search: Local Businesses (1.00),Receive Custom Social Content for Your Small Business With Emphatic (0.99),Building Trust: 5 Tips to Establish Your Credibility for Business (0.99),"Better Business Bureau Reviews, LinkedIn Apps and More (0.99)",Twitter Chat: Is Your Brand Helping Or Hurting Your Business? (0.99)
258,Apple Will Introduce Two Curved Phones,Indie Books Now Have a Better Shot With Brick-and-Mortar Bookstores (1.02),How an MBA grad became a marketplace millionaire by selling umbrellas (1.01),HP Reinventing Traditional Computers With Mini Desktop PC (1.00),Thanks to TheAppleBlog Sponsors! (1.00),Juice Your Apple Devices with this Fun Juice Box Charger (1.00),Amazon Introduces New Kindle Fire Tablets (1.00),The 5 best new songs you can stream right now (1.00),Your Uncharged Phone Might Not be Allowed on Some Flights (1.00),Nokia Introduces Asha Smartphones Beginning at Just $69 (1.00),Ebay Adds Same Day Delivery In Dallas (1.00)
259,WitKit Platform Lets Your Team Collaborate in Security,How Do Consumers Buy Online? (1.01),CorpNet Adds Free Meeting Minutes and Corporate Document Templates (1.01),Getting In The Game Puts Your Start Up Investment on the Board (1.01),"5 entrepreneurship lessons to learn from Colonel Sanders, the culprit responsible for your finger-licking mania (1.00)",Adobe Acquires Fotolia for $800 Million (1.00),Artsy Central Shows Trend Toward Etsy Alternatives (1.00),BotBeat: This weeks top botstories (1.00),Amazon Takes Aim at Etsy with Handmade (1.00),"This Hyderabad-based startup aims to aggregate cabs, food and mobile recharge apps (1.00)",Do Your Customers Look Forward to Seeing You? (1.00)
260,Peer-to-Peer Lending Club Fine-Tunes Small Business Loan Program,"Fortune 500 Thrives, But Small Businesses Not So Optimistic (1.00)",94 Percent of People Think Buying From Small Businesses is Important (1.00),Is It Time to Change Your Business Structure? (1.00),5 Tips for Buying a Franchise (1.00),Protecting Small Business Intellectual Property (1.00),Getting Your Business Energy Efficient Before the Holidays (1.00),How to Turn Your Home Brewing Hobby into a Business (1.00),Reward your Small Business with the Capital One Spark (1.00),Remote Work No Longer a Perk But a Business Imperative (1.00),Study Finds Small Business Loans Key to Startup Success (1.00)
261,Keurig CEO Regrets Big Mistake Made with the 2.0 Brewer,How millions from the Bangladesh Bank heist disappeared (1.00),Daily Sprout (1.00),10 things you need to know before the opening bell (1.00),Plastic Preferred: Cash To Decline to Just 23% of Purchases (1.00),China extends Marriott-Starwood deal review by up to 60 days (1.00),Finding Success Empowering Lifestyle Entrepreneurs (1.00),Here comes the jobs report ... (1.00),The Bengal Famine: How the British engineered the worst genocide in human history for profit (1.00),"Despite the Hype, Few Study Entrepreneurship (1.00)","Demonetisation: Banks may trim base rate by 360 bps in 3-4 years, says Ambit (1.00)"
262,"Reed Business Information: Online Sales Manager, LA",What Are Sunk Costs? (1.02),Mompreneur Launches $3 Million Business Selling Superhero Capes (1.01),Answers to Your Frequently Asked Questions About Incorporation (1.01),How Much Will the Sequester Cost Small Business Contractors? (1.00),5 Tips for Buying a Franchise (1.00),"Small Business Loans Up at Big Banks, Down at Small Ones (1.00)",President Obama Angers Small Booksellers With Amazon Speech (1.00),Your End of Year Legal Checklist (1.00),Ohio Weighing Major Tax Break For Small Businesses (1.00),Small Business Employment Share Shrinking for a Good Reason (1.00)
263,P2P Tech Firm CacheLogic Raises $20M in Third Round Funding,The Christmas Conspiracy (1.01),Finding Success Empowering Lifestyle Entrepreneurs (1.01),How 2 of the world's most powerful and dangerous drug lords compare (1.00),10 things you need to know in markets today (1.00),FCC Decision on Net Neutrality Coming Soon (1.00),Here come retail sales ... (1.00),The Daily Sprout (1.00),Cardamom futures remain up on rising demand (1.00),"Up close & personal: How Sunny Leone handles stocks, land, gold, other assets (1.00)",Here come personal income and spending ... (1.00)
264,Ohio Weighing Major Tax Break For Small Businesses,94 Percent of People Think Buying From Small Businesses is Important (1.00),Mompreneur Launches $3 Million Business Selling Superhero Capes (1.00),How Much Will the Sequester Cost Small Business Contractors? (1.00),5 Tips for Buying a Franchise (1.00),"Reed Business Information: Online Sales Manager, LA (1.00)",Small Business Employment Share Shrinking for a Good Reason (1.00),Raising Minimum Wage: Next Proposal to Threaten Small Businesses (1.00),Putting Television in Your Lobby or Place of Business: What you Need to Know (1.00),Woman Makes Business Out of Giant Cookies After Losing Job of 30 Years (1.00),"Small Businesses Spend More on Travel, Per Concur Survey (1.00)"
265,"Smarter, Faster, Cheaper: A Review",8 Daily Steps to Compete Like a Champion (1.01),Chris Goward: Affiliate Programs and Conversion Optimization #AMDays (1.01),Read Adaptability and Learn to Thrive in Any Environment (1.01),Time and Expense Tracking Apps: 27 Solutions (1.01),Outright: Simple Online Bookkeeping for Sole Proprietors (1.01),Big News: Quickbooks Competitor Intacct Targets the SMB Market (1.01),3 Ways to Look at Marketing (1.00),11 Ways to Use Twitter To Develop Sales Leads (1.00),Better Online Marketing Optimization Through Google Analytics: A Book Review (1.00),Raghu Raghavan of Act-On: Now is the Time to Dive Into Marketing Automation (1.00)
266,Curved LG G Flex 2 Phablet a Sequel Improving the Original,Indie Books Now Have a Better Shot With Brick-and-Mortar Bookstores (1.02),How an MBA grad became a marketplace millionaire by selling umbrellas (1.01),HP Reinventing Traditional Computers With Mini Desktop PC (1.00),"New Apple iPad Thinner, Lighter But Still $499 (1.00)",Thanks to TheAppleBlog Sponsors! (1.00),Juice Your Apple Devices with this Fun Juice Box Charger (1.00),Amazon Introduces New Kindle Fire Tablets (1.00),The 5 best new songs you can stream right now (1.00),Your Uncharged Phone Might Not be Allowed on Some Flights (1.00),Nokia Introduces Asha Smartphones Beginning at Just $69 (1.00)
267,Euro zone business growth picks up slightly but still muted,How to Get Your Company Back in Good Standing This Summer (1.01),Are You Operating Your Business in Multiple States? What You Need to Know (1.00),Estimated Tax Payments:  Your Questions Answered (1.00),Reaching the Cloud: Dedicated Ethernet vs Public Internet Connections (1.00),"BlackBerry Plans Personal, Business Accounts On One Device (1.00)",3 Questions for You to Ask Yourself About Employee Health Care (1.00),A Quick Guide to What You Should Be Doing NOW for the Affordable Care Act (1.00),Are You Guilty of Committing the Top Incorporation Mistakes? (1.00),IRS Business Data in Pictures (1.00),"Give Quantitative, Monetary Values to Employee Benefits or Risk Attrition (1.00)"
