,title,most_similar_1,most_similar_2,most_similar_3,most_similar_4,most_similar_5,most_similar_6,most_similar_7,most_similar_8,most_similar_9,most_similar_10
157,How To Keep Customers Loyal With Coupons,One on One: Michael Wu of Lithium Technologies (1.01),25 Free WordPress Plugins for Integrating Google Features (1.00),Raghu Raghavan of Act-On: Now is the Time to Dive Into Marketing Automation (1.00),Looking for Blog Topics? @TheSalesLion Has a Few [BlogWorld Coverage] (1.00),Monster Loyalty: Savvy Engagement Tips From Lady Gaga (1.00),4 Ways to Market Your SMB With Flickr (1.00),4 Ways to Make or Save Money with a Smartphone (1.00),The 5 Types of Influencers On The Web (1.00),10 Assets for Using Tech to Keep Your Team on Track (1.00),5 Reasons SMBs Need Content Marketing (1.00)
158,The Age of the Platform Will Make You Think,SMB Owners Get Mobile Coupons For The Holidays (1.00),5 Points to Remember About Mobile SEO (1.00),Infosys is using an algorithm to identify its next top-level leaders (1.00),Google Releases Real-Time Reputation Problem (1.00),Marketing With Vine: Leveraging the Power of 6-Second Videos (1.00),The ultimate master list of revenue models used by Web and Mobile companies (1.00),"Google Adds New Features to Place Pages, Is It Enough? (1.00)",How to Promote Offline Events On The Web (1.00),45+ Tools for Content Curation and Content Marketing (1.00),You Should Consider These Things When Choosing Who To Follow On Twitter (1.00)
159,Lawn Care Services Offered on Amazon Soon,Study: 16 Percent of Yelp Reviews May Be Fakes (1.01),Retail Trends:  The Eyes Have It (1.01),"India orders four maritime spy planes from Boeing, bolsters navy (1.00)",HP Reinventing Traditional Computers With Mini Desktop PC (1.00),How an English teacher conquered China : Wisdom of Jack Ma condensed into 33 quotes (1.00),Thanks to TheAppleBlog Sponsors! (1.00),Amazon Introduces New Kindle Fire Tablets (1.00),The 5 best new songs you can stream right now (1.00),The 10 most luxurious first-class plane cabins in the world (1.00),Indie Books Now Have a Better Shot With Brick-and-Mortar Bookstores (1.00)
160,HP Announces 8 New Business Tablets,Loan Approvals Rising at Small Banks and Alternative Lenders (1.00),Estimated Tax Payments:  Your Questions Answered (1.00),10 Questions to Ask Before Applying for a Bank Loan (1.00),"Give Quantitative, Monetary Values to Employee Benefits or Risk Attrition (1.00)",Successful S-Corp Owners: Watch Out For A Tax Increase (0.99),10 Things You Need To Do After Forming An LLC (0.99),How to Get Your Company Back in Good Standing This Summer (0.99),A Quick Guide to What You Should Be Doing NOW for the Affordable Care Act (0.99),How Do Your Employee Benefits Stack Up? (0.99),Are You Guilty of Committing the Top Incorporation Mistakes? (0.99)
161,5 Ways Social Media Can Make Your Trade Show A Success,Raghu Raghavan of Act-On: Now is the Time to Dive Into Marketing Automation (1.00),Social Customers Means a Social Inbox: Review of Nimble CRM (1.00),20 Reasons People Unfollow You On Twitter (1.00),8 Daily Steps to Compete Like a Champion (1.00),4 Ways to Market Your SMB With Flickr (1.00),10 Assets for Using Tech to Keep Your Team on Track (1.00),5 Reasons SMBs Need Content Marketing (1.00),6 Ways to Create A Positive Brand Perception (1.00),How To Keep Customers Loyal With Coupons (1.00),How to Use The Linkedin Mentions Feature to Engage and Connect (1.00)
162,How to Use The Linkedin Mentions Feature to Engage and Connect,25 Free WordPress Plugins for Integrating Google Features (1.00),Raghu Raghavan of Act-On: Now is the Time to Dive Into Marketing Automation (1.00),4 Ways to Market Your SMB With Flickr (1.00),10 Assets for Using Tech to Keep Your Team on Track (1.00),5 Reasons SMBs Need Content Marketing (1.00),6 Ways to Create A Positive Brand Perception (1.00),How To Keep Customers Loyal With Coupons (1.00),5 Ways Social Media Can Make Your Trade Show A Success (1.00),Design Advice From Visual Marketing Book (1.00),6 Actually-Useful Facebook Apps For SMBs (1.00)
163,"Better Business Bureau Reviews, LinkedIn Apps and More",Facebook Wants Your Businesses On Messenger (1.00),5 Small Business Social Media Mistakes (1.00),A 30 Point Checklist for Your Startup (1.00),Google Makes Business Photos Self-Service (1.00),What Is HTML5? Do I Need It For My Business Website? (0.99),10 Social Media Books Every Small Business Owner Should Read (0.99),Manta Business Directory Upgrades to Help You Get Discovered (0.99),Twitter Chat: Is Your Brand Helping Or Hurting Your Business? (0.99),What is Canva and How Do I Use It For My Business? (0.99),LinkedIn Introduces Showcase Pages for Business (0.99)
164,Loan Approvals Rising at Small Banks and Alternative Lenders,Are You Operating Your Business in Multiple States? What You Need to Know (1.00),HP Announces 8 New Business Tablets (1.00),Estimated Tax Payments:  Your Questions Answered (1.00),10 Questions to Ask Before Applying for a Bank Loan (1.00),A Quick Guide to What You Should Be Doing NOW for the Affordable Care Act (1.00),Are You Guilty of Committing the Top Incorporation Mistakes? (1.00),Small Banks Continue to Grab Share In Small Biz Loan Market (0.99),Answers to Your Frequently Asked Questions About Incorporation (0.99),Nokia Introduces 6 Inch Phone with Business Functionality (0.99),IRS Business Data in Pictures (0.99)
165,How a Small Business Can Use Big Data,What Is HTML5? Do I Need It For My Business Website? (1.00),5 Benefits of Having a Website for Your Small Business (1.00),Receive Custom Social Content for Your Small Business With Emphatic (1.00),Outsell Yourself: Go From Hello to Sold With Ethical Business and Sales Techniques (1.00),How Are Business Books Like Restaurants? (1.00),12 Blogs Every Small Business Should Be Reading (1.00),Strategic Speed Shows How to Execute Business Strategy Fast and Well (1.00),Clate Mask of Infusionsoft: $54M Ways Your Small Business Can Benefit (1.00),The Blink Factor: Time Management Can Build or Break Your Business (1.00),A Good Sense Of Humor is Great For Your Sense Of Life and Business (1.00)
166,Odd Lots,Retail Trends:  The Eyes Have It (1.01),How an English teacher conquered China : Wisdom of Jack Ma condensed into 33 quotes (1.00),Thanks to TheAppleBlog Sponsors! (1.00),Amazon Introduces New Kindle Fire Tablets (1.00),The 5 best new songs you can stream right now (1.00),Do You Trust Your Employees to Work Remotely? (1.00),Study: 16 Percent of Yelp Reviews May Be Fakes (1.00),Ebay Adds Same Day Delivery In Dallas (1.00),Googles Russian Ad Buy Blocked On Technicality; Putins Spanner In The Works? (1.00),Here's A Brand New Thing You Didn't Know About 'Friends' (1.00)
167,Twitter is Playing Favorites With People You Follow,Tipping the Odds for the Entrepreneur (1.00),5 Points to Remember About Mobile SEO (1.00),How to Create a LinkedIn Profile That Rocks At Generating Leads (1.00),"Google Adds New Features to Place Pages, Is It Enough? (1.00)",How to Promote Offline Events On The Web (1.00),45+ Tools for Content Curation and Content Marketing (1.00),Awaken Your Productivity With Fearless At Work (1.00),"Facebook, Yelp Follow FourSquare, Launch Deals (1.00)",10 Food Franchise Technology Tools And Solutions (1.00),Present Shock: Taking A Moment to Review the Future (1.00)
168,Omnichannel done right: 4 ways to keep the communication in marketingcommunications,Social Customers Means a Social Inbox: Review of Nimble CRM (1.00),20 Reasons People Unfollow You On Twitter (1.00),Not Sure How to Use LinkedIn for B2B? Let Us Help You (1.00),4 Ways to Market Your SMB With Flickr (1.00),10 Assets for Using Tech to Keep Your Team on Track (1.00),Navigating Social Media Legal Risks: Keeping Your Marketing Legally Safe (1.00),Chris Goward: Affiliate Programs and Conversion Optimization #AMDays (1.00),6 Ways to Create A Positive Brand Perception (1.00),5 Ways Social Media Can Make Your Trade Show A Success (1.00),4 Practical SMB Uses For FourSquare (1.00)
169,Rupee down against dollar,STOCKS RALLY: Here's what you need to know (1.00),FCC Decision on Net Neutrality Coming Soon (1.00),How millions from the Bangladesh Bank heist disappeared (1.00),Here come retail sales ... (1.00),Cardamom futures remain up on rising demand (1.00),The 10 most important things in the world right now (1.00),Here come personal income and spending ... (1.00),Earnings This Week (1.00),Here comes the Baker Hughes rig count ... (1.00),Here comes the Beige Book ... (1.00)
170,4 Practical SMB Uses For FourSquare,"Exceed Your Indiegogo Goals by 1,000 Percent with These Lessons (1.01)",11 Ways to Use Twitter To Develop Sales Leads (1.00),Social Customers Means a Social Inbox: Review of Nimble CRM (1.00),20 Reasons People Unfollow You On Twitter (1.00),Not Sure How to Use LinkedIn for B2B? Let Us Help You (1.00),How to Balance Engagement and Customer Service on Twitter (1.00),LotusJump Review: Do-It-Yourself Online Marketing Service (1.00),Navigating Social Media Legal Risks: Keeping Your Marketing Legally Safe (1.00),Chris Goward: Affiliate Programs and Conversion Optimization #AMDays (1.00),Omnichannel done right: 4 ways to keep the communication in marketingcommunications (1.00)
171,Insights From Google About How Small Businesses Can Improve Sales,Mid-Year Business Review: Risk Management Edition (1.00),Build your Business Through The Economics of Integrity (1.00),Get It Together! Consolidate Your Business Systems (1.00),Getting Your Small Business Started On Yelp (1.00),28 Webinar Services for Small Business Owners (1.00),Strategic Speed Shows How to Execute Business Strategy Fast and Well (1.00),Sell Local Think Global is Loaded With Creative Marketing Ideas for Small Business (1.00),The Best Business Dashboard Apps For Small Businesses (1.00),The Blink Factor: Time Management Can Build or Break Your Business (1.00),What is Branding? And Should Small Businesses Care? (1.00)
172,Infosys is using an algorithm to identify its next top-level leaders,Looking for Blog Topics? @TheSalesLion Has a Few [BlogWorld Coverage] (1.00),SMB Owners Get Mobile Coupons For The Holidays (1.00),Tipping the Odds for the Entrepreneur (1.00),5 Points to Remember About Mobile SEO (1.00),Getting Your Invention To Market (1.00),Coca-Cola: Marketing Done Right (1.00),The Age of the Platform Will Make You Think (1.00),Google Releases Real-Time Reputation Problem (1.00),How to Create a LinkedIn Profile That Rocks At Generating Leads (1.00),Marketing With Vine: Leveraging the Power of 6-Second Videos (1.00)
173,When I had no food and only Rs 50 in my pocket  a moving story of an entrepreneur,Do You Trust Your Employees to Work Remotely? (1.01),ZenPayroll Could Change the Way You Pay (1.00),"Nexus 6 Could Compete with iPhone 6 Plus, Other Phablets (1.00)","Citysearch: Product Manager, LA (1.00)",Googles Russian Ad Buy Blocked On Technicality; Putins Spanner In The Works? (1.00),Here's A Brand New Thing You Didn't Know About 'Friends' (1.00),Entrepreneur Gary Vaynerchuk: From Personal Brand to VC Investor (1.00),Weighing the Pros and Cons of Free City WiFi (1.00),Join Me For: Choosing the RIGHT Online Software (1.00),MSFT-YHOO: Links To Coverage Across Our Sites (1.00)
174,Entrepreneur Gary Vaynerchuk: From Personal Brand to VC Investor,Do You Trust Your Employees to Work Remotely? (1.01),Franchising And Politics (1.01),Retail Trends:  The Eyes Have It (1.01),Game Plan: (1.01),"[Techie Tuesdays] A tribute to Humblefool, the best coder that ever lived in India (1.01)",How an MBA grad became a marketplace millionaire by selling umbrellas (1.01),Thanks to TheAppleBlog Sponsors! (1.00),Amazon Introduces New Kindle Fire Tablets (1.00),With great stardom comes great stress  learn how to de-stress from your favourite celebrities and leaders (1.00),The 5 best new songs you can stream right now (1.00)
175,Internet Sales Tax Bill May Stall in House of Representatives,"South Dakota, Texas Top List of Best State Tax Systems (1.00)",25 of the Best Cities for Freelancers to Work and Play (1.00),A dummy's guide to GST (1.00),New Tax Penalty Targets Health Reimbursement Accounts (1.00),Communicating to Employees About Health Insurance Open Enrollment (1.00),How to Get Your Company Back in Good Standing This Summer (1.00),Successful S-Corp Owners: Watch Out For A Tax Increase (0.99),10 Things You Need To Do After Forming An LLC (0.99),Senate Passes Internet Sales Tax; Bill Moves to House (0.99),"Robust Employment Growth, Just not for the Self-Employed (0.99)"
176,Your End of Year Legal Checklist,"BlackBerry Plans Personal, Business Accounts On One Device (1.01)",Small Business Loan Approval Drops to 18.8 Percent at Big Banks (1.00),"Small Business Loans Up at Big Banks, Down at Small Ones (1.00)",President Obama Angers Small Booksellers With Amazon Speech (1.00),Gross Fixed Capital Formation Weak at Non-Corporate Businesses (1.00),Small Business Loans Hit Record High for Third Consecutive Month (1.00),Answers to Your Frequently Asked Questions About Incorporation (1.00),"SBA Nominee Talks Marketing to Banks, Businesses at Confirmation Hearing (1.00)",As Presidential Race Tightens Small Business Plays Big Role (1.00),Euro zone business growth picks up slightly but still muted (0.99)
177,5 Small Business Social Media Mistakes,What Is HTML5? Do I Need It For My Business Website? (1.00),Facebook Wants Your Businesses On Messenger (1.00),Manta Business Directory Upgrades to Help You Get Discovered (1.00),"Better Business Bureau Reviews, LinkedIn Apps and More (1.00)",Twitter Chat: Is Your Brand Helping Or Hurting Your Business? (1.00),A 30 Point Checklist for Your Startup (1.00),LinkedIn Introduces Showcase Pages for Business (1.00),Government Resources to Help Market Your Business Overseas (1.00),Be.Lead.Do Provides Online Resource for Business Managers (1.00),Google Makes Business Photos Self-Service (1.00)
178,WitKit Platform Lets Your Team Collaborate in Security,BotBeat: This weeks top botstories (1.00),"RGB, CMYK and PMS Colors Explained (1.00)",How I increased my productivity 1.5x by experimenting with my work schedule (1.00),What New Opportunities Does Android Wear Offer for Entrepreneurs? (1.00),ReTargeter Creator Aims to Replace CRM with New Immediately App (1.00),Our Top Story This Week: A New SBA Administrator is Approved (1.00),Print Photos From Your Phone with the Prynt Smartphone Case (1.00),"CBS MarketWatch.com: Director of Ad Development, NYC (1.00)",Speed Up Your Mobile Browsing with Dolphin (1.00),10 Mindsets of Successful Entrepreneurs (1.00)
179,Peer-to-Peer Lending Club Fine-Tunes Small Business Loan Program,What Are Sunk Costs? (1.01),"Fortune 500 Thrives, But Small Businesses Not So Optimistic (1.00)",The Secret to Achieving Resolutions:  Setting Small Goals (1.00),Is It Time to Change Your Business Structure? (1.00),How Much Will the Sequester Cost Small Business Contractors? (1.00),Getting Your Business Energy Efficient Before the Holidays (1.00),Reward your Small Business with the Capital One Spark (1.00),Remote Work No Longer a Perk But a Business Imperative (1.00),Study Finds Small Business Loans Key to Startup Success (1.00),"Small Businesses Spend More on Travel, Per Concur Survey (1.00)"
180,Keurig CEO Regrets Big Mistake Made with the 2.0 Brewer,How millions from the Bangladesh Bank heist disappeared (1.00),10 things you need to know before the opening bell (1.00),Here comes the jobs report ... (1.00),Angel Investments Update Since the Economic Downturn (1.00),Employers Say Wellness Programs Work (1.00),"Demonetisation: Banks may trim base rate by 360 bps in 3-4 years, says Ambit (1.00)",Here come initial jobless claims ... (1.00),Here's the salary you have to earn to buy a home in 19 major US cities (1.00),Five Things You Need to Know to Start Your Day (1.00),USPS Cuts Saturday Mail Delivery But Will Continue Package Delivery (1.00)
181,"Reed Business Information: Online Sales Manager, LA",Ohio Weighing Major Tax Break For Small Businesses (1.00),Study Finds Small Business Loans Key to Startup Success (1.00),"Small Businesses Spend More on Travel, Per Concur Survey (1.00)",eBay Opposes Legislation Imposing New Taxes and Regulatory Burdens on Small Businesses (1.00),Celebrating National Business Etiquette Week (1.00),How a Meetup Group Led a Mompreneur to Launch a Business (1.00),What Are Sunk Costs? (1.00),Small Businesses Divided on Internet Sales Tax (1.00),Will an LLC Help Lower Your Business Taxes? (1.00),5 Things You May not Know about Small Business Taxes (1.00)
182,Ohio Weighing Major Tax Break For Small Businesses,Mompreneur Launches $3 Million Business Selling Superhero Capes (1.00),"Reed Business Information: Online Sales Manager, LA (1.00)",eBay Opposes Legislation Imposing New Taxes and Regulatory Burdens on Small Businesses (1.00),Celebrating National Business Etiquette Week (1.00),What Are Sunk Costs? (1.00),Small Businesses Divided on Internet Sales Tax (1.00),Do You Need to Notify the State of Changes to Your Business? (1.00),Will an LLC Help Lower Your Business Taxes? (1.00),5 Things You May not Know about Small Business Taxes (1.00),An Update on the Greater Opportunities for Small Business Act (1.00)
183,Euro zone business growth picks up slightly but still muted,President Obama Angers Small Booksellers With Amazon Speech (1.00),Small Banks Continue to Grab Share In Small Biz Loan Market (1.00),Answers to Your Frequently Asked Questions About Incorporation (1.00),9 Things Small Retailers Must Know to Survive and Thrive (1.00),IRS Business Data in Pictures (1.00),Small Business Loan Approval Drops to 18.8 Percent at Big Banks (0.99),Are You Operating Your Business in Multiple States? What You Need to Know (0.99),Your End of Year Legal Checklist (0.99),"BlackBerry Plans Personal, Business Accounts On One Device (0.99)",Nokia Introduces 6 Inch Phone with Business Functionality (0.99)
184,Weighing the Pros and Cons of Free City WiFi,Do You Trust Your Employees to Work Remotely? (1.01),"Nexus 6 Could Compete with iPhone 6 Plus, Other Phablets (1.01)",Join Me For: Choosing the RIGHT Online Software (1.01),MSFT-YHOO: Links To Coverage Across Our Sites (1.01),Entrepreneurs Take Us to the Edge of Outer Space (1.01),How Low Will Online Storage Costs Finally Go? (1.01),Sauca Foods:  New Flair for the Food Truck Trend (1.00),ZenPayroll Could Change the Way You Pay (1.00),With great stardom comes great stress  learn how to de-stress from your favourite celebrities and leaders (1.00),"Citysearch: Product Manager, LA (1.00)"
185,Design Advice From Visual Marketing Book,25 Free WordPress Plugins for Integrating Google Features (1.00),Raghu Raghavan of Act-On: Now is the Time to Dive Into Marketing Automation (1.00),4 Ways to Market Your SMB With Flickr (1.00),10 Assets for Using Tech to Keep Your Team on Track (1.00),5 Reasons SMBs Need Content Marketing (1.00),6 Ways to Create A Positive Brand Perception (1.00),How To Keep Customers Loyal With Coupons (1.00),5 Ways Social Media Can Make Your Trade Show A Success (1.00),How to Use The Linkedin Mentions Feature to Engage and Connect (1.00),6 Actually-Useful Facebook Apps For SMBs (1.00)
186,10 things you need to know before the opening bell,European shares lifted by solid earnings but RBS slumps (1.00),STOCKS RALLY: Here's what you need to know (1.00),How millions from the Bangladesh Bank heist disappeared (1.00),Here come retail sales ... (1.00),The 10 most important things in the world right now (1.00),Here comes the Baker Hughes rig count ... (1.00),Daily Sprout (1.00),Putin and Erdogan move towards repairing Russia-Turkey ties (1.00),"What to buy, sell and hold (1.00)",Keurig CEO Regrets Big Mistake Made with the 2.0 Brewer (1.00)
187,"Google Announces Web Designer, Enhancements to DoubleClick",Headlining the News This Week: Wix Acquires OpenRest (1.02),Ten Approaches That May Shape the Future of eCommerce (1.01),Why You Need Honest Feedback and 3 Ways to Get It (1.01),The New Picture HTML Code Could Make Your Website Load Faster (1.01),Google Improves AdWords Express Program (1.01),How to Handle a Public Relations Crisis (1.01),"Bright Light Helps Market Products, But Makes Decisions More Emotional (1.00)",How to Get Your Products Discovered with Videos (1.00),"Court Reverses $338,000 Award for User Generated Content (1.00)",Vine: Now You Can Send Video Messages Directly to Friends and Colleagues (1.00)
188,Small Business Guide to Cloud Computing,Mid-Year Business Review: Risk Management Edition (1.00),Best Small Business Books (1.00),The Small Business Guide to Getting Ready for Vacation (1.00),The Commitment Engine Inspires Small Business Growth (1.00),Small Business News: Small Biz Startup Tips (1.00),10 Tips For Organizing Your Small Business This Year (1.00),25 Top YouTube Channels for Small Business Owners and Entrepreneurs (1.00),WordStream Improves Its Free AdWords Benchmark Tool For Small Business Advertisers (1.00),"Yelp Will Allow Businesses to Sell Food, Other Services (1.00)",Upstarts: How GenY Entrepreneurs are Rocking the World of Business (1.00)
189,"New Line Cinema: Director, Interactive Marketing, LA",Mix360 Headset Promises Hi-Fi Experience From Your Smartphone (1.00),eBay Plans a New Mobile Ad Network (1.00),IDG Entertainment: Director of Marketing (1.00),60 Percent of Online Traffic Now Comes From Mobile (1.00),"Say What? Siri Voicemail Transcription Means Text, Not Talk (1.00)",Simple Loose Leaf Creates Subscription Service for Tea (1.00),"TheStreet.com: Marketing Manager, NYC (1.00)",Working at TaxiForSure is fun for sure [Fabulous Workplaces] (1.00),Local and Ecommerce Merchants Pick Up On Facekini Trend (1.00),"5 entrepreneurship lessons to learn from Colonel Sanders, the culprit responsible for your finger-licking mania (0.99)"
190,60 Percent of Online Traffic Now Comes From Mobile,Mix360 Headset Promises Hi-Fi Experience From Your Smartphone (1.00),"RGB, CMYK and PMS Colors Explained (1.00)",IDG Entertainment: Director of Marketing (1.00),"Will We Soon See a Color Kindle E-Reader, Instead of Black and White? (1.00)","New Line Cinema: Director, Interactive Marketing, LA (1.00)","Say What? Siri Voicemail Transcription Means Text, Not Talk (1.00)",Speed Up Your Mobile Browsing with Dolphin (1.00),Simple Loose Leaf Creates Subscription Service for Tea (1.00),Learn Vital Lessons by Entering The Mind of Elite Entrepreneurs (1.00),"Yahoo Unveils News Digest, Digital Magazines But Without Clear Niche (1.00)"
191,Google Releases Real-Time Reputation Problem,SMB Owners Get Mobile Coupons For The Holidays (1.01),The 2012 Local Search Ranking Factors Report Is In (1.01),Why I Linked Out on LinkedIn (1.01),Present Shock: Taking A Moment to Review the Future (1.01),Bing Gives Twitter Results Including Hashtags and Handles (1.01),Getting Comfortable With Self-Promotion (1.00),Looking for Blog Topics? @TheSalesLion Has a Few [BlogWorld Coverage] (1.00),The Evolution of Affiliate Marketing (1.00),The 5 Types of Influencers On The Web (1.00),5 Points to Remember About Mobile SEO (1.00)
192,6 Actually-Useful Facebook Apps For SMBs,"Exceed Your Indiegogo Goals by 1,000 Percent with These Lessons (1.01)",Raghu Raghavan of Act-On: Now is the Time to Dive Into Marketing Automation (1.00),Social Customers Means a Social Inbox: Review of Nimble CRM (1.00),20 Reasons People Unfollow You On Twitter (1.00),Not Sure How to Use LinkedIn for B2B? Let Us Help You (1.00),How to Balance Engagement and Customer Service on Twitter (1.00),8 Daily Steps to Compete Like a Champion (1.00),4 Ways to Market Your SMB With Flickr (1.00),10 Assets for Using Tech to Keep Your Team on Track (1.00),Navigating Social Media Legal Risks: Keeping Your Marketing Legally Safe (1.00)
193,How to Create a LinkedIn Profile That Rocks At Generating Leads,Tipping the Odds for the Entrepreneur (1.00),Purchase by Commenting on Instagram with Spreesy (1.00),5 Points to Remember About Mobile SEO (1.00),Twitter is Playing Favorites With People You Follow (1.00),Infosys is using an algorithm to identify its next top-level leaders (1.00),Nina Yiamsamatha of Foursquare: Future of Global Search is Personalized and Local (1.00),Marketing With Vine: Leveraging the Power of 6-Second Videos (1.00),"Google Adds New Features to Place Pages, Is It Enough? (1.00)",How to Promote Offline Events On The Web (1.00),45+ Tools for Content Curation and Content Marketing (1.00)
194,How Are Business Books Like Restaurants?,What Is HTML5? Do I Need It For My Business Website? (1.00),5 Benefits of Having a Website for Your Small Business (1.00),Outsell Yourself: Go From Hello to Sold With Ethical Business and Sales Techniques (1.00),How a Small Business Can Use Big Data (1.00),12 Blogs Every Small Business Should Be Reading (1.00),A Good Sense Of Humor is Great For Your Sense Of Life and Business (1.00),How 5 Small Businesses Are Using Facebook to Reach Customers (1.00),Facebook Wants Your Businesses On Messenger (0.99),Receive Custom Social Content for Your Small Business With Emphatic (0.99),Get It Together! Consolidate Your Business Systems (0.99)
195,Invisible Capital Reveals The Resources That Builds Success,Want to Learn How to Use Google Plus for Business? Of Course You Do! (0.99),What NOT to Spend On In Your Startup (0.99),How to Market Your Business on Twitter Like a Pro (0.98),New Google and New Foursquare Offerings Call Attention to Local Business Marketing (0.98),Lumiary Lights the Way for Marketing Your Online Business (0.98),5 Ways Business Intelligence and Online Marketing Can Work Together (0.98),What Not to Do When Using Internet on the Go (0.97),What Google+ Local Pages Means to Your Business (0.97),Business Book Review: iPhone And iPad App Marketing (0.97),"How to Get More Positive Customer Reviews, Using Get Five Stars (0.97)"
