,title,most_similar_1,most_similar_2,most_similar_3,most_similar_4,most_similar_5,most_similar_6,most_similar_7,most_similar_8,most_similar_9,most_similar_10
313,Clate Mask of Infusionsoft: $54M Ways Your Small Business Can Benefit,5 Benefits of Having a Website for Your Small Business (1.00),Outsell Yourself: Go From Hello to Sold With Ethical Business and Sales Techniques (1.00),How a Small Business Can Use Big Data (1.00),How best friends turned co-founders are building their dream business (1.00),12 Blogs Every Small Business Should Be Reading (1.00),Strategic Speed Shows How to Execute Business Strategy Fast and Well (1.00),The Blink Factor: Time Management Can Build or Break Your Business (1.00),10 Online Dangers Your Business Faces (1.00),A Good Sense Of Humor is Great For Your Sense Of Life and Business (1.00),50 Time Saving Tips for Small Businesses (1.00)
314,Here come ADP private payrolls ...,European shares lifted by solid earnings but RBS slumps (1.00),STOCKS RALLY: Here's what you need to know (1.00),How millions from the Bangladesh Bank heist disappeared (1.00),Here come retail sales ... (1.00),Cardamom futures remain up on rising demand (1.00),The 10 most important things in the world right now (1.00),Here come personal income and spending ... (1.00),Earnings This Week (1.00),Here comes the Baker Hughes rig count ... (1.00),Here comes the Beige Book ... (1.00)
315,What is Canva and How Do I Use It For My Business?,Survey: Businesses Benefit from Social Media Savvy (1.00),"Google Glass: Not Yet On Sale, But Already Banned in Some Businesses (1.00)",The Referral Engine: Teaching Your Business to Market Itself (1.00),Google Makes Business Photos Self-Service (1.00),Advantages of Using eCommerce Software in Your Retail Business (1.00),Facebook Wants Your Businesses On Messenger (0.99),10 Social Media Books Every Small Business Owner Should Read (0.99),Manta Business Directory Upgrades to Help You Get Discovered (0.99),"Better Business Bureau Reviews, LinkedIn Apps and More (0.99)",Twitter Chat: Is Your Brand Helping Or Hurting Your Business? (0.99)
316,Flexible Working: Win-Win For Employers and Employees,Thanks to TheAppleBlog Sponsors! (1.00),Amazon Introduces New Kindle Fire Tablets (1.00),The 5 best new songs you can stream right now (1.00),Study: 16 Percent of Yelp Reviews May Be Fakes (1.00),Ebay Adds Same Day Delivery In Dallas (1.00),Here's A Brand New Thing You Didn't Know About 'Friends' (1.00),Liquid Soap and Green Tech are Game Changers for This Entrepreneur (1.00),Lawn Care Services Offered on Amazon Soon (1.00),Odd Lots (1.00),Entrepreneur Gary Vaynerchuk: From Personal Brand to VC Investor (1.00)
317,4 Reasons Your Brand Should Avoid Facebook,11 Ways to Use Twitter To Develop Sales Leads (1.00),10 Tips for Using a Blog to Increase Email List Signups (1.00),Not Sure How to Use LinkedIn for B2B? Let Us Help You (1.00),When and How to Use Autoresponders (1.00),What Not to Do When Using Internet on the Go (1.00),20 Ways to Kick Start Your Motivation Beginning Today (1.00),LotusJump Review: Do-It-Yourself Online Marketing Service (1.00),Navigating Social Media Legal Risks: Keeping Your Marketing Legally Safe (1.00),Chris Goward: Affiliate Programs and Conversion Optimization #AMDays (1.00),How to Use Evernote to Help You Keep Your Blog Active (1.00)
318,You Should Consider These Things When Choosing Who To Follow On Twitter,Looking for Blog Topics? @TheSalesLion Has a Few [BlogWorld Coverage] (1.00),SMB Owners Get Mobile Coupons For The Holidays (1.00),Tipping the Odds for the Entrepreneur (1.00),5 Points to Remember About Mobile SEO (1.00),Getting Your Invention To Market (1.00),Coca-Cola: Marketing Done Right (1.00),The Age of the Platform Will Make You Think (1.00),Infosys is using an algorithm to identify its next top-level leaders (1.00),Google Releases Real-Time Reputation Problem (1.00),How to Create a LinkedIn Profile That Rocks At Generating Leads (1.00)
319,Ten interesting things we read this week,European shares lifted by solid earnings but RBS slumps (1.00),STOCKS RALLY: Here's what you need to know (1.00),How millions from the Bangladesh Bank heist disappeared (1.00),Here come retail sales ... (1.00),The 10 most important things in the world right now (1.00),Here come personal income and spending ... (1.00),Here comes the Baker Hughes rig count ... (1.00),Here comes the Beige Book ... (1.00),Daily Sprout (1.00),Putin and Erdogan move towards repairing Russia-Turkey ties (1.00)
320,Multi-Screen Ecommerce Strategy: Beyond the Single Shopping Screen,25 Free WordPress Plugins for Integrating Google Features (1.00),4 Ways to Market Your SMB With Flickr (1.00),How To Keep Customers Loyal With Coupons (1.00),5 Ways Social Media Can Make Your Trade Show A Success (1.00),How to Use The Linkedin Mentions Feature to Engage and Connect (1.00),Design Advice From Visual Marketing Book (1.00),Read Social Marketology to Create Profitable Social Media Marketing (1.00),Loni Stark of Adobe: Digital Marketing Solutions in the Cloud (1.00),7 Missing Elements of Your Content Strategy (1.00),Little Known Brand Monitoring Search Tricks (1.00)
321,Take the Time to Manage Customer Reviews,"Exceed Your Indiegogo Goals by 1,000 Percent with These Lessons (1.01)",11 Ways to Use Twitter To Develop Sales Leads (1.00),Social Customers Means a Social Inbox: Review of Nimble CRM (1.00),20 Reasons People Unfollow You On Twitter (1.00),Not Sure How to Use LinkedIn for B2B? Let Us Help You (1.00),How to Balance Engagement and Customer Service on Twitter (1.00),20 Ways to Kick Start Your Motivation Beginning Today (1.00),LotusJump Review: Do-It-Yourself Online Marketing Service (1.00),Navigating Social Media Legal Risks: Keeping Your Marketing Legally Safe (1.00),Chris Goward: Affiliate Programs and Conversion Optimization #AMDays (1.00)
322,RANKED: The 20 best Nintendo 64 games of all time,Thanks to TheAppleBlog Sponsors! (1.00),Do You Trust Your Employees to Work Remotely? (1.00),Study: 16 Percent of Yelp Reviews May Be Fakes (1.00),Ebay Adds Same Day Delivery In Dallas (1.00),Googles Russian Ad Buy Blocked On Technicality; Putins Spanner In The Works? (1.00),Here's A Brand New Thing You Didn't Know About 'Friends' (1.00),Liquid Soap and Green Tech are Game Changers for This Entrepreneur (1.00),Lawn Care Services Offered on Amazon Soon (1.00),Odd Lots (1.00),Entrepreneur Gary Vaynerchuk: From Personal Brand to VC Investor (1.00)
323,"Demonetisation: Banks may trim base rate by 360 bps in 3-4 years, says Ambit",European shares lifted by solid earnings but RBS slumps (1.00),STOCKS RALLY: Here's what you need to know (1.00),How millions from the Bangladesh Bank heist disappeared (1.00),The 10 most important things in the world right now (1.00),Daily Sprout (1.00),Putin and Erdogan move towards repairing Russia-Turkey ties (1.00),"What to buy, sell and hold (1.00)",Keurig CEO Regrets Big Mistake Made with the 2.0 Brewer (1.00),10 things you need to know before the opening bell (1.00),Angel Investments Since the Economic Downturn (1.00)
324,The Project Champion: A Management Best Practice,Birth to re-birth: The man who made Savita Bhabhi (1.02),New York Times Hacked Via Crafty Phishing Attack (1.01),"Vocus, Provider of PRWeb, Acquires iContact Email Marketing (1.01)",Famous Bloggers Founder Loses Domain Names (1.01),This New Online Tool Creates a Picture of Your Cash Flow (1.01),Google+ Lifts Real Names Only Policy (1.01),MYQROsites Offers New App for Mobile Marketing With QR Codes (1.01),This Startup is Using Salt to Create an Alternative to Nuclear Energy (1.01),Google Acquires Flutter And Its Gesture Technology (1.01),"WhatsApp Offers Alternative to Paid Texting, Social Sites (1.01)"
325,LinkedIn Introduces Showcase Pages for Business,What Is HTML5? Do I Need It For My Business Website? (1.00),Facebook Wants Your Businesses On Messenger (1.00),Receive Custom Social Content for Your Small Business With Emphatic (1.00),5 Small Business Social Media Mistakes (1.00),Twitter Chat: Is Your Brand Helping Or Hurting Your Business? (1.00),A 30 Point Checklist for Your Startup (1.00),Government Resources to Help Market Your Business Overseas (1.00),Be.Lead.Do Provides Online Resource for Business Managers (1.00),Google Makes Business Photos Self-Service (1.00),5 Benefits of Having a Website for Your Small Business (0.99)
326,Twitter Ads API Gives You More Advertising Options,How to Handle a Public Relations Crisis (1.01),Time is Money: Are You and Your Employees Effectively Managing It? (1.01),"Bright Light Helps Market Products, But Makes Decisions More Emotional (1.00)",How to Get Your Products Discovered with Videos (1.00),Ten Approaches That May Shape the Future of eCommerce (1.00),Twitter Officially Launches Mobile Ads Manager (1.00),5 lessons from the Bhagvad Gita for every entrepreneur (1.00),How To Integrate Your Remote Office Effectively (1.00),"Google Announces Web Designer, Enhancements to DoubleClick (1.00)",Why We Are Afraid to Talk Pricing (1.00)
327,Retail Trends:  The Eyes Have It,The 5 best new songs you can stream right now (1.01),Study: 16 Percent of Yelp Reviews May Be Fakes (1.01),Lawn Care Services Offered on Amazon Soon (1.01),Odd Lots (1.01),Entrepreneur Gary Vaynerchuk: From Personal Brand to VC Investor (1.01),Franchising And Politics (1.01),PayPal Will Change User Agreement After Robocall Concerns (1.01),Amazon AWS MarketPlace Puts Desktop Apps in the Cloud (1.01),War of Words: Reliance Jios free-data-for-three-months plan under attack (1.01),This couple bought 300 acres of land and created Indias first private wildlife sanctuary (1.01)
328,"Small Businesses Spend More on Travel, Per Concur Survey",What Are Sunk Costs? (1.01),"Fortune 500 Thrives, But Small Businesses Not So Optimistic (1.00)",Is It Time to Change Your Business Structure? (1.00),Peer-to-Peer Lending Club Fine-Tunes Small Business Loan Program (1.00),"Reed Business Information: Online Sales Manager, LA (1.00)",Getting Your Business Energy Efficient Before the Holidays (1.00),Remote Work No Longer a Perk But a Business Imperative (1.00),Study Finds Small Business Loans Key to Startup Success (1.00),eBay Opposes Legislation Imposing New Taxes and Regulatory Burdens on Small Businesses (1.00),How a Meetup Group Led a Mompreneur to Launch a Business (1.00)
329,"Yahoo: Director Product Management, Yahoo! Finance, Sunnyvale, CA",How an MBA grad became a marketplace millionaire by selling umbrellas (1.01),Thanks to TheAppleBlog Sponsors! (1.00),Do You Trust Your Employees to Work Remotely? (1.00),"Nexus 6 Could Compete with iPhone 6 Plus, Other Phablets (1.00)",Study: 16 Percent of Yelp Reviews May Be Fakes (1.00),Ebay Adds Same Day Delivery In Dallas (1.00),Googles Russian Ad Buy Blocked On Technicality; Putins Spanner In The Works? (1.00),Here's A Brand New Thing You Didn't Know About 'Friends' (1.00),Liquid Soap and Green Tech are Game Changers for This Entrepreneur (1.00),Lawn Care Services Offered on Amazon Soon (1.00)
330,Cyber Liability Insurance: Protect Your Business Online,10 Apps to Assist with Your Small Business Taxes (1.00),How the Cloud is Reshaping Small Business Productivity (1.00),Email Erases 9 to 5 at Many Small to Mid-Sized Businesses (1.00),Satanic Latte Art? How Should a Business Respond? (1.00),Small Business Disaster Survival Guide: Get Your Insurance Claims Covered (1.00),Small Business Leads To Better Economy (1.00),Top Reasons to Incorporate Your Business (1.00),How to Reinstate a Non-Compliant Business Before the End of the Year (1.00),6 eCommerce Customer Service Benchmarks for Your Business (1.00),The Island Approach: Which Are the Best Credit Cards for Small Business? (1.00)
331,Survey: Businesses Benefit from Social Media Savvy,10 Social Media Books Every Small Business Owner Should Read (1.00),Twitter Chat: Is Your Brand Helping Or Hurting Your Business? (1.00),What is Canva and How Do I Use It For My Business? (1.00),"Google Glass: Not Yet On Sale, But Already Banned in Some Businesses (1.00)",The Referral Engine: Teaching Your Business to Market Itself (1.00),Google Makes Business Photos Self-Service (1.00),Advantages of Using eCommerce Software in Your Retail Business (1.00),Facebook Wants Your Businesses On Messenger (0.99),Manta Business Directory Upgrades to Help You Get Discovered (0.99),"Better Business Bureau Reviews, LinkedIn Apps and More (0.99)"
332,16 Tips for Saving on Small Business Expenses Infographic,"Fortune 500 Thrives, But Small Businesses Not So Optimistic (1.00)",10 Apps to Assist with Your Small Business Taxes (1.00),The Secret to Achieving Resolutions:  Setting Small Goals (1.00),How Much Will the Sequester Cost Small Business Contractors? (1.00),Satanic Latte Art? How Should a Business Respond? (1.00),Top Reasons to Incorporate Your Business (1.00),Getting Your Business Energy Efficient Before the Holidays (1.00),How to Reinstate a Non-Compliant Business Before the End of the Year (1.00),Reward your Small Business with the Capital One Spark (1.00),The Island Approach: Which Are the Best Credit Cards for Small Business? (1.00)
333,"Mike Blumenthal Talks Local Search Marketing, Pigeon Update",25 Free WordPress Plugins for Integrating Google Features (1.00),Raghu Raghavan of Act-On: Now is the Time to Dive Into Marketing Automation (1.00),Social Customers Means a Social Inbox: Review of Nimble CRM (1.00),20 Reasons People Unfollow You On Twitter (1.00),8 Daily Steps to Compete Like a Champion (1.00),4 Ways to Market Your SMB With Flickr (1.00),10 Assets for Using Tech to Keep Your Team on Track (1.00),Chris Goward: Affiliate Programs and Conversion Optimization #AMDays (1.00),5 Reasons SMBs Need Content Marketing (1.00),6 Ways to Create A Positive Brand Perception (1.00)
334,Top 5 Online Credibility Killers,One on One: Michael Wu of Lithium Technologies (1.01),25 Free WordPress Plugins for Integrating Google Features (1.00),Looking for Blog Topics? @TheSalesLion Has a Few [BlogWorld Coverage] (1.00),Monster Loyalty: Savvy Engagement Tips From Lady Gaga (1.00),4 Ways to Market Your SMB With Flickr (1.00),4 Ways to Make or Save Money with a Smartphone (1.00),The Evolution of Affiliate Marketing (1.00),The 5 Types of Influencers On The Web (1.00),5 Reasons SMBs Need Content Marketing (1.00),How To Keep Customers Loyal With Coupons (1.00)
335,Google+ Lifts Real Names Only Policy,"Vocus, Provider of PRWeb, Acquires iContact Email Marketing (1.01)",Why We Are Afraid to Talk Pricing (1.01),Famous Bloggers Founder Loses Domain Names (1.01),The Project Champion: A Management Best Practice (1.01),What Are Net Promoter Scores? (1.01),"Look beyond the hype of certification, look for skills to move up in the real world (1.01)",This Startup is Using Salt to Create an Alternative to Nuclear Energy (1.01),Time is Money: Are You and Your Employees Effectively Managing It? (1.01),What is Siri? And Does Siri Have Competitors? (1.01),The Art of Pricing (1.00)
336,"VC Firm IvyCap is going into IITs, IIMs and ISB to fund startups.
Yes, Christmas just came early this year",Here comes the Baker Hughes rig count ... (1.00),Putin and Erdogan move towards repairing Russia-Turkey ties (1.00),"What to buy, sell and hold (1.00)",Banks and tech firms apply blockchain to trade finance (1.00),Here come ADP private payrolls ... (1.00),Ten interesting things we read this week (1.00),Netgear Offers Storage Alternatives to the Cloud (1.00),Introduction To Franchising (1.00),Here comes consumer confidence ... (1.00),Are Immigrants Really More Likely to Become High Tech Entrepreneurs? (1.00)
337,Awaken Your Productivity With Fearless At Work,Headlining the News This Week: Wix Acquires OpenRest (1.02),Vine: Now You Can Send Video Messages Directly to Friends and Colleagues (1.01),"Facebook, Yelp Follow FourSquare, Launch Deals (1.01)",9 Holiday Marketing Tips to Make Your Retail Store Stand Out (1.01),Save the Date for a Twitter Chat: Demystifying Data Backup (1.01),Google Improves AdWords Express Program (1.01),10 Food Franchise Technology Tools And Solutions (1.01),Spotlight: Studypool Provides Fast Online Homework Help (1.01),10 Reasons to Be Optimistic Looking Forward (1.01),6 Things Customers Want from Retail Stores and How You Can Deliver (1.01)
338,Small Business Loans Hit Record High for Third Consecutive Month,"BlackBerry Plans Personal, Business Accounts On One Device (1.01)",Small Business Loan Approval Drops to 18.8 Percent at Big Banks (1.00),"Small Business Loans Up at Big Banks, Down at Small Ones (1.00)",President Obama Angers Small Booksellers With Amazon Speech (1.00),Your End of Year Legal Checklist (1.00),Gross Fixed Capital Formation Weak at Non-Corporate Businesses (1.00),Small Business Job Growth Dips in January (1.00),"SBA Nominee Talks Marketing to Banks, Businesses at Confirmation Hearing (1.00)",Lessons Learned From Your 2013 Tax Return (1.00),As Presidential Race Tightens Small Business Plays Big Role (1.00)
339,Best Places to Turn Your Website Into an App for Android and iPhone,Social Customers Means a Social Inbox: Review of Nimble CRM (1.00),20 Reasons People Unfollow You On Twitter (1.00),4 Ways to Market Your SMB With Flickr (1.00),10 Assets for Using Tech to Keep Your Team on Track (1.00),5 Ways Social Media Can Make Your Trade Show A Success (1.00),6 Actually-Useful Facebook Apps For SMBs (1.00),What is Periscope and How Do I Use It? (1.00),"Email Marketing is Not Dead, Bring it Back to Life With These Resources (1.00)",Behind the Book: Anita Campbell Talks About Visual Marketing (1.00),Learn How to Improve Online Marketing: Performance Marketing With Google Analytics (1.00)
340,How Do I Update WordPress Plugins Automatically?,Looking for Blog Topics? @TheSalesLion Has a Few [BlogWorld Coverage] (1.00),SMB Owners Get Mobile Coupons For The Holidays (1.00),Google Releases Real-Time Reputation Problem (1.00),The ultimate master list of revenue models used by Web and Mobile companies (1.00),How to Promote Offline Events On The Web (1.00),The 2012 Local Search Ranking Factors Report Is In (1.00),Why I Linked Out on LinkedIn (1.00),Present Shock: Taking A Moment to Review the Future (1.00),SMB Marketing Is About Telling Your Story (1.00),Bieber Invests in Social Media for Teens (1.00)
341,When To Respond To Negative Reviews (and not),5 Ways to Avoid BYOD Nightmares (1.01),"Exceed Your Indiegogo Goals by 1,000 Percent with These Lessons (1.01)",11 Ways to Use Twitter To Develop Sales Leads (1.00),10 Tips for Using a Blog to Increase Email List Signups (1.00),Not Sure How to Use LinkedIn for B2B? Let Us Help You (1.00),When and How to Use Autoresponders (1.00),What Not to Do When Using Internet on the Go (1.00),How to Balance Engagement and Customer Service on Twitter (1.00),20 Ways to Kick Start Your Motivation Beginning Today (1.00),LotusJump Review: Do-It-Yourself Online Marketing Service (1.00)
342,15 Startup Mistakes You Should Avoid,7 Missing Elements of Your Content Strategy (1.00),"Mike Blumenthal Talks Local Search Marketing, Pigeon Update (1.00)",10 Reasons to Boost Your Twitter Presence (1.00),25 Free WordPress Plugins for Integrating Google Features (0.99),Raghu Raghavan of Act-On: Now is the Time to Dive Into Marketing Automation (0.99),Social Customers Means a Social Inbox: Review of Nimble CRM (0.99),20 Reasons People Unfollow You On Twitter (0.99),8 Daily Steps to Compete Like a Champion (0.99),4 Ways to Market Your SMB With Flickr (0.99),4 Ways to Make or Save Money with a Smartphone (0.99)
343,Answers to Your Frequently Asked Questions About Incorporation,IRS Business Data in Pictures (1.01),Small Business Loan Approval Drops to 18.8 Percent at Big Banks (1.00),Are You Operating Your Business in Multiple States? What You Need to Know (1.00),President Obama Angers Small Booksellers With Amazon Speech (1.00),Your End of Year Legal Checklist (1.00),Euro zone business growth picks up slightly but still muted (1.00),Small Banks Continue to Grab Share In Small Biz Loan Market (1.00),"BlackBerry Plans Personal, Business Accounts On One Device (1.00)",9 Things Small Retailers Must Know to Survive and Thrive (1.00),"SBA Nominee Talks Marketing to Banks, Businesses at Confirmation Hearing (1.00)"
344,Book Review: The Constant Contact Guide to Email Marketing,11 Ways to Use Twitter To Develop Sales Leads (1.00),10 Tips for Using a Blog to Increase Email List Signups (1.00),When and How to Use Autoresponders (1.00),What Not to Do When Using Internet on the Go (1.00),20 Ways to Kick Start Your Motivation Beginning Today (1.00),LotusJump Review: Do-It-Yourself Online Marketing Service (1.00),Navigating Social Media Legal Risks: Keeping Your Marketing Legally Safe (1.00),How to Use Evernote to Help You Keep Your Blog Active (1.00),4 Practical SMB Uses For FourSquare (1.00),How to Use Criminal Background Checks and Not Get Sued (1.00)
345,Podio Launches Video Conference App,Time is Money: Are You and Your Employees Effectively Managing It? (1.01),5 lessons from the Bhagvad Gita for every entrepreneur (1.00),"Vocus, Provider of PRWeb, Acquires iContact Email Marketing (1.00)",Why We Are Afraid to Talk Pricing (1.00),Famous Bloggers Founder Loses Domain Names (1.00),The Project Champion: A Management Best Practice (1.00),Google+ Lifts Real Names Only Policy (1.00),What Are Net Promoter Scores? (1.00),"Look beyond the hype of certification, look for skills to move up in the real world (1.00)","Fraudulent DMCA Takedown Requests: Finally, a Lid on Them? (1.00)"
346,This couple bought 300 acres of land and created Indias first private wildlife sanctuary,Retail Trends:  The Eyes Have It (1.01),"India orders four maritime spy planes from Boeing, bolsters navy (1.00)",How an English teacher conquered China : Wisdom of Jack Ma condensed into 33 quotes (1.00),Thanks to TheAppleBlog Sponsors! (1.00),Amazon Introduces New Kindle Fire Tablets (1.00),The 5 best new songs you can stream right now (1.00),The 10 most luxurious first-class plane cabins in the world (1.00),Indie Books Now Have a Better Shot With Brick-and-Mortar Bookstores (1.00),Study: 16 Percent of Yelp Reviews May Be Fakes (1.00),Kid Inventors Come Up With Creative Environmental Solutions (1.00)
347,"Yelp Loses Money, But Hits 100 Million Visitors",Do You Trust Your Employees to Work Remotely? (1.00),"Nexus 6 Could Compete with iPhone 6 Plus, Other Phablets (1.00)",Weighing the Pros and Cons of Free City WiFi (1.00),Join Me For: Choosing the RIGHT Online Software (1.00),"[Techie Tuesdays] A tribute to Humblefool, the best coder that ever lived in India (1.00)",Entrepreneurs Take Us to the Edge of Outer Space (1.00),How Low Will Online Storage Costs Finally Go? (1.00),How an MBA grad became a marketplace millionaire by selling umbrellas (1.00),Sauca Foods:  New Flair for the Food Truck Trend (0.99),ZenPayroll Could Change the Way You Pay (0.99)
348,These 19 companies are racing to put driverless cars on the road by 2020,"India orders four maritime spy planes from Boeing, bolsters navy (1.00)",The 5 best new songs you can stream right now (1.00),"Up close & personal: How Sunny Leone handles stocks, land, gold, other assets (1.00)",The 10 most luxurious first-class plane cabins in the world (1.00),Indie Books Now Have a Better Shot With Brick-and-Mortar Bookstores (1.00),"Reliance Jio is yet to be launched, but is already breaking rules (1.00)",Study: 16 Percent of Yelp Reviews May Be Fakes (1.00),Kid Inventors Come Up With Creative Environmental Solutions (1.00),Microsoft Temporarily Cuts the Price on the Surface 2 (1.00),Who Has the Better Job: Software Developer or Architect? (1.00)
349,Review of Hootsuite: Manage Social Media From A Single Dashboard,11 Ways to Use Twitter To Develop Sales Leads (1.00),10 Tips for Using a Blog to Increase Email List Signups (1.00),Not Sure How to Use LinkedIn for B2B? Let Us Help You (1.00),When and How to Use Autoresponders (1.00),What Not to Do When Using Internet on the Go (1.00),20 Ways to Kick Start Your Motivation Beginning Today (1.00),LotusJump Review: Do-It-Yourself Online Marketing Service (1.00),Navigating Social Media Legal Risks: Keeping Your Marketing Legally Safe (1.00),How to Use Evernote to Help You Keep Your Blog Active (1.00),4 Practical SMB Uses For FourSquare (1.00)
350,How to Claim a YouTube Custom Channel URL,"Vocus, Provider of PRWeb, Acquires iContact Email Marketing (1.00)",Why We Are Afraid to Talk Pricing (1.00),Famous Bloggers Founder Loses Domain Names (1.00),The Project Champion: A Management Best Practice (1.00),Google+ Lifts Real Names Only Policy (1.00),What Are Net Promoter Scores? (1.00),"Look beyond the hype of certification, look for skills to move up in the real world (1.00)",Birth to re-birth: The man who made Savita Bhabhi (1.00),This Startup is Using Salt to Create an Alternative to Nuclear Energy (1.00),Time is Money: Are You and Your Employees Effectively Managing It? (1.00)
351,Amazon Innovates With New Tablets and e-Readers,Do You Trust Your Employees to Work Remotely? (1.00),"Nexus 6 Could Compete with iPhone 6 Plus, Other Phablets (1.00)",Googles Russian Ad Buy Blocked On Technicality; Putins Spanner In The Works? (1.00),Here's A Brand New Thing You Didn't Know About 'Friends' (1.00),Liquid Soap and Green Tech are Game Changers for This Entrepreneur (1.00),Odd Lots (1.00),Entrepreneur Gary Vaynerchuk: From Personal Brand to VC Investor (1.00),Weighing the Pros and Cons of Free City WiFi (1.00),Lenovo A7000 Phablet Offers Super Sound and Little Interference (1.00),Join Me For: Choosing the RIGHT Online Software (1.00)
