,title,most_similar_1,most_similar_2,most_similar_3,most_similar_4,most_similar_5,most_similar_6,most_similar_7,most_similar_8,most_similar_9,most_similar_10
765,Spotlight: Studypool Provides Fast Online Homework Help,Franchising: The Importance Of Great Systems Within The System (1.04),What Are Net Promoter Scores? (1.01),5 Surprising Mobile Search Statistics and Facts (1.01),"Fraudulent DMCA Takedown Requests: Finally, a Lid on Them? (1.01)",Headlining the News This Week: Wix Acquires OpenRest (1.01),"Brands Doing More Content Marketing with Less Return, TrackMaven Says (1.00)","Jupitermedia: Media Analyst, NYC (1.00)",How to Turn Around a Bad Review Online Successfully (1.00),Twitter Officially Launches Mobile Ads Manager (1.00),Why Networking in Person Still Matters (1.00)
766,20 Free Social Media Monitoring Tools You Should be Using,8 Daily Steps to Compete Like a Champion (1.01),Time and Expense Tracking Apps: 27 Solutions (1.01),Outright: Simple Online Bookkeeping for Sole Proprietors (1.01),Big News: Quickbooks Competitor Intacct Targets the SMB Market (1.01),3 Ways to Look at Marketing (1.00),11 Ways to Use Twitter To Develop Sales Leads (1.00),Better Online Marketing Optimization Through Google Analytics: A Book Review (1.00),Raghu Raghavan of Act-On: Now is the Time to Dive Into Marketing Automation (1.00),Social Customers Means a Social Inbox: Review of Nimble CRM (1.00),20 Reasons People Unfollow You On Twitter (1.00)
767,"Who Is Visiting our Site, Why, And What We Do About It",How To Integrate Your Remote Office Effectively (1.01),Business Insider is hiring a paid social media intern for our video team. Apply now! (1.01),What Makes You Stand Out When Job Hunting? (1.01),Why to Think Twice About Green Labels (1.01),"Meet Byju, whos changing the way India learns (1.00)",4 Ways to Make or Save Money with a Smartphone (1.00),SMB Owners Get Mobile Coupons For The Holidays (1.00),Purchase by Commenting on Instagram with Spreesy (1.00),5 Points to Remember About Mobile SEO (1.00),Coca-Cola: Marketing Done Right (1.00)
768,Be.Lead.Do Provides Online Resource for Business Managers,Black Business Secrets Offers Tips to a New Generation of African American Entrepreneurs (1.01),Hacking of Google Maps May Have Killed This Business (1.00),5 Benefits of Having a Website for Your Small Business (1.00),Receive Custom Social Content for Your Small Business With Emphatic (1.00),"Better Business Bureau Reviews, LinkedIn Apps and More (1.00)",How a Small Business Can Use Big Data (1.00),How Are Business Books Like Restaurants? (1.00),3 Key Business Marketing Trends for 2014 (1.00),12 Blogs Every Small Business Should Be Reading (1.00),Twitter Chat: Is Your Brand Helping Or Hurting Your Business? (1.00)
769,"Yahoo Unveils News Digest, Digital Magazines But Without Clear Niche",CorpNet Adds Free Meeting Minutes and Corporate Document Templates (1.01),"5 entrepreneurship lessons to learn from Colonel Sanders, the culprit responsible for your finger-licking mania (1.00)",Artsy Central Shows Trend Toward Etsy Alternatives (1.00),BotBeat: This weeks top botstories (1.00),Amazon Takes Aim at Etsy with Handmade (1.00),How Do Consumers Buy Online? (1.00),WitKit Platform Lets Your Team Collaborate in Security (1.00),Do Your Customers Look Forward to Seeing You? (1.00),What New Opportunities Does Android Wear Offer for Entrepreneurs? (1.00),Facebook Messenger hits 1 billion users (1.00)
770,Managing Different Generations in the Workplace,3 Ways to Look at Marketing (1.01),Better Online Marketing Optimization Through Google Analytics: A Book Review (1.01),Raghu Raghavan of Act-On: Now is the Time to Dive Into Marketing Automation (1.01),Social Customers Means a Social Inbox: Review of Nimble CRM (1.01),How to Leverage Infographics for B2B Marketing (1.01),Not Sure How to Use LinkedIn for B2B? Let Us Help You (1.01),Monster Loyalty: Savvy Engagement Tips From Lady Gaga (1.01),How to Balance Engagement and Customer Service on Twitter (1.01),4 Ways to Market Your SMB With Flickr (1.01),Review: Attention! This Book Will Make You Money (1.01)
771,"HP Did Better Than The Market on PC Sales, But Mum About Mobile",How Do Consumers Buy Online? (1.01),CorpNet Adds Free Meeting Minutes and Corporate Document Templates (1.01),Getting In The Game Puts Your Start Up Investment on the Board (1.01),"5 entrepreneurship lessons to learn from Colonel Sanders, the culprit responsible for your finger-licking mania (1.00)",Adobe Acquires Fotolia for $800 Million (1.00),Artsy Central Shows Trend Toward Etsy Alternatives (1.00),BotBeat: This weeks top botstories (1.00),Amazon Takes Aim at Etsy with Handmade (1.00),WitKit Platform Lets Your Team Collaborate in Security (1.00),"This Hyderabad-based startup aims to aggregate cabs, food and mobile recharge apps (1.00)"
772,Top Small Business News This Week: May 17,10 Apps to Assist with Your Small Business Taxes (1.00),The Secret to Achieving Resolutions:  Setting Small Goals (1.00),How the Cloud is Reshaping Small Business Productivity (1.00),Is It Time to Change Your Business Structure? (1.00),How Cloud Computing Can Help You Scale Your Business (1.00),Email Erases 9 to 5 at Many Small to Mid-Sized Businesses (1.00),Satanic Latte Art? How Should a Business Respond? (1.00),Small Business Disaster Survival Guide: Get Your Insurance Claims Covered (1.00),How to Turn Your Hobby Into a Business (1.00),Top Reasons to Incorporate Your Business (1.00)
773,LIVE: Auto sales,Finding Success Empowering Lifestyle Entrepreneurs (1.01),How 2 of the world's most powerful and dangerous drug lords compare (1.00),10 things you need to know in markets today (1.00),FCC Decision on Net Neutrality Coming Soon (1.00),Here come retail sales ... (1.00),The Daily Sprout (1.00),Cardamom futures remain up on rising demand (1.00),"Up close & personal: How Sunny Leone handles stocks, land, gold, other assets (1.00)",Here come personal income and spending ... (1.00),Earnings This Week (1.00)
774,"21 Year Old Solves Own Acne Problem, Builds Business",The Secret to Achieving Resolutions:  Setting Small Goals (1.01),Your New Year Small Business Checklist (1.01),"Fortune 500 Thrives, But Small Businesses Not So Optimistic (1.00)",10 Apps to Assist with Your Small Business Taxes (1.00),How the Cloud is Reshaping Small Business Productivity (1.00),Is It Time to Change Your Business Structure? (1.00),How Cloud Computing Can Help You Scale Your Business (1.00),Email Erases 9 to 5 at Many Small to Mid-Sized Businesses (1.00),Satanic Latte Art? How Should a Business Respond? (1.00),Small Business Disaster Survival Guide: Get Your Insurance Claims Covered (1.00)
775,11 things to do in your 20s to become a millionaire by 30,The Christmas Conspiracy (1.01),Finding Success Empowering Lifestyle Entrepreneurs (1.01),1001 Startup Ideas - Place for connecting students to micro-jobs (1.01),How 2 of the world's most powerful and dangerous drug lords compare (1.00),10 things you need to know in markets today (1.00),FCC Decision on Net Neutrality Coming Soon (1.00),Victoria's Secret supermodel reveals everything she eats in a day (1.00),Microsoft Makes $44.6 Billion Cash And Stock Bid For Yahoo; 62 Percent Premium (1.00),How an English teacher conquered China : Wisdom of Jack Ma condensed into 33 quotes (1.00),Cardamom futures remain up on rising demand (1.00)
776,Planning a Summer Move: Move Your Corporation From One State to Another,10 things you need to know before the opening bell (1.00),Plastic Preferred: Cash To Decline to Just 23% of Purchases (1.00),Franchising In The Downturn And Recovery (1.00),China extends Marriott-Starwood deal review by up to 60 days (1.00),"Demonetisation: RBI relaxes loan repayment norms for banks, NBFCs (1.00)",Here comes the jobs report ... (1.00),Angel Investments Update Since the Economic Downturn (1.00),"Despite the Hype, Few Study Entrepreneurship (1.00)",10 real problems in India startups can aim to solve (1.00),Five Things You Need to Know to Start Your Day (1.00)
777,New LG Smartphone Added to the G3 Line Has a Stylus Pen,Indie Books Now Have a Better Shot With Brick-and-Mortar Bookstores (1.01),Getting In The Game Puts Your Start Up Investment on the Board (1.01),"5 entrepreneurship lessons to learn from Colonel Sanders, the culprit responsible for your finger-licking mania (1.00)",Sauca Foods:  New Flair for the Food Truck Trend (1.00),Days Are Numbered for the LG Google Nexus 5 (1.00),Audiam Wants to Find Money for Musicians on YouTube (1.00),"Nexus 6 Could Compete with iPhone 6 Plus, Other Phablets (1.00)","China Based Huawei Introduces Five New Devices, Eyes U.S. Market (1.00)","Citysearch: Product Manager, LA (1.00)","Community Connect: Product Strategist, NYC (1.00)"
778,Rs 1 Cr sales in four months  how a software engineer is giving Mandyas debt-ridden farmers a new lease of life,The Christmas Conspiracy (1.01),Finding Success Empowering Lifestyle Entrepreneurs (1.01),How 2 of the world's most powerful and dangerous drug lords compare (1.00),10 things you need to know in markets today (1.00),FCC Decision on Net Neutrality Coming Soon (1.00),Here come retail sales ... (1.00),The Daily Sprout (1.00),Cardamom futures remain up on rising demand (1.00),"Etsy Balances Needs of Sellers, Stockholders as IPO Gets Under Way (1.00)","Up close & personal: How Sunny Leone handles stocks, land, gold, other assets (1.00)"
779,Amazon Launches a Phone! Fire Has a Scan and Buy Feature,Indie Books Now Have a Better Shot With Brick-and-Mortar Bookstores (1.01),Getting In The Game Puts Your Start Up Investment on the Board (1.01),Days Are Numbered for the LG Google Nexus 5 (1.00),"Nexus 6 Could Compete with iPhone 6 Plus, Other Phablets (1.00)","Citysearch: Product Manager, LA (1.00)",Nokia Introduces Asha Smartphones Beginning at Just $69 (1.00),Verizon Plans to Acquire Content Delivery Network EdgeCast (1.00),The Kodak Pixpro SP360 Sports a 360 Degree Camera (1.00),Lenovo A7000 Phablet Offers Super Sound and Little Interference (1.00),First Smartphone Anti-Theft Law Could Also Make Reselling Phones Hard (1.00)
780,"Hotpot Loses Identity, Gets Merged Into Places",Franchising: The Importance Of Great Systems Within The System (1.02),Google Improves AdWords Express Program (1.01),Infusionsoft Gmail Integration is Now Available (1.01),RebelMouse CMS Lets You Share Posts from Across the Web (1.01),How to Get Your Products Discovered with Videos (1.00),"Court Reverses $338,000 Award for User Generated Content (1.00)","Brands Doing More Content Marketing with Less Return, TrackMaven Says (1.00)",Vine: Now You Can Send Video Messages Directly to Friends and Colleagues (1.00),"Culture, Career Development and Networking Blend in Black Faces In White Places (1.00)",The Art of Pricing (1.00)
781,Q2 Earnings Announcements This Week,Finding Success Empowering Lifestyle Entrepreneurs (1.01),"Upstart: Backers Invest in You, And Your Future Earnings Repay Them (1.01)",1001 Startup Ideas - Place for connecting students to micro-jobs (1.01),SMBs Make Hopeful 2011 New Year Resolutions (1.01),How 2 of the world's most powerful and dangerous drug lords compare (1.00),FCC Decision on Net Neutrality Coming Soon (1.00),Victoria's Secret supermodel reveals everything she eats in a day (1.00),Microsoft Makes $44.6 Billion Cash And Stock Bid For Yahoo; 62 Percent Premium (1.00),How an English teacher conquered China : Wisdom of Jack Ma condensed into 33 quotes (1.00),"Etsy Balances Needs of Sellers, Stockholders as IPO Gets Under Way (1.00)"
782,Entrepreneur Cleans Up With Handmade Product Businesses,Mid-Year Business Review: Risk Management Edition (1.00),Best Small Business Books (1.00),Is Your Small Business Marketing to Hispanic Consumers? (1.00),Going Mobile: Does Your Small Business Need an App? (1.00),Quantify Lets You Shop For Your Next Business Consultant Online (1.00),The Small Business Guide to Getting Ready for Vacation (1.00),The Commitment Engine Inspires Small Business Growth (1.00),Small Business News: Small Biz Startup Tips (1.00),10 Tips For Organizing Your Small Business This Year (1.00),25 Top YouTube Channels for Small Business Owners and Entrepreneurs (1.00)
783,The First Consumer 3D Printer Is Now In Crowdfunding,The 5 best new songs you can stream right now (1.01),Indie Books Now Have a Better Shot With Brick-and-Mortar Bookstores (1.01),Want to build a billion dollar organisation without VC money? Learn from Sridhar Vembu (1.01),Liquid Soap and Green Tech are Game Changers for This Entrepreneur (1.01),UPS Considers Delivery Drones Too (1.01),RANKED: The 20 best Nintendo 64 games of all time (1.01),Game Plan: (1.01),"[Techie Tuesdays] A tribute to Humblefool, the best coder that ever lived in India (1.01)",How an MBA grad became a marketplace millionaire by selling umbrellas (1.01),Types of Franchises And How To Find Them (1.01)
784,Amazon Cloud Storage is Unlimited but Budget Friendly,Want to build a billion dollar organisation without VC money? Learn from Sridhar Vembu (1.01),Victoria's Secret supermodel reveals everything she eats in a day (1.00),Microsoft Makes $44.6 Billion Cash And Stock Bid For Yahoo; 62 Percent Premium (1.00),How an English teacher conquered China : Wisdom of Jack Ma condensed into 33 quotes (1.00),"Etsy Balances Needs of Sellers, Stockholders as IPO Gets Under Way (1.00)",Kid Inventors Come Up With Creative Environmental Solutions (1.00),Microsoft Temporarily Cuts the Price on the Surface 2 (1.00),Ebay Adds Same Day Delivery In Dallas (1.00),Liquid Soap and Green Tech are Game Changers for This Entrepreneur (1.00),Entrepreneur Gary Vaynerchuk: From Personal Brand to VC Investor (1.00)
785,IRS Claims Small Businesses Underreporting Cash Payments,"Fortune 500 Thrives, But Small Businesses Not So Optimistic (1.00)",94 Percent of People Think Buying From Small Businesses is Important (1.00),5 Tips for Buying a Franchise (1.00),Protecting Small Business Intellectual Property (1.00),Peer-to-Peer Lending Club Fine-Tunes Small Business Loan Program (1.00),Ohio Weighing Major Tax Break For Small Businesses (1.00),Getting Your Business Energy Efficient Before the Holidays (1.00),How to Turn Your Home Brewing Hobby into a Business (1.00),Remote Work No Longer a Perk But a Business Imperative (1.00),Study Finds Small Business Loans Key to Startup Success (1.00)
786,Twitter Attack Caused Thousands to Retweet a Single Message,Offer Newsletter Sign Up Incentives to Your Site Visitors With Incentivibe (1.01),Local and Ecommerce Merchants Pick Up On Facekini Trend (1.01),Google Acquisition of Motorola Finally Closes: Why You Should Care (1.00),"Bright Light Helps Market Products, But Makes Decisions More Emotional (1.00)",Top Jobs Of The Week In Digital Media And Mobile Content (1.00),Enterprise Cloud Services Retooled as Google for Work (1.00),This New Online Tool Creates a Picture of Your Cash Flow (1.00),Podio Launches Video Conference App (1.00),"Google Updates Listings, Crowdfunding Campaigns Extended (1.00)","Haiku Deck Offers PowerPoint Alternative, Fewer Features Touted (1.00)"
787,Internet Sales Tax Issue Still Lives Despite Activist Claims,Do You Trust Your Employees to Work Remotely? (1.03),Senate Passes Internet Sales Tax; Bill Moves to House (1.01),How to Get a Startup Visa Act Passed (1.01),Pricing pressure in US biz cyclical in nature: Cadila Health (1.01),Consumer Attitudes Indicate a New Year with Old Spending Habits (1.01),On the Long Road to Economic Recovery? You Decide (1.00),How Venture Capital Deals Have Changed Since the Great Recession (1.00),HP Announces 8 New Business Tablets (1.00),Angel Investments Since the Economic Downturn (1.00),Plastic Preferred: Cash To Decline to Just 23% of Purchases (1.00)
788,"Google Databoard Lets You View Research, Create Infographics",How To Integrate Your Remote Office Effectively (1.01),Business Insider is hiring a paid social media intern for our video team. Apply now! (1.01),Zapier Zaps Your Data from One App to Another With One Click (1.00),"Meet Byju, whos changing the way India learns (1.00)",SMB Owners Get Mobile Coupons For The Holidays (1.00),Purchase by Commenting on Instagram with Spreesy (1.00),Getting Your Invention To Market (1.00),Coca-Cola: Marketing Done Right (1.00),Make Your App Development Easier: Programming JavaScript Applications (1.00),How to Create a LinkedIn Profile That Rocks At Generating Leads (1.00)
789,Are You Guilty of Committing the Top Incorporation Mistakes?,How to Get Your Company Back in Good Standing This Summer (1.01),Are You Operating Your Business in Multiple States? What You Need to Know (1.00),Euro zone business growth picks up slightly but still muted (1.00),Estimated Tax Payments:  Your Questions Answered (1.00),Small Banks Continue to Grab Share In Small Biz Loan Market (1.00),"BlackBerry Plans Personal, Business Accounts On One Device (1.00)",3 Questions for You to Ask Yourself About Employee Health Care (1.00),"SBA Nominee Talks Marketing to Banks, Businesses at Confirmation Hearing (1.00)",A Quick Guide to What You Should Be Doing NOW for the Affordable Care Act (1.00),IRS Business Data in Pictures (1.00)
790,12 Apps to Help Ease Anxiety,Franchising: The Importance Of Great Systems Within The System (1.04),"Fraudulent DMCA Takedown Requests: Finally, a Lid on Them? (1.01)",Infusionsoft Gmail Integration is Now Available (1.01),How to Get Your Products Discovered with Videos (1.00),"Brands Doing More Content Marketing with Less Return, TrackMaven Says (1.00)",Vine: Now You Can Send Video Messages Directly to Friends and Colleagues (1.00),"Culture, Career Development and Networking Blend in Black Faces In White Places (1.00)",Social Media Customer Care Company Raises $1 Million for Growth (1.00),Infosys is using an algorithm to identify its next top-level leaders (1.00),"The Rumors Are True, Facebook Gets Hashtags (1.00)"
791,50 Time Saving Tips for Small Businesses,Build your Business Through The Economics of Integrity (1.00),Hacking of Google Maps May Have Killed This Business (1.00),Get It Together! Consolidate Your Business Systems (1.00),The Creative Small Business and 4 Ways to Get There (1.00),Getting Your Small Business Started On Yelp (1.00),Chekkt: A Place To Discover Business Management Software (1.00),How best friends turned co-founders are building their dream business (1.00),12 Blogs Every Small Business Should Be Reading (1.00),Tips for Tracking Employee Time Effectively in Your Business (1.00),Clate Mask of Infusionsoft: $54M Ways Your Small Business Can Benefit (1.00)
792,Cash ban positive in long-run; investment push needed: Experts,Victoria's Secret supermodel reveals everything she eats in a day (1.00),Microsoft Makes $44.6 Billion Cash And Stock Bid For Yahoo; 62 Percent Premium (1.00),How an English teacher conquered China : Wisdom of Jack Ma condensed into 33 quotes (1.00),"Etsy Balances Needs of Sellers, Stockholders as IPO Gets Under Way (1.00)",The 20 best smartphones in the world (1.00),Here comes consumer confidence... (1.00),Kid Inventors Come Up With Creative Environmental Solutions (1.00),Want to build a billion dollar organisation without VC money? Learn from Sridhar Vembu (1.00),The Christmas Conspiracy (1.00),PayPal Will Change User Agreement After Robocall Concerns (1.00)
793,Infusionsoft Gmail Integration is Now Available,Franchising: The Importance Of Great Systems Within The System (1.04),How to Get Your Products Discovered with Videos (1.01),"Brands Doing More Content Marketing with Less Return, TrackMaven Says (1.01)",Vine: Now You Can Send Video Messages Directly to Friends and Colleagues (1.01),"Culture, Career Development and Networking Blend in Black Faces In White Places (1.01)",Social Media Customer Care Company Raises $1 Million for Growth (1.01),Twitter Ads API Gives You More Advertising Options (1.01),Sustainable Startups Using Technology to Make Use of Food Waste (1.01),Why You Need Honest Feedback and 3 Ways to Get It (1.01),Web.com Moves Into Mobile Marketing With SmartCalls (1.01)
794,What is Siri? And Does Siri Have Competitors?,Franchising: The Importance Of Great Systems Within The System (1.02),Headlining the News This Week: Wix Acquires OpenRest (1.02),"Jupitermedia: Media Analyst, NYC (1.01)","WhatsApp Offers Alternative to Paid Texting, Social Sites (1.01)",WixMusic Lets Musicians Set the Tempo for Their Brand (1.01),Apple Pays $200 Million for Topsy (1.01),Google Acquisition of Motorola Finally Closes: Why You Should Care (1.00),"Bright Light Helps Market Products, But Makes Decisions More Emotional (1.00)",Twitter Officially Launches Mobile Ads Manager (1.00),Enterprise Cloud Services Retooled as Google for Work (1.00)
795,Tech Startup Viddler is a Hometown Success Story,Want to build a billion dollar organisation without VC money? Learn from Sridhar Vembu (1.00),"Intuit Will Acquire Check App, Deal is Worth $360 Million (0.99)","India orders four maritime spy planes from Boeing, bolsters navy (0.99)",Victoria's Secret supermodel reveals everything she eats in a day (0.99),Microsoft Makes $44.6 Billion Cash And Stock Bid For Yahoo; 62 Percent Premium (0.99),How an English teacher conquered China : Wisdom of Jack Ma condensed into 33 quotes (0.99),With great stardom comes great stress  learn how to de-stress from your favourite celebrities and leaders (0.99),"Etsy Balances Needs of Sellers, Stockholders as IPO Gets Under Way (0.99)","Reliance Jio is yet to be launched, but is already breaking rules (0.99)",Kid Inventors Come Up With Creative Environmental Solutions (0.99)
796,"Homeless Man Learns Coding, Launches App",CorpNet Adds Free Meeting Minutes and Corporate Document Templates (1.01),[Techie Tuesdays] Manish Bhattacharya  The Kid who paid his education loan by hacking into facebook (1.01),Working at TaxiForSure is fun for sure [Fabulous Workplaces] (1.01),CrowdtiltOpen Allows Free Crowdsourcing on Your Own Domain (1.00),"Busted: Hotels.com Caught Buying Links, Apology is Weak (1.00)",Artsy Central Shows Trend Toward Etsy Alternatives (1.00),What is a Database? (1.00),"Will We Soon See a Color Kindle E-Reader, Instead of Black and White? (1.00)",MyOpenID Will Shut Down in February (1.00),60 Percent of Online Traffic Now Comes From Mobile (1.00)
797,Shutdown Cost Small Tourism Businesses Millions,What Are Sunk Costs? (1.01),Mompreneur Launches $3 Million Business Selling Superhero Capes (1.00),"Small Business Loans Up at Big Banks, Down at Small Ones (1.00)",President Obama Angers Small Booksellers With Amazon Speech (1.00),Your End of Year Legal Checklist (1.00),"Reed Business Information: Online Sales Manager, LA (1.00)",Small Business Employment Share Shrinking for a Good Reason (1.00),Gross Fixed Capital Formation Weak at Non-Corporate Businesses (1.00),Raising Minimum Wage: Next Proposal to Threaten Small Businesses (1.00),Small Business Job Growth Dips in January (1.00)
798,Lessons Learned From Your 2013 Tax Return,What Are Sunk Costs? (1.01),Mompreneur Launches $3 Million Business Selling Superhero Capes (1.00),How Much Will the Sequester Cost Small Business Contractors? (1.00),5 Tips for Buying a Franchise (1.00),Your End of Year Legal Checklist (1.00),"Reed Business Information: Online Sales Manager, LA (1.00)",Ohio Weighing Major Tax Break For Small Businesses (1.00),Small Business Employment Share Shrinking for a Good Reason (1.00),Raising Minimum Wage: Next Proposal to Threaten Small Businesses (1.00),Putting Television in Your Lobby or Place of Business: What you Need to Know (1.00)
799,Why Word-of-Mouth Should Be Core to Your Business,Mid-Year Business Review: Risk Management Edition (1.00),Best Small Business Books (1.00),Quantify Lets You Shop For Your Next Business Consultant Online (1.00),The Small Business Guide to Getting Ready for Vacation (1.00),The Commitment Engine Inspires Small Business Growth (1.00),Small Business News: Small Biz Startup Tips (1.00),10 Tips For Organizing Your Small Business This Year (1.00),25 Top YouTube Channels for Small Business Owners and Entrepreneurs (1.00),Join The Crowdfunding Revolution to Start Your Business (1.00),Tom Byun of Yahoo! Small Business: Making That Next Sale (1.00)
800,Photographer Driven Bananas Over Wikipedia Monkey Selfies,Indie Books Now Have a Better Shot With Brick-and-Mortar Bookstores (1.01),Verizon Plans to Acquire Content Delivery Network EdgeCast (1.00),"Michael Phelps has the perfect body for swimming, but that's not the only reason he's so good (1.00)",Getting In The Game Puts Your Start Up Investment on the Board (1.00),"5 entrepreneurship lessons to learn from Colonel Sanders, the culprit responsible for your finger-licking mania (0.99)","Daisy Chittilapilly- Director, Partner Organization, Cisco India and SAARC (0.99)",Sauca Foods:  New Flair for the Food Truck Trend (0.99),"New Apple iPad Thinner, Lighter But Still $499 (0.99)",Days Are Numbered for the LG Google Nexus 5 (0.99),Amazon Introduces New Kindle Fire Tablets (0.99)
801,Are You Blogging for Your Small Business?,Mid-Year Business Review: Risk Management Edition (1.00),Best Small Business Books (1.00),Quantify Lets You Shop For Your Next Business Consultant Online (1.00),The Small Business Guide to Getting Ready for Vacation (1.00),The Commitment Engine Inspires Small Business Growth (1.00),Small Business News: Small Biz Startup Tips (1.00),10 Tips For Organizing Your Small Business This Year (1.00),25 Top YouTube Channels for Small Business Owners and Entrepreneurs (1.00),WordStream Improves Its Free AdWords Benchmark Tool For Small Business Advertisers (1.00),Tom Byun of Yahoo! Small Business: Making That Next Sale (1.00)
