,title,most_similar_1,most_similar_2,most_similar_3,most_similar_4,most_similar_5,most_similar_6,most_similar_7,most_similar_8,most_similar_9,most_similar_10
499,"Yahoo Will Free Up Inactive IDs, Possibly Including Yours",CorpNet Adds Free Meeting Minutes and Corporate Document Templates (1.02),CrowdtiltOpen Allows Free Crowdsourcing on Your Own Domain (1.01),Artsy Central Shows Trend Toward Etsy Alternatives (1.01),What New Opportunities Does Android Wear Offer for Entrepreneurs? (1.01),[Techie Tuesdays] Manish Bhattacharya  The Kid who paid his education loan by hacking into facebook (1.01),Ever Wish You Had the Same Data As Amazon? Terapeak Says You Can (1.01),This Coffee Shop is Selling More Than Just Coffee (1.01),Working at TaxiForSure is fun for sure [Fabulous Workplaces] (1.01),Mix360 Headset Promises Hi-Fi Experience From Your Smartphone (1.00),"Busted: Hotels.com Caught Buying Links, Apology is Weak (1.00)"
500,Answers to Your Frequently Asked Questions About Incorporation,Mompreneur Launches $3 Million Business Selling Superhero Capes (1.01),"Reed Business Information: Online Sales Manager, LA (1.01)",What Are Sunk Costs? (1.01),Small Business Loan Approval Drops to 18.8 Percent at Big Banks (1.00),"Small Business Loans Up at Big Banks, Down at Small Ones (1.00)",The Micro Business Home Equity Loan Crunch (1.00),President Obama Angers Small Booksellers With Amazon Speech (1.00),Your End of Year Legal Checklist (1.00),Small Business Employment Share Shrinking for a Good Reason (1.00),Gross Fixed Capital Formation Weak at Non-Corporate Businesses (1.00)
501,Book Review: The Constant Contact Guide to Email Marketing,10 Tips for Using a Blog to Increase Email List Signups (1.00),When and How to Use Autoresponders (1.00),Book Review: You Are What You Choose (1.00),8 Daily Steps to Compete Like a Champion (1.00),5 Ways to Start Building Your Brand Online (1.00),"Smarter, Faster, Cheaper: A Review (1.00)",10 Creative and Efficient Customer Service Solutions (1.00),"Email Marketing is Not Dead, Bring it Back to Life With These Resources (1.00)",Behind the Book: Anita Campbell Talks About Visual Marketing (1.00),Dig Into The Strategy Book (1.00)
502,Failing to deliver a 39-point list for school education cost Smriti Irani her job,Victoria's Secret supermodel reveals everything she eats in a day (1.01),Want to build a billion dollar organisation without VC money? Learn from Sridhar Vembu (1.01),PayPal Will Change User Agreement After Robocall Concerns (1.01),Flexible Working: Win-Win For Employers and Employees (1.01),This couple bought 300 acres of land and created Indias first private wildlife sanctuary (1.01),1001 Startup Ideas - Place for connecting students to micro-jobs (1.01),SMBs Make Hopeful 2011 New Year Resolutions (1.01),"Intuit Will Acquire Check App, Deal is Worth $360 Million (1.00)","India orders four maritime spy planes from Boeing, bolsters navy (1.00)",Microsoft Makes $44.6 Billion Cash And Stock Bid For Yahoo; 62 Percent Premium (1.00)
503,Podio Launches Video Conference App,Offer Newsletter Sign Up Incentives to Your Site Visitors With Incentivibe (1.01),Local and Ecommerce Merchants Pick Up On Facekini Trend (1.01),Google Acquisition of Motorola Finally Closes: Why You Should Care (1.00),New York Times Hacked Via Crafty Phishing Attack (1.00),Top Jobs Of The Week In Digital Media And Mobile Content (1.00),Enterprise Cloud Services Retooled as Google for Work (1.00),This New Online Tool Creates a Picture of Your Cash Flow (1.00),"Haiku Deck Offers PowerPoint Alternative, Fewer Features Touted (1.00)",MYQROsites Offers New App for Mobile Marketing With QR Codes (1.00),A Beer Keurig Machine? SYNEK Draft System is on its Way (1.00)
504,This couple bought 300 acres of land and created Indias first private wildlife sanctuary,Want to build a billion dollar organisation without VC money? Learn from Sridhar Vembu (1.01),PayPal Will Change User Agreement After Robocall Concerns (1.01),Failing to deliver a 39-point list for school education cost Smriti Irani her job (1.01),"[Techie Tuesdays] A tribute to Humblefool, the best coder that ever lived in India (1.01)",1001 Startup Ideas - Place for connecting students to micro-jobs (1.01),How an MBA grad became a marketplace millionaire by selling umbrellas (1.01),"Amazon, Quikr, Ebay, Snapdeal involved in wildlife trade: Govt (1.01)",SMBs Make Hopeful 2011 New Year Resolutions (1.01),"Intuit Will Acquire Check App, Deal is Worth $360 Million (1.00)","India orders four maritime spy planes from Boeing, bolsters navy (1.00)"
505,How Google Upgraded URLs Will Change Your AdWords Experience,Why to Think Twice About Green Labels (1.02),"Meet Byju, whos changing the way India learns (1.01)",5 Points to Remember About Mobile SEO (1.01),How To Integrate Your Remote Office Effectively (1.01),Business Insider is hiring a paid social media intern for our video team. Apply now! (1.01),Graph Search Presents Opportunties to Reach More Facebook Users (1.01),Turn Visitors Into Buyers: Benefits of Retargeting (1.01),New Study Helps SMB Owner Analyze Local Search Data (1.01),25 Free WordPress Plugins for Integrating Google Features (1.00),You Made It Yourself: Now What? 29 Places to Sell Your Handmade Creations (1.00)
506,What Does Google Place Pages Mean For SMBs?,How To Integrate Your Remote Office Effectively (1.01),Business Insider is hiring a paid social media intern for our video team. Apply now! (1.01),Why to Think Twice About Green Labels (1.01),"Meet Byju, whos changing the way India learns (1.00)",4 Ways to Make or Save Money with a Smartphone (1.00),SMB Owners Get Mobile Coupons For The Holidays (1.00),5 Points to Remember About Mobile SEO (1.00),Coca-Cola: Marketing Done Right (1.00),The Age of the Platform Will Make You Think (1.00),Google Releases Real-Time Reputation Problem (1.00)
507,"Yelp Loses Money, But Hits 100 Million Visitors",Indie Books Now Have a Better Shot With Brick-and-Mortar Bookstores (1.01),Nokia Introduces Asha Smartphones Beginning at Just $69 (1.00),First Smartphone Anti-Theft Law Could Also Make Reselling Phones Hard (1.00),New Microsoft Surface 2 Tablets Have Arrived (1.00),Amazon Innovates With New Tablets and e-Readers (1.00),"Michael Phelps has the perfect body for swimming, but that's not the only reason he's so good (1.00)",Call+ Offers Free Landline Calls To 16 Countries (1.00),Windows 8.1 For Free? A Version May Be In The Works (1.00),Entrepreneurs Take Us to the Edge of Outer Space (1.00),"No More Plastic Phones: Samsung Galaxy A3, A5 Made of Metal (1.00)"
508,Six Apart finds a pot full of VC Dollars,Victoria's Secret supermodel reveals everything she eats in a day (1.00),How an English teacher conquered China : Wisdom of Jack Ma condensed into 33 quotes (1.00),"Etsy Balances Needs of Sellers, Stockholders as IPO Gets Under Way (1.00)",Kid Inventors Come Up With Creative Environmental Solutions (1.00),Want to build a billion dollar organisation without VC money? Learn from Sridhar Vembu (1.00),Liquid Soap and Green Tech are Game Changers for This Entrepreneur (1.00),Entrepreneur Gary Vaynerchuk: From Personal Brand to VC Investor (1.00),"Mashable Raises $13 Million, Its First Ever Outside Investment (1.00)",PayPal Will Change User Agreement After Robocall Concerns (1.00),Flexible Working: Win-Win For Employers and Employees (1.00)
509,These 19 companies are racing to put driverless cars on the road by 2020,Finding Success Empowering Lifestyle Entrepreneurs (1.01),10 things you need to know in markets today (1.00),Earnings This Week (1.00),The 20 best smartphones in the world (1.00),Union Cabinet approves skill training through Pradhan Mantri Kaushal Vikas Yojana (1.00),Here comes Wells Fargo... (1.00),The Christmas Conspiracy (1.00),P2P Tech Firm CacheLogic Raises $20M in Third Round Funding (1.00),How to Boost Your Retail Sales Into the New Year (1.00),Govt's decision to demonetise a retrograde move: Arvind Sanger (1.00)
510,Review of Hootsuite: Manage Social Media From A Single Dashboard,8 Daily Steps to Compete Like a Champion (1.01),Time and Expense Tracking Apps: 27 Solutions (1.01),Outright: Simple Online Bookkeeping for Sole Proprietors (1.01),Big News: Quickbooks Competitor Intacct Targets the SMB Market (1.01),3 Ways to Look at Marketing (1.00),11 Ways to Use Twitter To Develop Sales Leads (1.00),Better Online Marketing Optimization Through Google Analytics: A Book Review (1.00),Raghu Raghavan of Act-On: Now is the Time to Dive Into Marketing Automation (1.00),Social Customers Means a Social Inbox: Review of Nimble CRM (1.00),20 Reasons People Unfollow You On Twitter (1.00)
511,How to Claim a YouTube Custom Channel URL,Franchising: The Importance Of Great Systems Within The System (1.02),Headlining the News This Week: Wix Acquires OpenRest (1.01),"Jupitermedia: Media Analyst, NYC (1.00)",Twitter Officially Launches Mobile Ads Manager (1.00),Google+ Lifts Real Names Only Policy (1.00),Charitable Startup Finds New Use for Old Cardboard Boxes (1.00),"WhatsApp Offers Alternative to Paid Texting, Social Sites (1.00)",Spotlight: Studypool Provides Fast Online Homework Help (1.00),What is Siri? And Does Siri Have Competitors? (1.00),WixMusic Lets Musicians Set the Tempo for Their Brand (1.00)
512,Amazon Innovates With New Tablets and e-Readers,Indie Books Now Have a Better Shot With Brick-and-Mortar Bookstores (1.02),Getting In The Game Puts Your Start Up Investment on the Board (1.01),"New Apple iPad Thinner, Lighter But Still $499 (1.00)",Days Are Numbered for the LG Google Nexus 5 (1.00),Amazon Introduces New Kindle Fire Tablets (1.00),The 5 best new songs you can stream right now (1.00),"Nexus 6 Could Compete with iPhone 6 Plus, Other Phablets (1.00)","China Based Huawei Introduces Five New Devices, Eyes U.S. Market (1.00)","Citysearch: Product Manager, LA (1.00)",Nokia Introduces Asha Smartphones Beginning at Just $69 (1.00)
513,"Google Glass: Not Yet On Sale, But Already Banned in Some Businesses",LinkedIn Introduces Showcase Pages for Business (1.00),Customer Asked to Leave Local Business Over Google Glass Policy (1.00),6 Benefits of Social Media for Small Businesses (1.00),The Referral Engine: Teaching Your Business to Market Itself (1.00),Building Trust: 5 Tips to Establish Your Credibility for Business (0.99),10 Social Media Books Every Small Business Owner Should Read (0.99),5 Small Business Social Media Mistakes (0.99),Survey: Businesses Benefit from Social Media Savvy (0.99),Best Small Business Use of Facebook Graph Search: Local Businesses (0.99),Advantages of Using eCommerce Software in Your Retail Business (0.99)
514,What Are Net Promoter Scores?,Franchising: The Importance Of Great Systems Within The System (1.04),"Fraudulent DMCA Takedown Requests: Finally, a Lid on Them? (1.01)",Spotlight: Studypool Provides Fast Online Homework Help (1.01),"Brands Doing More Content Marketing with Less Return, TrackMaven Says (1.00)",How to Turn Around a Bad Review Online Successfully (1.00),Twitter Officially Launches Mobile Ads Manager (1.00),Why Networking in Person Still Matters (1.00),Infosys is using an algorithm to identify its next top-level leaders (1.00),"Google Announces Web Designer, Enhancements to DoubleClick (1.00)","The Rumors Are True, Facebook Gets Hashtags (1.00)"
515,The 10 biggest European tech stories thisweek,Finding Success Empowering Lifestyle Entrepreneurs (1.01),1001 Startup Ideas - Place for connecting students to micro-jobs (1.01),How 2 of the world's most powerful and dangerous drug lords compare (1.00),10 things you need to know in markets today (1.00),FCC Decision on Net Neutrality Coming Soon (1.00),Victoria's Secret supermodel reveals everything she eats in a day (1.00),Microsoft Makes $44.6 Billion Cash And Stock Bid For Yahoo; 62 Percent Premium (1.00),How an English teacher conquered China : Wisdom of Jack Ma condensed into 33 quotes (1.00),Cardamom futures remain up on rising demand (1.00),"Etsy Balances Needs of Sellers, Stockholders as IPO Gets Under Way (1.00)"
516,eBay Opposes Legislation Imposing New Taxes and Regulatory Burdens on Small Businesses,94 Percent of People Think Buying From Small Businesses is Important (1.00),How Much Will the Sequester Cost Small Business Contractors? (1.00),5 Tips for Buying a Franchise (1.00),"Reed Business Information: Online Sales Manager, LA (1.00)",Ohio Weighing Major Tax Break For Small Businesses (1.00),Small Business Employment Share Shrinking for a Good Reason (1.00),Raising Minimum Wage: Next Proposal to Threaten Small Businesses (1.00),Woman Makes Business Out of Giant Cookies After Losing Job of 30 Years (1.00),"Small Businesses Spend More on Travel, Per Concur Survey (1.00)",Celebrating National Business Etiquette Week (1.00)
517,Your New Year Small Business Checklist,"21 Year Old Solves Own Acne Problem, Builds Business (1.01)",10 Apps to Assist with Your Small Business Taxes (1.00),The Secret to Achieving Resolutions:  Setting Small Goals (1.00),How the Cloud is Reshaping Small Business Productivity (1.00),Is It Time to Change Your Business Structure? (1.00),Satanic Latte Art? How Should a Business Respond? (1.00),How to Turn Your Hobby Into a Business (1.00),Protecting Small Business Intellectual Property (1.00),Top Reasons to Incorporate Your Business (1.00),Getting Your Business Energy Efficient Before the Holidays (1.00)
518,SoundCloud Introduces Program to Share Revenue with Artists,CorpNet Adds Free Meeting Minutes and Corporate Document Templates (1.01),Artsy Central Shows Trend Toward Etsy Alternatives (1.00),How Do Consumers Buy Online? (1.00),WitKit Platform Lets Your Team Collaborate in Security (1.00),What New Opportunities Does Android Wear Offer for Entrepreneurs? (1.00),"Yahoo Will Free Up Inactive IDs, Possibly Including Yours (1.00)",No one is telling you the dark side of becoming an entrepreneur (1.00),10 Mindsets of Successful Entrepreneurs (1.00),Top 5 Programming Languages for Mobile Application Development (1.00),"Yahoo Unveils News Digest, Digital Magazines But Without Clear Niche (1.00)"
519,Government Resources to Help Market Your Business Overseas,Build your Business Through The Economics of Integrity (1.00),What Is HTML5? Do I Need It For My Business Website? (1.00),Hacking of Google Maps May Have Killed This Business (1.00),5 Benefits of Having a Website for Your Small Business (1.00),Get It Together! Consolidate Your Business Systems (1.00),The Creative Small Business and 4 Ways to Get There (1.00),How a Small Business Can Use Big Data (1.00),Chekkt: A Place To Discover Business Management Software (1.00),How Are Business Books Like Restaurants? (1.00),How best friends turned co-founders are building their dream business (1.00)
520,6 Rules of Entrepreneurship from Founders in the Trenches,How To Integrate Your Remote Office Effectively (1.00),Business Insider is hiring a paid social media intern for our video team. Apply now! (1.00),Why to Think Twice About Green Labels (1.00),25 Free WordPress Plugins for Integrating Google Features (0.99),"Meet Byju, whos changing the way India learns (0.99)",Getting Comfortable With Self-Promotion (0.99),4 Ways to Make or Save Money with a Smartphone (0.99),SMB Owners Get Mobile Coupons For The Holidays (0.99),The Evolution of Affiliate Marketing (0.99),5 Points to Remember About Mobile SEO (0.99)
521,A Picture Is Worth A 1000 Words: Pinterest Is On To Something,How to Get Your Products Discovered with Videos (1.00),"Court Reverses $338,000 Award for User Generated Content (1.00)",Google AdWords Conversion Import Tracks Offline Sales (1.00),Getting Your Invention To Market (1.00),How To Integrate Your Remote Office Effectively (1.00),The ultimate master list of revenue models used by Web and Mobile companies (1.00),Selling In A Skirt Elevates Training for Saleswomen and Salesmen (1.00),"Facebook, Yelp Follow FourSquare, Launch Deals (1.00)",LinkedIn Gets Rid of Products and Services Tab on Company Pages (1.00),20 More Resources To Sell Your Handmade Crafts (1.00)
522,Communicating to Employees About Health Insurance Open Enrollment,IRS Adopts Taxpayer Bill of Rights (1.01),Do You Trust Your Employees to Work Remotely? (1.00),"South Dakota, Texas Top List of Best State Tax Systems (1.00)",Internet Sales Tax Bill May Stall in House of Representatives (1.00),New Tax Penalty Targets Health Reimbursement Accounts (1.00),How Do You Feel About Raising the Minimum Wage? (1.00),"Federal Gas Tax Could Increase by 15 Cents, More Costs Possible (1.00)",Successful S-Corp Owners: Watch Out For A Tax Increase (0.99),Evernote Coming Out With New App Just for Businesses (0.99),25 of the Best Cities for Freelancers to Work and Play (0.99)
523,Will the Dependent Coverage Provision Raise Insurance Premiums?,Do You Trust Your Employees to Work Remotely? (1.01),Senate Passes Internet Sales Tax; Bill Moves to House (1.00),"Robust Employment Growth, Just not for the Self-Employed (1.00)",Consumer Attitudes Indicate a New Year with Old Spending Habits (1.00),Does a Rise in Housing Starts Equal Growth in Construction Startups? (1.00),Internet Sales Tax Issue Still Lives Despite Activist Claims (1.00),IRS Adopts Taxpayer Bill of Rights (0.99),On the Long Road to Economic Recovery? You Decide (0.99),"South Dakota, Texas Top List of Best State Tax Systems (0.99)",How to Get a Startup Visa Act Passed (0.99)
524,No one is telling you the dark side of becoming an entrepreneur,CorpNet Adds Free Meeting Minutes and Corporate Document Templates (1.02),Artsy Central Shows Trend Toward Etsy Alternatives (1.01),Working at TaxiForSure is fun for sure [Fabulous Workplaces] (1.01),CrowdtiltOpen Allows Free Crowdsourcing on Your Own Domain (1.00),What is a Database? (1.00),How Do Consumers Buy Online? (1.00),WitKit Platform Lets Your Team Collaborate in Security (1.00),What New Opportunities Does Android Wear Offer for Entrepreneurs? (1.00),Facebook Messenger hits 1 billion users (1.00),Our Top Story This Week: A New SBA Administrator is Approved (1.00)
525,"Buy  BEML, target Rs  1000  :   Kunal Bothra",The Christmas Conspiracy (1.01),Finding Success Empowering Lifestyle Entrepreneurs (1.01),1001 Startup Ideas - Place for connecting students to micro-jobs (1.01),How 2 of the world's most powerful and dangerous drug lords compare (1.00),10 things you need to know in markets today (1.00),FCC Decision on Net Neutrality Coming Soon (1.00),Victoria's Secret supermodel reveals everything she eats in a day (1.00),Microsoft Makes $44.6 Billion Cash And Stock Bid For Yahoo; 62 Percent Premium (1.00),How an English teacher conquered China : Wisdom of Jack Ma condensed into 33 quotes (1.00),Cardamom futures remain up on rising demand (1.00)
526,"Introducing the ASUS ZenFone 2, No Contract Required",Getting In The Game Puts Your Start Up Investment on the Board (1.02),"5 entrepreneurship lessons to learn from Colonel Sanders, the culprit responsible for your finger-licking mania (1.01)",Amazon Takes Aim at Etsy with Handmade (1.01),How Low Will Online Storage Costs Finally Go? (1.01),Adobe Acquires Fotolia for $800 Million (1.00),Days Are Numbered for the LG Google Nexus 5 (1.00),BotBeat: This weeks top botstories (1.00),Audiam Wants to Find Money for Musicians on YouTube (1.00),Cicret Could Turn Your Skin Into a Smartphone Display (1.00),"China Based Huawei Introduces Five New Devices, Eyes U.S. Market (1.00)"
527,STOCKS GO NOWHERE: Here's what you need to know,Finding Success Empowering Lifestyle Entrepreneurs (1.01),How 2 of the world's most powerful and dangerous drug lords compare (1.00),10 things you need to know in markets today (1.00),FCC Decision on Net Neutrality Coming Soon (1.00),Here come retail sales ... (1.00),The Daily Sprout (1.00),Cardamom futures remain up on rising demand (1.00),"Up close & personal: How Sunny Leone handles stocks, land, gold, other assets (1.00)",Here come personal income and spending ... (1.00),Earnings This Week (1.00)
528,Stay At Home Mom Launched $24 Million Franchise in her Living Room,Victoria's Secret supermodel reveals everything she eats in a day (1.00),Ebay Adds Same Day Delivery In Dallas (1.00),Want to build a billion dollar organisation without VC money? Learn from Sridhar Vembu (1.00),Liquid Soap and Green Tech are Game Changers for This Entrepreneur (1.00),Entrepreneur Gary Vaynerchuk: From Personal Brand to VC Investor (1.00),"Mashable Raises $13 Million, Its First Ever Outside Investment (1.00)",PayPal Will Change User Agreement After Robocall Concerns (1.00),Flexible Working: Win-Win For Employers and Employees (1.00),Failing to deliver a 39-point list for school education cost Smriti Irani her job (1.00),This couple bought 300 acres of land and created Indias first private wildlife sanctuary (1.00)
529,9 Things Small Retailers Must Know to Survive and Thrive,Small Business Loan Approval Drops to 18.8 Percent at Big Banks (1.00),The Micro Business Home Equity Loan Crunch (1.00),President Obama Angers Small Booksellers With Amazon Speech (1.00),New Business Trend: Pricey Play Date Consultants (1.00),Small Business Loans Hit Record High for Third Consecutive Month (1.00),"SBA Nominee Talks Marketing to Banks, Businesses at Confirmation Hearing (1.00)",What Are Sunk Costs? (1.00),Mompreneur Launches $3 Million Business Selling Superhero Capes (0.99),"Small Business Loans Up at Big Banks, Down at Small Ones (0.99)",Your End of Year Legal Checklist (0.99)
530,Why Small Businesses Have Trouble Getting Credit,"Fortune 500 Thrives, But Small Businesses Not So Optimistic (1.00)",10 Apps to Assist with Your Small Business Taxes (1.00),The Secret to Achieving Resolutions:  Setting Small Goals (1.00),Is It Time to Change Your Business Structure? (1.00),Protecting Small Business Intellectual Property (1.00),Peer-to-Peer Lending Club Fine-Tunes Small Business Loan Program (1.00),Getting Your Business Energy Efficient Before the Holidays (1.00),Reward your Small Business with the Capital One Spark (1.00),Remote Work No Longer a Perk But a Business Imperative (1.00),Cyber Liability Insurance: Protect Your Business Online (1.00)
531,Senate Considering New Visa Program To Encourage Tech Startups,Do You Trust Your Employees to Work Remotely? (1.01),How to Get a Startup Visa Act Passed (1.00),Angel Investments Since the Economic Downturn (1.00),Plastic Preferred: Cash To Decline to Just 23% of Purchases (1.00),Pricing pressure in US biz cyclical in nature: Cadila Health (1.00),Franchising In The Downturn And Recovery (1.00),Angel Investments Update Since the Economic Downturn (1.00),Here's the salary you have to earn to buy a home in 19 major US cities (1.00),Nokia Introduces 6 Inch Phone with Business Functionality (1.00),Newly Sworn SBA Chief Must Deal With Lending Defaults (1.00)
532,"Michael Phelps has the perfect body for swimming, but that's not the only reason he's so good",Indie Books Now Have a Better Shot With Brick-and-Mortar Bookstores (1.02),Verizon Plans to Acquire Content Delivery Network EdgeCast (1.01),[Video] The Single Biggest Reason Why Startups Succeed (1.01),Getting In The Game Puts Your Start Up Investment on the Board (1.01),"5 entrepreneurship lessons to learn from Colonel Sanders, the culprit responsible for your finger-licking mania (1.00)","Daisy Chittilapilly- Director, Partner Organization, Cisco India and SAARC (1.00)",Sauca Foods:  New Flair for the Food Truck Trend (1.00),"New Apple iPad Thinner, Lighter But Still $499 (1.00)",Days Are Numbered for the LG Google Nexus 5 (1.00),Audiam Wants to Find Money for Musicians on YouTube (1.00)
533,3 Steps to Performing Content Marketing on a Shoestring Budget,3 Ways to Look at Marketing (1.00),Better Online Marketing Optimization Through Google Analytics: A Book Review (1.00),Metrics Overload? How to Streamline Marketing Data (1.00),Social Customers Means a Social Inbox: Review of Nimble CRM (1.00),How to Leverage Infographics for B2B Marketing (1.00),Getting Comfortable With Self-Promotion (1.00),4 Ways to Market Your SMB With Flickr (1.00),The 5 Types of Influencers On The Web (1.00),10 Assets for Using Tech to Keep Your Team on Track (1.00),How To Keep Customers Loyal With Coupons (1.00)
534,JotForm Now Offers Adobe eSign Service,Indie Books Now Have a Better Shot With Brick-and-Mortar Bookstores (1.01),"Nexus 6 Could Compete with iPhone 6 Plus, Other Phablets (1.00)","Citysearch: Product Manager, LA (1.00)",Nokia Introduces Asha Smartphones Beginning at Just $69 (1.00),Verizon Plans to Acquire Content Delivery Network EdgeCast (1.00),The Kodak Pixpro SP360 Sports a 360 Degree Camera (1.00),Lenovo A7000 Phablet Offers Super Sound and Little Interference (1.00),First Smartphone Anti-Theft Law Could Also Make Reselling Phones Hard (1.00),MSFT-YHOO: Links To Coverage Across Our Sites (1.00),How to Secure and Protect Mobile Devices (1.00)
535,Agriculture has seen little reform in 25 years but there are crorepati farmers who have come up the hard way,Finding Success Empowering Lifestyle Entrepreneurs (1.01),10 real problems in India startups can aim to solve (1.01),Behavioral Economics for Entrepreneurs (1.01),European shares lifted by solid earnings but RBS slumps (1.00),STOCKS RALLY: Here's what you need to know (1.00),10 things you need to know in markets today (1.00),How millions from the Bangladesh Bank heist disappeared (1.00),Here come retail sales ... (1.00),The Daily Sprout (1.00),Cardamom futures remain up on rising demand (1.00)
