,title,most_similar_1,most_similar_2,most_similar_3,most_similar_4,most_similar_5,most_similar_6,most_similar_7,most_similar_8,most_similar_9,most_similar_10
507,Fox Mobile/Jamba CEO Lucy Hood Resigns; European Focus Going Forward,"India orders four maritime spy planes from Boeing, bolsters navy (1.00)",The 5 best new songs you can stream right now (1.00),"Up close & personal: How Sunny Leone handles stocks, land, gold, other assets (1.00)",The 10 most luxurious first-class plane cabins in the world (1.00),Indie Books Now Have a Better Shot With Brick-and-Mortar Bookstores (1.00),"Reliance Jio is yet to be launched, but is already breaking rules (1.00)",Study: 16 Percent of Yelp Reviews May Be Fakes (1.00),Kid Inventors Come Up With Creative Environmental Solutions (1.00),Microsoft Temporarily Cuts the Price on the Surface 2 (1.00),Lawn Care Services Offered on Amazon Soon (1.00)
508,[Video] The Single Biggest Reason Why Startups Succeed,Adobe Acquires Fotolia for $800 Million (1.00),Days Are Numbered for the LG Google Nexus 5 (1.00),Do You Trust Your Employees to Work Remotely? (1.00),Cicret Could Turn Your Skin Into a Smartphone Display (1.00),"Community Connect: Product Strategist, NYC (1.00)",How Do Consumers Buy Online? (1.00),CorpNet Adds Free Meeting Minutes and Corporate Document Templates (1.00),How to Secure and Protect Mobile Devices (1.00),The Rebel Entrepreneur Rewrites The Rulebook (1.00),How I increased my productivity 1.5x by experimenting with my work schedule (1.00)
509,Time is Money: Are You and Your Employees Effectively Managing It?,How to Get Your Products Discovered with Videos (1.02),Twitter Officially Launches Mobile Ads Manager (1.02),5 lessons from the Bhagvad Gita for every entrepreneur (1.02),Famous Bloggers Founder Loses Domain Names (1.02),"Look beyond the hype of certification, look for skills to move up in the real world (1.02)",How to Handle a Public Relations Crisis (1.02),What is Siri? And Does Siri Have Competitors? (1.02),Tweeter in Chief: Obama Twitter Account Gets Heavy Engagement (1.02),WhatsApp Messaging Service Reaches 400 Million Active Users (1.02),"Bright Light Helps Market Products, But Makes Decisions More Emotional (1.01)"
510,Mobile Apps Software Firm Golden Gecko Gets First Round Funding,Study: 16 Percent of Yelp Reviews May Be Fakes (1.01),Amazon AWS MarketPlace Puts Desktop Apps in the Cloud (1.01),"India orders four maritime spy planes from Boeing, bolsters navy (1.00)",HP Reinventing Traditional Computers With Mini Desktop PC (1.00),Amazon Introduces New Kindle Fire Tablets (1.00),The 5 best new songs you can stream right now (1.00),"Up close & personal: How Sunny Leone handles stocks, land, gold, other assets (1.00)",The 10 most luxurious first-class plane cabins in the world (1.00),Indie Books Now Have a Better Shot With Brick-and-Mortar Bookstores (1.00),"Reliance Jio is yet to be launched, but is already breaking rules (1.00)"
511,How an MBA grad became a marketplace millionaire by selling umbrellas,Do You Trust Your Employees to Work Remotely? (1.01),Here's A Brand New Thing You Didn't Know About 'Friends' (1.01),Entrepreneur Gary Vaynerchuk: From Personal Brand to VC Investor (1.01),Join Me For: Choosing the RIGHT Online Software (1.01),Franchising And Politics (1.01),Retail Trends:  The Eyes Have It (1.01),"Yahoo: Director Product Management, Yahoo! Finance, Sunnyvale, CA (1.01)",Game Plan: (1.01),Entrepreneur Creates Winery on the Third Floor of a Warehouse (1.01),"[Techie Tuesdays] A tribute to Humblefool, the best coder that ever lived in India (1.01)"
512,Enterprise Analytics: Big Data Measures to Better Business,Mid-Year Business Review: Risk Management Edition (1.00),Best Small Business Books (1.00),The Small Business Guide to Getting Ready for Vacation (1.00),The Commitment Engine Inspires Small Business Growth (1.00),Small Business News: Small Biz Startup Tips (1.00),10 Tips For Organizing Your Small Business This Year (1.00),25 Top YouTube Channels for Small Business Owners and Entrepreneurs (1.00),WordStream Improves Its Free AdWords Benchmark Tool For Small Business Advertisers (1.00),Getting Your Small Business Started On Yelp (1.00),"Yelp Will Allow Businesses to Sell Food, Other Services (1.00)"
513,One on One: Michael Wu of Lithium Technologies,How To Keep Customers Loyal With Coupons (1.01),7 Missing Elements of Your Content Strategy (1.01),Little Known Brand Monitoring Search Tricks (1.01),Yelp Reviews Out of Google Places. What Else Ya Got? (1.01),Top 5 Online Credibility Killers (1.01),Is Your Online Marketing Strategy Up to Date? (1.01),Watch These Metrics to Measure YouTube Marketing Success (1.01),Shocker: People Do Not Read What They Share on Social Media (1.01),10 Reasons to Boost Your Twitter Presence (1.01),Picking Winning Keywords For Your SMB Site (1.01)
514,"WhatsApp Offers Alternative to Paid Texting, Social Sites",The Project Champion: A Management Best Practice (1.01),New York Times Hacked Via Crafty Phishing Attack (1.00),"Vocus, Provider of PRWeb, Acquires iContact Email Marketing (1.00)",Famous Bloggers Founder Loses Domain Names (1.00),Google+ Lifts Real Names Only Policy (1.00),MYQROsites Offers New App for Mobile Marketing With QR Codes (1.00),Birth to re-birth: The man who made Savita Bhabhi (1.00),This Startup is Using Salt to Create an Alternative to Nuclear Energy (1.00),What is Siri? And Does Siri Have Competitors? (1.00),Against The Machine: Being Human In The Age of The Electronic Mob (1.00)
515,Small Businesses Divided on Internet Sales Tax,"Reed Business Information: Online Sales Manager, LA (1.00)",Ohio Weighing Major Tax Break For Small Businesses (1.00),eBay Opposes Legislation Imposing New Taxes and Regulatory Burdens on Small Businesses (1.00),Celebrating National Business Etiquette Week (1.00),How a Meetup Group Led a Mompreneur to Launch a Business (1.00),What Are Sunk Costs? (1.00),Do You Need to Notify the State of Changes to Your Business? (1.00),Will an LLC Help Lower Your Business Taxes? (1.00),5 Things You May not Know about Small Business Taxes (1.00),An Update on the Greater Opportunities for Small Business Act (1.00)
516,Spotlight: My Elder Advocate Puts Seniors First,Adobe Acquires Fotolia for $800 Million (1.00),How Do Consumers Buy Online? (1.00),How I increased my productivity 1.5x by experimenting with my work schedule (1.00),Our Top Story This Week: A New SBA Administrator is Approved (1.00),Print Photos From Your Phone with the Prynt Smartphone Case (1.00),10 Mindsets of Successful Entrepreneurs (1.00),This African Entrepreneur Creates 3-D Printers Out of E-Waste (1.00),Infusionsoft Announces Mobile Payments and More at ICON15 (1.00),"Yahoo Unveils News Digest, Digital Magazines But Without Clear Niche (1.00)","HP Did Better Than The Market on PC Sales, But Mum About Mobile (1.00)"
517,Picking Winning Keywords For Your SMB Site,One on One: Michael Wu of Lithium Technologies (1.01),25 Free WordPress Plugins for Integrating Google Features (1.00),Raghu Raghavan of Act-On: Now is the Time to Dive Into Marketing Automation (1.00),Looking for Blog Topics? @TheSalesLion Has a Few [BlogWorld Coverage] (1.00),Monster Loyalty: Savvy Engagement Tips From Lady Gaga (1.00),4 Ways to Market Your SMB With Flickr (1.00),4 Ways to Make or Save Money with a Smartphone (1.00),The Evolution of Affiliate Marketing (1.00),The 5 Types of Influencers On The Web (1.00),10 Assets for Using Tech to Keep Your Team on Track (1.00)
518,Customer Relations Blunder? Google Causes Stir Over Easter Doodle,Famous Bloggers Founder Loses Domain Names (1.01),The Project Champion: A Management Best Practice (1.01),5 lessons from the Bhagvad Gita for every entrepreneur (1.00),"Vocus, Provider of PRWeb, Acquires iContact Email Marketing (1.00)",Why We Are Afraid to Talk Pricing (1.00),Google+ Lifts Real Names Only Policy (1.00),What Are Net Promoter Scores? (1.00),"Look beyond the hype of certification, look for skills to move up in the real world (1.00)",Birth to re-birth: The man who made Savita Bhabhi (1.00),This Startup is Using Salt to Create an Alternative to Nuclear Energy (1.00)
519,21 Often-Overlooked Ways to Generate Leads Online,"Exceed Your Indiegogo Goals by 1,000 Percent with These Lessons (1.01)",11 Ways to Use Twitter To Develop Sales Leads (1.00),Social Customers Means a Social Inbox: Review of Nimble CRM (1.00),20 Reasons People Unfollow You On Twitter (1.00),Not Sure How to Use LinkedIn for B2B? Let Us Help You (1.00),How to Balance Engagement and Customer Service on Twitter (1.00),LotusJump Review: Do-It-Yourself Online Marketing Service (1.00),Navigating Social Media Legal Risks: Keeping Your Marketing Legally Safe (1.00),Chris Goward: Affiliate Programs and Conversion Optimization #AMDays (1.00),4 Practical SMB Uses For FourSquare (1.00)
520,Best Business Gifts Under $25 for 2015,Small Business Product Launches and Shut Downs (1.00),Improving Your Community Can Improve Your Business (1.00),Going Mobile: Does Your Small Business Need an App? (1.00),How the Cloud is Reshaping Small Business Productivity (1.00),The Small Business Guide to Getting Ready for Vacation (1.00),Email Erases 9 to 5 at Many Small to Mid-Sized Businesses (1.00),Catch Up With Our Latest Small Business News Recap (1.00),The Commitment Engine Inspires Small Business Growth (1.00),Small Business Disaster Survival Guide: Get Your Insurance Claims Covered (1.00),Small Business News: Week in Review for July 7 (1.00)
521,4 ways to tell whether it is love or lust,5 Points to Remember About Mobile SEO (1.00),"Google Adds New Features to Place Pages, Is It Enough? (1.00)",How to Promote Offline Events On The Web (1.00),45+ Tools for Content Curation and Content Marketing (1.00),10 Food Franchise Technology Tools And Solutions (1.00),Present Shock: Taking A Moment to Review the Future (1.00),"Google Databoard Lets You View Research, Create Infographics (1.00)",10 Reasons to Be Optimistic Looking Forward (1.00),6 Things Customers Want from Retail Stores and How You Can Deliver (1.00),Pinterest Marketing Tool Discover Can Give Better View of Your Brand (1.00)
522,10 Food Franchise Technology Tools And Solutions,Tipping the Odds for the Entrepreneur (1.01),Awaken Your Productivity With Fearless At Work (1.01),"Facebook, Yelp Follow FourSquare, Launch Deals (1.01)",Headlining the News This Week: Wix Acquires OpenRest (1.01),10 Reasons to Be Optimistic Looking Forward (1.01),6 Things Customers Want from Retail Stores and How You Can Deliver (1.01),Pinterest Marketing Tool Discover Can Give Better View of Your Brand (1.01),"Anthony Smith of Insightly: How to Attract 20,000 Users in 3 Months (1.01)",Vine: Now You Can Send Video Messages Directly to Friends and Colleagues (1.00),"Meet Byju, whos changing the way India learns (1.00)"
523,20 Places to Get Low Cost or Free Legal Advice for Your Business,Mid-Year Business Review: Risk Management Edition (1.00),Best Small Business Books (1.00),Going Mobile: Does Your Small Business Need an App? (1.00),The Small Business Guide to Getting Ready for Vacation (1.00),The Commitment Engine Inspires Small Business Growth (1.00),Small Business News: Small Biz Startup Tips (1.00),10 Tips For Organizing Your Small Business This Year (1.00),25 Top YouTube Channels for Small Business Owners and Entrepreneurs (1.00),WordStream Improves Its Free AdWords Benchmark Tool For Small Business Advertisers (1.00),"Yelp Will Allow Businesses to Sell Food, Other Services (1.00)"
524,Earnings Announcements This Week,FCC Decision on Net Neutrality Coming Soon (1.00),Cardamom futures remain up on rising demand (1.00),"Up close & personal: How Sunny Leone handles stocks, land, gold, other assets (1.00)",Earnings This Week (1.00),Here comes the Baker Hughes rig count ... (1.00),Here comes the Beige Book ... (1.00),Putin and Erdogan move towards repairing Russia-Turkey ties (1.00),Wall Street opens little changed (1.00),Microsoft Temporarily Cuts the Price on the Surface 2 (1.00),Rupee down against dollar (1.00)
525,Facebook is Trying to Make Advertising Simpler,25 Free WordPress Plugins for Integrating Google Features (1.00),Looking for Blog Topics? @TheSalesLion Has a Few [BlogWorld Coverage] (1.00),SMB Owners Get Mobile Coupons For The Holidays (1.00),The Evolution of Affiliate Marketing (1.00),The 5 Types of Influencers On The Web (1.00),Google Releases Real-Time Reputation Problem (1.00),The ultimate master list of revenue models used by Web and Mobile companies (1.00),Loni Stark of Adobe: Digital Marketing Solutions in the Cloud (1.00),Creating a Custom Favicon (1.00),Little Known Brand Monitoring Search Tricks (1.00)
526,A Good Sense Of Humor is Great For Your Sense Of Life and Business,What Is HTML5? Do I Need It For My Business Website? (1.00),5 Benefits of Having a Website for Your Small Business (1.00),Get It Together! Consolidate Your Business Systems (1.00),Outsell Yourself: Go From Hello to Sold With Ethical Business and Sales Techniques (1.00),How a Small Business Can Use Big Data (1.00),How Are Business Books Like Restaurants? (1.00),How best friends turned co-founders are building their dream business (1.00),12 Blogs Every Small Business Should Be Reading (1.00),Strategic Speed Shows How to Execute Business Strategy Fast and Well (1.00),Clate Mask of Infusionsoft: $54M Ways Your Small Business Can Benefit (1.00)
527,Infusionsoft Announces Mobile Payments and More at ICON15,How I increased my productivity 1.5x by experimenting with my work schedule (1.01),Our Top Story This Week: A New SBA Administrator is Approved (1.01),Print Photos From Your Phone with the Prynt Smartphone Case (1.01),"Yahoo Unveils News Digest, Digital Magazines But Without Clear Niche (1.01)",Adobe Acquires Fotolia for $800 Million (1.00),"Busted: Hotels.com Caught Buying Links, Apology is Weak (1.00)",BotBeat: This weeks top botstories (1.00),"RGB, CMYK and PMS Colors Explained (1.00)",Cicret Could Turn Your Skin Into a Smartphone Display (1.00),How Do Consumers Buy Online? (1.00)
528,Present Shock: Taking A Moment to Review the Future,SMB Owners Get Mobile Coupons For The Holidays (1.01),5 Points to Remember About Mobile SEO (1.01),Google Releases Real-Time Reputation Problem (1.01),The ultimate master list of revenue models used by Web and Mobile companies (1.01),"Google Adds New Features to Place Pages, Is It Enough? (1.01)",How to Promote Offline Events On The Web (1.01),The 2012 Local Search Ranking Factors Report Is In (1.01),"Google Databoard Lets You View Research, Create Infographics (1.01)",10 Reasons to Be Optimistic Looking Forward (1.01),Bing Gives Twitter Results Including Hashtags and Handles (1.01)
529,Spotlight: Studypool Provides Fast Online Homework Help,Headlining the News This Week: Wix Acquires OpenRest (1.02),Vine: Now You Can Send Video Messages Directly to Friends and Colleagues (1.01),Pinterest Contemplates Sponsored Pins (1.01),Awaken Your Productivity With Fearless At Work (1.01),9 Holiday Marketing Tips to Make Your Retail Store Stand Out (1.01),Save the Date for a Twitter Chat: Demystifying Data Backup (1.01),Google Improves AdWords Express Program (1.01),The Psychology of Color in Marketing (1.01),6 Things Customers Want from Retail Stores and How You Can Deliver (1.01),"Court Reverses $338,000 Award for User Generated Content (1.00)"
530,"Who Is Visiting our Site, Why, And What We Do About It",Tipping the Odds for the Entrepreneur (1.00),5 Points to Remember About Mobile SEO (1.00),How to Create a LinkedIn Profile That Rocks At Generating Leads (1.00),Marketing With Vine: Leveraging the Power of 6-Second Videos (1.00),"Google Adds New Features to Place Pages, Is It Enough? (1.00)",How to Promote Offline Events On The Web (1.00),45+ Tools for Content Curation and Content Marketing (1.00),You Should Consider These Things When Choosing Who To Follow On Twitter (1.00),Awaken Your Productivity With Fearless At Work (1.00),"Facebook, Yelp Follow FourSquare, Launch Deals (1.00)"
531,Be.Lead.Do Provides Online Resource for Business Managers,A 30 Point Checklist for Your Startup (1.01),What Is HTML5? Do I Need It For My Business Website? (1.00),Facebook Wants Your Businesses On Messenger (1.00),Receive Custom Social Content for Your Small Business With Emphatic (1.00),Manta Business Directory Upgrades to Help You Get Discovered (1.00),5 Small Business Social Media Mistakes (1.00),Twitter Chat: Is Your Brand Helping Or Hurting Your Business? (1.00),LinkedIn Introduces Showcase Pages for Business (1.00),Government Resources to Help Market Your Business Overseas (1.00),Google Makes Business Photos Self-Service (1.00)
532,"Yahoo Unveils News Digest, Digital Magazines But Without Clear Niche",BotBeat: This weeks top botstories (1.01),"RGB, CMYK and PMS Colors Explained (1.01)",How I increased my productivity 1.5x by experimenting with my work schedule (1.01),Our Top Story This Week: A New SBA Administrator is Approved (1.01),Print Photos From Your Phone with the Prynt Smartphone Case (1.01),Speed Up Your Mobile Browsing with Dolphin (1.01),10 Mindsets of Successful Entrepreneurs (1.01),This African Entrepreneur Creates 3-D Printers Out of E-Waste (1.01),Infusionsoft Announces Mobile Payments and More at ICON15 (1.01),Presentations: How to Make Your Message Stick (1.01)
533,Managing Different Generations in the Workplace,Looking for Blog Topics? @TheSalesLion Has a Few [BlogWorld Coverage] (1.00),How To Keep Customers Loyal With Coupons (1.00),Loni Stark of Adobe: Digital Marketing Solutions in the Cloud (1.00),7 Missing Elements of Your Content Strategy (1.00),Little Known Brand Monitoring Search Tricks (1.00),Yelp Reviews Out of Google Places. What Else Ya Got? (1.00),Top 5 Online Credibility Killers (1.00),Is Your Online Marketing Strategy Up to Date? (1.00),Watch These Metrics to Measure YouTube Marketing Success (1.00),Shocker: People Do Not Read What They Share on Social Media (1.00)
534,"HP Did Better Than The Market on PC Sales, But Mum About Mobile",How I increased my productivity 1.5x by experimenting with my work schedule (1.01),Adobe Acquires Fotolia for $800 Million (1.00),Days Are Numbered for the LG Google Nexus 5 (1.00),BotBeat: This weeks top botstories (1.00),Cicret Could Turn Your Skin Into a Smartphone Display (1.00),How Do Consumers Buy Online? (1.00),CorpNet Adds Free Meeting Minutes and Corporate Document Templates (1.00),QuickBooks Replacement Intacct Raises Money to Penetrate SMB Market (1.00),Do Your Customers Look Forward to Seeing You? (1.00),ReTargeter Creator Aims to Replace CRM with New Immediately App (1.00)
535,Top Small Business News This Week: May 17,10 Apps to Assist with Your Small Business Taxes (1.00),How the Cloud is Reshaping Small Business Productivity (1.00),Satanic Latte Art? How Should a Business Respond? (1.00),Small Business Disaster Survival Guide: Get Your Insurance Claims Covered (1.00),Small Business Leads To Better Economy (1.00),Top Reasons to Incorporate Your Business (1.00),How to Reinstate a Non-Compliant Business Before the End of the Year (1.00),6 eCommerce Customer Service Benchmarks for Your Business (1.00),Reward your Small Business with the Capital One Spark (1.00),The Island Approach: Which Are the Best Credit Cards for Small Business? (1.00)
536,"21 Year Old Solves Own Acne Problem, Builds Business",Satanic Latte Art? How Should a Business Respond? (1.01),"Fortune 500 Thrives, But Small Businesses Not So Optimistic (1.00)",10 Apps to Assist with Your Small Business Taxes (1.00),The Secret to Achieving Resolutions:  Setting Small Goals (1.00),How the Cloud is Reshaping Small Business Productivity (1.00),How Much Will the Sequester Cost Small Business Contractors? (1.00),Small Business Disaster Survival Guide: Get Your Insurance Claims Covered (1.00),Small Business Leads To Better Economy (1.00),Top Reasons to Incorporate Your Business (1.00),Getting Your Business Energy Efficient Before the Holidays (1.00)
537,11 things to do in your 20s to become a millionaire by 30,Amazon AWS MarketPlace Puts Desktop Apps in the Cloud (1.01),"India orders four maritime spy planes from Boeing, bolsters navy (1.00)","Up close & personal: How Sunny Leone handles stocks, land, gold, other assets (1.00)",The 10 most luxurious first-class plane cabins in the world (1.00),Earnings This Week (1.00),Here comes the Beige Book ... (1.00),"Reliance Jio is yet to be launched, but is already breaking rules (1.00)",Study: 16 Percent of Yelp Reviews May Be Fakes (1.00),Kid Inventors Come Up With Creative Environmental Solutions (1.00),Microsoft Temporarily Cuts the Price on the Surface 2 (1.00)
538,Planning a Summer Move: Move Your Corporation From One State to Another,European shares lifted by solid earnings but RBS slumps (1.00),STOCKS RALLY: Here's what you need to know (1.00),How millions from the Bangladesh Bank heist disappeared (1.00),Here come retail sales ... (1.00),The 10 most important things in the world right now (1.00),Here comes the Baker Hughes rig count ... (1.00),Daily Sprout (1.00),Putin and Erdogan move towards repairing Russia-Turkey ties (1.00),"What to buy, sell and hold (1.00)",Keurig CEO Regrets Big Mistake Made with the 2.0 Brewer (1.00)
539,New LG Smartphone Added to the G3 Line Has a Stylus Pen,Do You Trust Your Employees to Work Remotely? (1.01),ZenPayroll Could Change the Way You Pay (1.00),"Nexus 6 Could Compete with iPhone 6 Plus, Other Phablets (1.00)","Citysearch: Product Manager, LA (1.00)","Community Connect: Product Strategist, NYC (1.00)",CorpNet Adds Free Meeting Minutes and Corporate Document Templates (1.00),When I had no food and only Rs 50 in my pocket  a moving story of an entrepreneur (1.00),Weighing the Pros and Cons of Free City WiFi (1.00),Join Me For: Choosing the RIGHT Online Software (1.00),MSFT-YHOO: Links To Coverage Across Our Sites (1.00)
540,Rs 1 Cr sales in four months  how a software engineer is giving Mandyas debt-ridden farmers a new lease of life,Microsoft Temporarily Cuts the Price on the Surface 2 (1.00),Who Has the Better Job: Software Developer or Architect? (1.00),Seven important triggers that changed your market while you were sleeping (1.00),"SBA Fund Adds Manufacturing, Lifts $200 Million Limit (1.00)",Amazon AWS MarketPlace Puts Desktop Apps in the Cloud (1.00),Lodha says it sold Rs 150-160 cr new property in last 10 days (1.00),"Xero Sees 200 Percent Increase in U.S. Customers, Adds New Leadership (1.00)","Time Warner takes stake in Hulu, lifts profit forecast (1.00)",Earnings Announcements This Week (1.00),Crowdfunders: PayPal Will No Longer Freeze Your Funds (1.00)
541,Amazon Launches a Phone! Fire Has a Scan and Buy Feature,Do You Trust Your Employees to Work Remotely? (1.01),Sauca Foods:  New Flair for the Food Truck Trend (1.00),ZenPayroll Could Change the Way You Pay (1.00),"Nexus 6 Could Compete with iPhone 6 Plus, Other Phablets (1.00)","Citysearch: Product Manager, LA (1.00)",Googles Russian Ad Buy Blocked On Technicality; Putins Spanner In The Works? (1.00),Here's A Brand New Thing You Didn't Know About 'Friends' (1.00),When I had no food and only Rs 50 in my pocket  a moving story of an entrepreneur (1.00),Entrepreneur Gary Vaynerchuk: From Personal Brand to VC Investor (1.00),Weighing the Pros and Cons of Free City WiFi (1.00)
542,"Hotpot Loses Identity, Gets Merged Into Places",Time is Money: Are You and Your Employees Effectively Managing It? (1.01),"Bright Light Helps Market Products, But Makes Decisions More Emotional (1.00)",How to Get Your Products Discovered with Videos (1.00),Ten Approaches That May Shape the Future of eCommerce (1.00),"Google Announces Web Designer, Enhancements to DoubleClick (1.00)",Twitter Ads API Gives You More Advertising Options (1.00),Why You Need Honest Feedback and 3 Ways to Get It (1.00),The New Picture HTML Code Could Make Your Website Load Faster (1.00),"Google Updates Listings, Crowdfunding Campaigns Extended (1.00)",HubSpot Adds Sales Platform and Free CRM to Its Marketing System (1.00)
543,Entrepreneur Cleans Up With Handmade Product Businesses,Small Business Product Launches and Shut Downs (1.00),Improving Your Community Can Improve Your Business (1.00),Catch Up With Our Latest Small Business News Recap (1.00),Small Business News: Week in Review for July 7 (1.00),Oakland Program Helps Underprivileged Youth Start Businesses (1.00),How to Turn Your Hobby Into a Business (1.00),Join The Crowdfunding Revolution to Start Your Business (1.00),Small Business Startup: Where To Begin (1.00),6 eCommerce Customer Service Benchmarks for Your Business (1.00),"Small Business Book Awards: Nominate Through March 3, 2013 (1.00)"
544,The First Consumer 3D Printer Is Now In Crowdfunding,Do You Trust Your Employees to Work Remotely? (1.00),"Nexus 6 Could Compete with iPhone 6 Plus, Other Phablets (1.00)",Googles Russian Ad Buy Blocked On Technicality; Putins Spanner In The Works? (1.00),Here's A Brand New Thing You Didn't Know About 'Friends' (1.00),Entrepreneur Gary Vaynerchuk: From Personal Brand to VC Investor (1.00),Weighing the Pros and Cons of Free City WiFi (1.00),Lenovo A7000 Phablet Offers Super Sound and Little Interference (1.00),Join Me For: Choosing the RIGHT Online Software (1.00),Franchising And Politics (1.00),"Mashable Raises $13 Million, Its First Ever Outside Investment (1.00)"
